year,quarter,monthsigned,market,building_name,building_id,address,region,city,state,zip,internal_submarket,internal_class,leasedSF,company_name,internal_industry,transaction_type,internal_market_cluster,costarID,space_type,CBD_suburban,RBA,available_space,availability_proportion,internal_class_rent,overall_rent,direct_available_space,direct_availability_proportion,direct_internal_class_rent,direct_overall_rent,sublet_available_space,sublet_availability_proportion,sublet_internal_class_rent,sublet_overall_rent,leasing,year-quarter,company_size,industry_size
2018,Q2,4.0,Denver,Kellogg Office Building,Denver_Southwest_Littleton_Kellogg Office Building_26 W Dry Creek Cir,26 W Dry Creek Cir,Midwest/Central,Littleton,CO,80120.0,Southwest,O,5734.0,BB&T,Financial Services and Insurance,New,,393185,Relet,Suburban,,,,,,,,,,,,,,,2018-Q2,Small,Financial_Services_and_Insurance_Small
2018,Q2,4.0,Detroit,Columbia Center II,Detroit_Troy South_Troy_Columbia Center II_101 W Big Beaver Rd,101 W Big Beaver Rd,Midwest/Central,Troy,MI,48084.0,Troy South,A,2742.0,Transamerica Premier Life Insurance,Financial Services and Insurance,TBD,Suburban Detroit,460377,,Suburban,34423167.0,6472413.0,0.188024913570561,21.3336500243945,18.8803566539298,,,,,,,,,345698.0,2018-Q2,Small,Financial_Services_and_Insurance_Small
2018,Q2,4.0,Houston,Saturn One,Houston_Nasa/Clear Lake_Houston_Saturn One_18050 Saturn Ln,18050 Saturn Ln,South,Houston,TX,77058.0,Nasa/Clear Lake,A,9077.0,Maxim Group,Financial Services and Insurance,Renewal,,6320386,,Suburban,114154896.0,32526877.0,0.284936328968317,33.563960419687,28.5165015124504,,,,,,,,,1991765.0,2018-Q2,Small,Financial_Services_and_Insurance_Small
2018,Q2,4.0,Manhattan,1045 Avenue of the Americas,Manhattan_Penn Plaza/Times Square South_New York_1045 Avenue of the Americas_7 Bryant Park,7 Bryant Park,Northeast,New York,NY,10018.0,Penn Plaza/Times Square South,A,9750.0,Venrock,Financial Services and Insurance,New,Midtown,8144255,Relet,CBD,244192517.0,29535879.0,0.120953251814838,82.0331156463172,73.9042202835504,,,,,,,,,6703076.0,2018-Q2,Small,Financial_Services_and_Insurance_Small
2018,Q2,4.0,Manhattan,16 E 60th St,Manhattan_Plaza North_New York_16 E 60th St_650 Madison Ave,650 Madison Ave,Northeast,New York,NY,10022.0,Plaza North,A,6168.0,Wp Global Partners,Financial Services and Insurance,Renewal,Midtown,157299,,CBD,244192517.0,29535879.0,0.120953251814838,82.0331156463172,73.9042202835504,,,,,,,,,6703076.0,2018-Q2,Small,Financial_Services_and_Insurance_Small
2018,Q2,4.0,Manhattan,17 State Street,Manhattan_Financial District_New York_17 State Street_17 State St,17 State St,Northeast,New York,NY,10004.0,Financial District,A,6181.0,Am Re,Financial Services and Insurance,,Downtown,157109,Relet,CBD,244192517.0,29535879.0,0.120953251814838,82.0331156463172,73.9042202835504,,,,,,,,,6703076.0,2018-Q2,Small,Financial_Services_and_Insurance_Small
2018,Q2,4.0,Manhattan,17 State Street,Manhattan_Financial District_New York_17 State Street_17 State St,17 State St,Northeast,New York,NY,10004.0,Financial District,A,5213.0,Think Equities,Financial Services and Insurance,,Downtown,157109,Relet,CBD,244192517.0,29535879.0,0.120953251814838,82.0331156463172,73.9042202835504,,,,,,,,,6703076.0,2018-Q2,Small,Financial_Services_and_Insurance_Small
2018,Q2,4.0,Manhattan,28 Liberty,Manhattan_Financial District_New York_28 Liberty_28 Liberty St,28 Liberty St,Northeast,New York,NY,10005.0,Financial District,A,8062.0,Euroclear Bank,Financial Services and Insurance,New,Downtown,157030,Relet,CBD,244192517.0,29535879.0,0.120953251814838,82.0331156463172,73.9042202835504,,,,,,,,,6703076.0,2018-Q2,Small,Financial_Services_and_Insurance_Small
2018,Q2,4.0,Manhattan,2937 E 51st St,Manhattan_Plaza South_New York_2937 E 51st St_477 Madison Ave,477 Madison Ave,Northeast,New York,NY,10022.0,Plaza South,O,5800.0,Fagenson & Co,Financial Services and Insurance,Renewal,Midtown,157376,,CBD,199870492.0,20756796.0,0.103851227824065,62.1751199680751,73.9042202835504,,,,,,,,,4324015.0,2018-Q2,Small,Financial_Services_and_Insurance_Small
2018,Q2,4.0,Manhattan,3143 E 49th St,Manhattan_Plaza South_New York_3143 E 49th St_437 Madison Ave,437 Madison Ave,Northeast,New York,NY,10022.0,Plaza South,A,7779.0,Landmark Partners,Financial Services and Insurance,Renewal and Expansion,Midtown,157135,Relet,CBD,244192517.0,29535879.0,0.120953251814838,82.0331156463172,73.9042202835504,,,,,,,,,6703076.0,2018-Q2,Small,Financial_Services_and_Insurance_Small
2018,Q2,4.0,Manhattan,412 W 15th St,Manhattan_Chelsea_New York_412 W 15th St_412 W 15th St,412 W 15th St,Northeast,New York,NY,10011.0,Chelsea,A,6092.0,Copenhagen Infrastructure Partners,Financial Services and Insurance,,Midtown South,9566321,Relet,CBD,244192517.0,29535879.0,0.120953251814838,82.0331156463172,73.9042202835504,,,,,,,,,6703076.0,2018-Q2,Small,Financial_Services_and_Insurance_Small
2018,Q2,4.0,Manhattan,875 Third Ave,Manhattan_East Side / UN_New York_875 Third Ave_875 Third Ave,875 Third Ave,Northeast,New York,NY,10022.0,East Side / UN,A,4377.0,Aetos Capital,Financial Services and Insurance,Relocation,Midtown,157277,Relet,CBD,244192517.0,29535879.0,0.120953251814838,82.0331156463172,73.9042202835504,,,,,,,,,6703076.0,2018-Q2,Small,Financial_Services_and_Insurance_Small
2018,Q2,4.0,Nashville,,Nashville_Airport South_Nashville_NA_176 Thompson Ln,176 Thompson Ln,South,Nashville,TN,37211.0,Airport South,O,536.0,Farmers Insurance,Financial Services and Insurance,TBD,Airport,810783,,Suburban,22248695.0,2245696.0,0.100936077374426,24.7363156987456,27.9041462312128,,,,,,,,,238435.0,2018-Q2,Small,Financial_Services_and_Insurance_Small
2018,Q2,4.0,Northern Virginia,The Mason,Northern Virginia_Old Town Alexandria_Alexandria_The Mason_1700 Diagonal Rd,1700 Diagonal Rd,Northeast,Alexandria,VA,22314.0,Old Town Alexandria,A,1285.0,Edward Jones,Financial Services and Insurance,New,Alexandria,137650,Relet,Suburban,98610960.0,21315720.0,0.216159745326483,34.4448668610663,32.3010111130319,,,,,,,,,2188728.0,2018-Q2,Small,Financial_Services_and_Insurance_Small
2018,Q2,4.0,Philadelphia,,Philadelphia_Newtown_Newtown_NA_12 Terry Dr,12 Terry Dr,Northeast,Newtown,PA,18940.0,Newtown,O,2068.0,Amwins,Financial Services and Insurance,Renewal,,618104,,Suburban,45525612.0,8302868.0,0.182377954633537,25.5278958417526,28.0206610320801,,,,,,,,,510848.0,2018-Q2,Small,Financial_Services_and_Insurance_Small
2018,Q2,4.0,Phoenix,Southwest Business Center,Phoenix_Tempe_Tempe_Southwest Business Center_4500 S Lakeshore Dr,4500 S Lakeshore Dr,West,Tempe,AZ,85282.0,Tempe,O,2068.0,Solidarity Healthshare,Financial Services and Insurance,New,East Valley,224635,Relet,Suburban,55548218.0,10343812.0,0.186367234084491,22.8774079230129,26.2318194631733,,,,,,,,,676735.0,2018-Q2,Small,Financial_Services_and_Insurance_Small
2018,Q2,4.0,Phoenix,,Phoenix_Mesa East_Mesa_NA_4435-4455 E Broadway Rd,4435-4455 E Broadway Rd,West,Mesa,AZ,85206.0,Mesa East,O,864.0,Farmers Insurance,Financial Services and Insurance,New,East Valley,226632,Relet,Suburban,55548218.0,10343812.0,0.186367234084491,22.8774079230129,26.2318194631733,,,,,,,,,676735.0,2018-Q2,Small,Financial_Services_and_Insurance_Small
2018,Q2,4.0,San Francisco,475 Sacramento St,San Francisco_Financial District North_San Francisco_475 Sacramento St_275 Battery St,275 Battery St,West,San Francisco,CA,94111.0,Financial District North,A,11225.0,Moelis &,Financial Services and Insurance,New,,320361,Relet,CBD,46050495.0,4027372.0,0.087455563724125,68.9639384422598,66.5293843664807,,,,,,,,,2194536.0,2018-Q2,Small,Financial_Services_and_Insurance_Small
2018,Q2,4.0,South Florida,701 Brickell,South Florida_Brickell_Miami_701 Brickell_701 Brickell Ave,701 Brickell Ave,South,Miami,FL,33131.0,Brickell,A,4368.0,Blackrock,Financial Services and Insurance,New,Miami-Dade County,379520,Relet,CBD,51817856.0,8799234.0,0.169810846670306,37.6773271789521,33.4349320475774,,,,,,,,,669302.0,2018-Q2,Small,Financial_Services_and_Insurance_Small
2018,Q2,4.0,Southern Maryland,,Southern Maryland_Silver Spring / North Silver Spring_Silver Spring_NA_1100 Wayne Ave,1100 Wayne Ave,Northeast,Silver Spring,MD,20910.0,Silver Spring / North Silver Spring,A,2096.0,Toler Financial Group,Financial Services and Insurance,New,,131063,Relet,Suburban,,,,,,,,,,,,,,,2018-Q2,Small,Financial_Services_and_Insurance_Small
2018,Q2,4.0,Tampa,501 East Kennedy,Tampa_Tampa CBD_Tampa_501 East Kennedy_501 E Kennedy Blvd,501 E Kennedy Blvd,South,Tampa,FL,33602.0,Tampa CBD,O,1785.0,Americas Mortgage Professionals,Financial Services and Insurance,New,Hillsborough,112912,Relet,CBD,28107216.0,4545359.0,0.161715020085945,20.848301087507,23.7175468131548,,,,,,,,,510429.0,2018-Q2,Small,Financial_Services_and_Insurance_Small
2018,Q2,4.0,Washington D.C.,,Washington D.C._Central Business District_Washington_NA_1133 Connecticut Ave NW,1133 Connecticut Ave NW,Northeast,Washington,DC,20036.0,Central Business District,A,818.0,The Halifax Group,Financial Services and Insurance,New,,129044,Relet,CBD,,,,,,,,,,,,,,,2018-Q2,Small,Financial_Services_and_Insurance_Small
2018,Q2,5.0,Atlanta,Prominence Tower,Atlanta_Buckhead_Atlanta_Prominence Tower_3475 Piedmont Rd NE,3475 Piedmont Rd NE,South,Atlanta,GA,30305.0,Buckhead,A,5067.0,Citizens Bank,Financial Services and Insurance,New,,444945,Relet,CBD,103299677.0,21402315.0,0.207186659451026,29.2519005754806,26.0678750972516,,,,,,,,,1440017.0,2018-Q2,Small,Financial_Services_and_Insurance_Small
2018,Q2,5.0,Charlotte,Ballantyne One,Charlotte_Ballantyne / Highway 51_Charlotte_Ballantyne One_15720 Brixham Hill Ave,15720 Brixham Hill Ave,South,Charlotte,NC,28277.0,Ballantyne / Highway 51,A,929.0,Northwood Investors,Financial Services and Insurance,New,,479810,Relet,Suburban,37279246.0,6442771.0,0.172824605948307,29.3791009452546,26.8226604382563,,,,,,,,,522574.0,2018-Q2,Small,Financial_Services_and_Insurance_Small
2018,Q2,5.0,Charlotte,Providence Park,Charlotte_East Charlotte_Charlotte_Providence Park_10800 Sikes Pl,10800 Sikes Pl,South,Charlotte,NC,28277.0,East Charlotte,A,1422.0,Alvarado Agencies,Financial Services and Insurance,New,,479838,New,Suburban,37279246.0,6442771.0,0.172824605948307,29.3791009452546,26.8226604382563,,,,,,,,,522574.0,2018-Q2,Small,Financial_Services_and_Insurance_Small
2018,Q2,5.0,Chicago,311 South Wacker,Chicago_West Loop_Chicago_311 South Wacker_311 S Wacker Dr,311 S Wacker Dr,Midwest/Central,Chicago,IL,60606.0,West Loop,A,9011.0,Monroe Capital,Financial Services and Insurance,New,,144280,Relet,CBD,,,,,,,,,,,,,,,2018-Q2,Small,Financial_Services_and_Insurance_Small
2018,Q2,5.0,Chicago Suburbs,Columbia Centre I,Chicago Suburbs_O'Hare Area_Rosemont_Columbia Centre I_5600 N River Rd,5600 N River Rd,Midwest/Central,Rosemont,IL,60018.0,O'Hare Area,O,5254.0,Goosehead Insurance,Financial Services and Insurance,New,,144586,Relet,Suburban,46523263.0,12077233.0,0.259595570499859,19.760039929257,23.50885504696,,,,,,,,,489801.0,2018-Q2,Small,Financial_Services_and_Insurance_Small
2018,Q2,5.0,Dallas/Ft Worth,2929 NCX,Dallas/Ft Worth_Richardson Telecom Corridor_Richardson_2929 NCX_2929 N Central Expy,2929 N Central Expy,South,Richardson,TX,75080.0,Richardson Telecom Corridor,O,3000.0,Farmers Insurance,Financial Services and Insurance,Renewal,,408386,,Suburban,,,,,,,,,,,,,,,2018-Q2,Small,Financial_Services_and_Insurance_Small
2018,Q2,5.0,Dallas/Ft Worth,Park Center,Dallas/Ft Worth_North Dallas Corridor_Plano_Park Center_2400 N Dallas Pky,2400 N Dallas Pky,South,Plano,TX,75093.0,North Dallas Corridor,A,4965.0,First Citizens,Financial Services and Insurance,New,,409217,Sublet,Suburban,,,,,,,,,,,,,,,2018-Q2,Small,Financial_Services_and_Insurance_Small
2018,Q2,5.0,Dallas/Ft Worth,The Crescent Building 200,Dallas/Ft Worth_Uptown_Dallas_The Crescent Building 200_200 Crescent Ct,200 Crescent Ct,South,Dallas,TX,75201.0,Uptown,A,7880.0,Standish Management,Financial Services and Insurance,Renewal,,6411255,Relet,CBD,,,,,,,,,,,,,,,2018-Q2,Small,Financial_Services_and_Insurance_Small
2018,Q2,5.0,Houston,609 Main at Texas,Houston_CBD_Houston_609 Main at Texas_609 Main St,609 Main St,South,Houston,TX,77002.0,CBD,A,3922.0,Blackrock,Financial Services and Insurance,New,,9060830,New,CBD,114154896.0,32526877.0,0.284936328968317,33.563960419687,28.5165015124504,,,,,,,,,1991765.0,2018-Q2,Small,Financial_Services_and_Insurance_Small
2018,Q2,5.0,Los Angeles,Warner Gateway,Los Angeles_West San Fernando Valley_Woodland Hills_Warner Gateway_6200 Canoga Ave,6200 Canoga Ave,West,Woodland Hills,CA,91367.0,West San Fernando Valley,A,6460.0,Senex Group,Financial Services and Insurance,New,San Fernando Valley,248869,,Suburban,144098024.0,25837665.0,0.179306171471165,39.0330756919583,36.5813015155726,,,,,,,,,2418566.0,2018-Q2,Small,Financial_Services_and_Insurance_Small
2018,Q2,5.0,Manhattan,1775 Broadway,Manhattan_Columbus Circle_New York_1775 Broadway_3 Columbus Cir,3 Columbus Cir,Northeast,New York,NY,10019.0,Columbus Circle,A,4407.0,Gotham Partners,Financial Services and Insurance,New,Midtown,157308,Sublet,CBD,244192517.0,29535879.0,0.120953251814838,82.0331156463172,73.9042202835504,,,,,,,,,6703076.0,2018-Q2,Small,Financial_Services_and_Insurance_Small
2018,Q2,5.0,Manhattan,2 Trinity Centre,Manhattan_WTC/Brookfield Place_New York_2 Trinity Centre_115 Broadway,115 Broadway,Northeast,New York,NY,10006.0,WTC/Brookfield Place,O,10828.0,Triad Securities,Financial Services and Insurance,Renewal,Downtown,157454,Relet,CBD,199870492.0,20756796.0,0.103851227824065,62.1751199680751,73.9042202835504,,,,,,,,,4324015.0,2018-Q2,Small,Financial_Services_and_Insurance_Small
2018,Q2,5.0,Manhattan,410 Park Avenue,Manhattan_Plaza North_New York_410 Park Avenue_410 Park Ave,410 Park Ave,Northeast,New York,NY,10022.0,Plaza North,A,10124.0,Yorktown Partners,Financial Services and Insurance,Expansion,Midtown,157475,Relet,CBD,244192517.0,29535879.0,0.120953251814838,82.0331156463172,73.9042202835504,,,,,,,,,6703076.0,2018-Q2,Small,Financial_Services_and_Insurance_Small
2018,Q2,5.0,Manhattan,888 Seventh Avenue,Manhattan_Columbus Circle_New York_888 Seventh Avenue_888 7th Ave,888 7th Ave,Northeast,New York,NY,10106.0,Columbus Circle,A,11500.0,Palestra Capital,Financial Services and Insurance,Relocation,Midtown,157084,Relet,CBD,244192517.0,29535879.0,0.120953251814838,82.0331156463172,73.9042202835504,,,,,,,,,6703076.0,2018-Q2,Small,Financial_Services_and_Insurance_Small
2018,Q2,5.0,Manhattan,Grace Building,Manhattan_Grand Central_New York_Grace Building_1114 Avenue of the Americas,1114 Avenue of the Americas,Northeast,New York,NY,10036.0,Grand Central,A,8014.0,Amp Capital Investors,Financial Services and Insurance,New,Midtown,157053,Relet,CBD,244192517.0,29535879.0,0.120953251814838,82.0331156463172,73.9042202835504,,,,,,,,,6703076.0,2018-Q2,Small,Financial_Services_and_Insurance_Small
2018,Q2,5.0,Manhattan,Lexington Tower,Manhattan_Grand Central_New York_Lexington Tower_369 Lexington Ave,369 Lexington Ave,Northeast,New York,NY,10017.0,Grand Central,O,6183.0,Quantbot Technologies,Financial Services and Insurance,Renewal,Midtown,157285,Relet,CBD,199870492.0,20756796.0,0.103851227824065,62.1751199680751,73.9042202835504,,,,,,,,,4324015.0,2018-Q2,Small,Financial_Services_and_Insurance_Small
2018,Q2,5.0,Manhattan,Pan Ocean Bldg,Manhattan_Plaza North_New York_Pan Ocean Bldg_645 Madison Ave,645 Madison Ave,Northeast,New York,NY,10022.0,Plaza North,A,6864.0,Roc Capital,Financial Services and Insurance,Relocation,Midtown,157443,Relet,CBD,244192517.0,29535879.0,0.120953251814838,82.0331156463172,73.9042202835504,,,,,,,,,6703076.0,2018-Q2,Small,Financial_Services_and_Insurance_Small
2018,Q2,5.0,Manhattan,Park Avenue Tower,Manhattan_Plaza North_New York_Park Avenue Tower_65 E 55th St,65 E 55th St,Northeast,New York,NY,10022.0,Plaza North,A,3531.0,Harvard Management,Financial Services and Insurance,New,Midtown,157175,Relet,CBD,244192517.0,29535879.0,0.120953251814838,82.0331156463172,73.9042202835504,,,,,,,,,6703076.0,2018-Q2,Small,Financial_Services_and_Insurance_Small
2018,Q2,5.0,Manhattan,The Trump Building,Manhattan_Financial District_New York_The Trump Building_40 Wall St,40 Wall St,Northeast,New York,NY,10005.0,Financial District,A,6297.0,Nfp,Financial Services and Insurance,Expansion,Downtown,157026,Relet,CBD,244192517.0,29535879.0,0.120953251814838,82.0331156463172,73.9042202835504,,,,,,,,,6703076.0,2018-Q2,Small,Financial_Services_and_Insurance_Small
2018,Q2,5.0,Manhattan,Times Square Plaza,Manhattan_Times Square_New York_Times Square Plaza_1500 Broadway,1500 Broadway,Northeast,New York,NY,10036.0,Times Square,A,6652.0,"Weber, Gallagher, Simpson",Financial Services and Insurance,New,Midtown,157215,Relet,CBD,244192517.0,29535879.0,0.120953251814838,82.0331156463172,73.9042202835504,,,,,,,,,6703076.0,2018-Q2,Small,Financial_Services_and_Insurance_Small
2018,Q2,5.0,Northern Virginia,Fairfax Square II,Northern Virginia_Tysons Corner_Vienna_Fairfax Square II_8075 Leesburg Pike,8075 Leesburg Pike,Northeast,Vienna,VA,22182.0,Tysons Corner,A,8768.0,Bank Of America,Financial Services and Insurance,New,Fairfax County,136976,Relet,Suburban,98610960.0,21315720.0,0.216159745326483,34.4448668610663,32.3010111130319,,,,,,,,,2188728.0,2018-Q2,Small,Financial_Services_and_Insurance_Small
2018,Q2,5.0,Northern Virginia,One Fair Oaks,Northern Virginia_Fairfax / Oakton / Vienna_Fairfax_One Fair Oaks_4114 Legato Rd,4114 Legato Rd,Northeast,Fairfax,VA,22033.0,Fairfax / Oakton / Vienna,A,5379.0,Loan Depot,Financial Services and Insurance,New,Fairfax County,134909,Relet,Suburban,98610960.0,21315720.0,0.216159745326483,34.4448668610663,32.3010111130319,,,,,,,,,2188728.0,2018-Q2,Small,Financial_Services_and_Insurance_Small
2018,Q2,5.0,San Diego,Plaza 2020,San Diego_Mission Valley_San Diego_Plaza 2020_2020 Camino Del Rio N,2020 Camino Del Rio N,West,San Diego,CA,92108.0,Mission Valley,O,1745.0,Amerifirst Financial,Financial Services and Insurance,New,,391276,Relet,Suburban,33356642.0,4757715.0,0.142631713348124,28.319436365711,32.6707297793116,,,,,,,,,743946.0,2018-Q2,Small,Financial_Services_and_Insurance_Small
2018,Q2,5.0,Seattle,Bellevue Corporate Plaza,Seattle_Bellevue CBD_Bellevue_Bellevue Corporate Plaza_600 108th Ave NE,600 108th Ave NE,West,Bellevue,WA,98004.0,Bellevue CBD,O,6701.0,Massmutual Life Insurance,Financial Services and Insurance,New,,470046,Sublet,CBD,51977566.0,7549304.0,0.145241583647838,27.99768550356,35.245030932464,,,,,,,,,912082.0,2018-Q2,Small,Financial_Services_and_Insurance_Small
2018,Q2,5.0,Southern Maryland,481 North Frederick,Southern Maryland_Gaithersburg / Germantown_Gaithersburg_481 North Frederick_481 N Frederick Ave,481 N Frederick Ave,Northeast,Gaithersburg,MD,20877.0,Gaithersburg / Germantown,O,5711.0,Columbia Bank,Financial Services and Insurance,New,,130825,Relet,Suburban,,,,,,,,,,,,,,,2018-Q2,Small,Financial_Services_and_Insurance_Small
2018,Q2,5.0,Southern Maryland,7450 Wisconsin Ave,Southern Maryland_Bethesda / Chevy Chase_Bethesda_7450 Wisconsin Ave_3 Bethesda Metro Center,3 Bethesda Metro Center,Northeast,Bethesda,MD,20814.0,Bethesda / Chevy Chase,A,3263.0,Ally Bank,Financial Services and Insurance,New,,131095,,Suburban,,,,,,,,,,,,,,,2018-Q2,Small,Financial_Services_and_Insurance_Small
2018,Q2,5.0,Southern Maryland,7501 Wisconsin Avenue,Southern Maryland_Bethesda / Chevy Chase_Bethesda_7501 Wisconsin Avenue_7501 Wisconsin Ave,7501 Wisconsin Ave,Northeast,Bethesda,MD,20814.0,Bethesda / Chevy Chase,A,3000.0,Novak Biddle Venture Partners,Financial Services and Insurance,Renewal,,132020,Relet,Suburban,,,,,,,,,,,,,,,2018-Q2,Small,Financial_Services_and_Insurance_Small
2018,Q2,5.0,Southern Maryland,Montvale Center,Southern Maryland_Gaithersburg / Germantown_Gaithersburg_Montvale Center_18310 Montgomery Village Ave,18310 Montgomery Village Ave,Northeast,Gaithersburg,MD,20879.0,Gaithersburg / Germantown,A,2713.0,Walker Poole Insurance,Financial Services and Insurance,New,,130835,Relet,Suburban,,,,,,,,,,,,,,,2018-Q2,Small,Financial_Services_and_Insurance_Small
2018,Q2,5.0,Washington D.C.,Republic Place,Washington D.C._Central Business District_Washington_Republic Place_1776 I St NW,1776 I St NW,Northeast,Washington,DC,20006.0,Central Business District,A,1919.0,Brevan Howard,Financial Services and Insurance,Renewal,,129069,Relet,CBD,,,,,,,,,,,,,,,2018-Q2,Small,Financial_Services_and_Insurance_Small
2018,Q2,6.0,Manhattan,One Forty Broadway,Manhattan_Financial District_New York_One Forty Broadway_140 Broadway,140 Broadway,Northeast,New York,NY,10005.0,Financial District,A,4049.0,Sabr Group,Financial Services and Insurance,Relocation,Downtown,157049,Relet,CBD,244192517.0,29535879.0,0.120953251814838,82.0331156463172,73.9042202835504,,,,,,,,,6703076.0,2018-Q2,Small,Financial_Services_and_Insurance_Small
2018,Q2,7.0,Manhattan,259265 Pearl St,Manhattan_Financial District_New York_259265 Pearl St_40 Fulton St,40 Fulton St,Northeast,New York,NY,10038.0,Financial District,A,7700.0,Old Republic Construction Program,Financial Services and Insurance,New,Downtown,157286,Relet,CBD,244192517.0,29535879.0,0.120953251814838,82.0331156463172,73.9042202835504,,,,,,,,,6703076.0,2018-Q2,Small,Financial_Services_and_Insurance_Small
2019,Q2,3.0,Atlanta,Ravine Two,Atlanta_Northwest_Kennesaw_Ravine Two_600 TownPark Ln,600 TownPark Ln,South,Kennesaw,GA,30144.0,Northwest,A,2499.0,American Advisors Group,Financial Services and Insurance,New,,436959,Relet,Suburban,103866928.0,20867317.0,0.200904343680984,29.9445463104943,26.9054257174279,18391134.0,0.108,30.525283,27.272135,2476183.0,0.0145,23.278305,22.134262,1532604.0,2019-Q2,Small,Financial_Services_and_Insurance_Small
2019,Q2,3.0,Austin,Lake Pointe Center II,Austin_Southwest_Austin_Lake Pointe Center II_11612 Bee Caves Rd,11612 Bee Caves Rd,South,Austin,TX,78738.0,Southwest,O,2014.0,Edward Jones,Financial Services and Insurance,New,,598169,New,Suburban,27947525.0,3295636.0,0.118729320497142,30.7147950599793,36.2009202973452,2737010.0,0.0413,31.672212,37.50936,558626.0,0.0084,25.506284,30.130918,487384.0,2019-Q2,Small,Financial_Services_and_Insurance_Small
2019,Q2,3.0,Charlotte,Carmel Park II,Charlotte_Ballantyne / Highway 51_Charlotte_Carmel Park II_11121 Carmel Commons Blvd,11121 Carmel Commons Blvd,South,Charlotte,NC,28226.0,Ballantyne / Highway 51,O,10730.0,Quietstream Financial,Financial Services and Insurance,New,,479827,Relet,Suburban,27835480.0,2971476.0,0.106751383486112,23.0988677569748,28.1455057090784,2635641.0,0.0404,23.229555,28.435415,335835.0,0.0051,21.934232,24.477567,147074.0,2019-Q2,Small,Financial_Services_and_Insurance_Small
2019,Q2,3.0,Charlotte,Two Morrocroft Centre,Charlotte_SouthPark_Charlotte_Two Morrocroft Centre_4064 Colony Rd,4064 Colony Rd,South,Charlotte,NC,28211.0,SouthPark,A,5663.0,Janney Montgomery Scott,Financial Services and Insurance,Renewal,,513553,Relet,Suburban,37398747.0,4768532.0,0.127505127377663,31.3941000964255,28.1455057090784,4321826.0,0.0663,31.590407,28.435415,446706.0,0.0068,27.782789,24.477567,2279759.0,2019-Q2,Small,Financial_Services_and_Insurance_Small
2019,Q2,3.0,Chicago,One North Wacker,Chicago_West Loop_Chicago_One North Wacker_1 N Wacker Dr,1 N Wacker Dr,Midwest/Central,Chicago,IL,60606.0,West Loop,A,9121.0,Adams Street Partners,Financial Services and Insurance,Renewal,,146647,Relet,CBD,,,,,,,,,,,,,,,2019-Q2,Small,Financial_Services_and_Insurance_Small
2019,Q2,3.0,Chicago Suburbs,Buffalo Grove Business Park,Chicago Suburbs_North Corridor_Buffalo Grove_Buffalo Grove Business Park_750 W Lake Cook Rd,750 W Lake Cook Rd,Midwest/Central,Buffalo Grove,IL,60089.0,North Corridor,O,570.0,Baril Advisors,Financial Services and Insurance,Renewal,,209650,,Suburban,46402863.0,12329988.0,0.265716104629148,19.7044382306852,23.7702058474828,11496711.0,0.1159,19.945645,24.04943,833277.0,0.0084,14.786079,17.731739,593798.0,2019-Q2,Small,Financial_Services_and_Insurance_Small
2019,Q2,3.0,Dallas/Ft Worth,2515 McKinney,Dallas/Ft Worth_Uptown_Dallas_2515 McKinney_2515 McKinney Ave,2515 McKinney Ave,South,Dallas,TX,75201.0,Uptown,A,1000.0,Newmark Knight Frank,Financial Services and Insurance,Renewal,,409997,,CBD,,,,,,,,,,,,,,,2019-Q2,Small,Financial_Services_and_Insurance_Small
2019,Q2,3.0,Dallas/Ft Worth,Trammell Crow Center,Dallas/Ft Worth_Dallas CBD_Dallas_Trammell Crow Center_2001 Ross Ave,2001 Ross Ave,South,Dallas,TX,75201.0,Dallas CBD,A,6315.0,Invesco,Financial Services and Insurance,New,,409737,Relet,CBD,,,,,,,,,,,,,,,2019-Q2,Small,Financial_Services_and_Insurance_Small
2019,Q2,3.0,Denver,50 FIFTY DTC,Denver_Southeast_Denver_50 FIFTY DTC_5050 S Syracuse St,5050 S Syracuse St,Midwest/Central,Denver,CO,80237.0,Southeast,A,2600.0,Fios Capital,Financial Services and Insurance,New,,9936337,New,Suburban,,,,,,,,,,,,,,,2019-Q2,Small,Financial_Services_and_Insurance_Small
2019,Q2,3.0,Denver,Prentice Point,Denver_Southeast_Greenwood Village_Prentice Point_5299 Dtc Blvd,5299 Dtc Blvd,Midwest/Central,Greenwood Village,CO,80111.0,Southeast,A,4789.0,R-T Specialty,Financial Services and Insurance,New,,393027,,Suburban,,,,,,,,,,,,,,,2019-Q2,Small,Financial_Services_and_Insurance_Small
2019,Q2,3.0,Houston,Bay Plaza,Houston_Nasa/Clear Lake_Webster_Bay Plaza_711 W Bay Area Blvd,711 W Bay Area Blvd,South,Webster,TX,77598.0,Nasa/Clear Lake,O,1610.0,Edward Jones,Financial Services and Insurance,New,,240673,Relet,Suburban,78051358.0,18888576.0,0.242090285900575,20.634460543688,28.435689063275,18073026.0,0.094,20.840033,28.972157,815550.0,0.0042,15.846735,22.974909,1049916.0,2019-Q2,Small,Financial_Services_and_Insurance_Small
2019,Q2,3.0,Philadelphia,Atrium 1,Philadelphia_Burlington County_Mount Laurel_Atrium 1_1000 Atrium Way,1000 Atrium Way,Northeast,Mount Laurel,NJ,8054.0,Burlington County,A,5124.0,Bankers Life,Financial Services and Insurance,New,,244190,Relet,Suburban,85439454.0,14512127.0,0.169852759124608,29.4664384139111,28.0457017660982,12109183.0,0.0926,30.100849,28.329098,2402944.0,0.0184,25.443865,24.242128,1574637.0,2019-Q2,Small,Financial_Services_and_Insurance_Small
