year,quarter,monthsigned,market,building_name,building_id,address,region,city,state,zip,internal_submarket,internal_class,leasedSF,company_name,internal_industry,transaction_type,internal_market_cluster,costarID,space_type,CBD_suburban,RBA,available_space,availability_proportion,internal_class_rent,overall_rent,direct_available_space,direct_availability_proportion,direct_internal_class_rent,direct_overall_rent,sublet_available_space,sublet_availability_proportion,sublet_internal_class_rent,sublet_overall_rent,leasing,year-quarter,company_size,industry_size
2024,Q3,7.0,Chicago,West Wacker 333,Chicago_West Loop_Chicago_West Wacker 333_333 W Wacker Dr,333 W Wacker Dr,Midwest/Central,Chicago,IL,60606.0,West Loop,A,9260.0,Chapter 4 Capital,Financial Services and Insurance,TBD,,1583,Relet,CBD,,,,,,,,,,,,,,,2024-Q3,Small,Financial_Services_and_Insurance_Small
2024,Q3,7.0,Chicago,,Chicago_River North_Chicago_NA_325 W Huron St,325 W Huron St,Midwest/Central,Chicago,IL,60654.0,River North,O,4750.0,Rockitcoin,Financial Services and Insurance,Renewal,,144595,Relet,CBD,,,,,,,,,,,,,,,2024-Q3,Small,Financial_Services_and_Insurance_Small
2024,Q3,7.0,Denver,Deer Creek Technology Center,Denver_Southwest_Littleton_Deer Creek Technology Center_10822 W Toller Dr,10822 W Toller Dr,Midwest/Central,Littleton,CO,80127.0,Southwest,O,2000.0,Buttonwood Due Diligence,Financial Services and Insurance,Renewal,,399444,Relet,Suburban,,,,,,,,,,,,,,,2024-Q3,Small,Financial_Services_and_Insurance_Small
2024,Q3,7.0,Denver,Panorama Falls Condos,Denver_Southeast_Centennial_Panorama Falls Condos_9085 E Mineral Cir,9085 E Mineral Cir,Midwest/Central,Centennial,CO,80112.0,Southeast,O,1000.0,Denco Consultants,Financial Services and Insurance,New,,18862,Relet,Suburban,,,,,,,,,,,,,,,2024-Q3,Small,Financial_Services_and_Insurance_Small
2024,Q3,7.0,Denver,Plaza 300,Denver_Southwest_Highlands Ranch_Plaza 300_300 Plaza Dr,300 Plaza Dr,Midwest/Central,Highlands Ranch,CO,80129.0,Southwest,O,6265.0,Debit Technologies,Financial Services and Insurance,Renewal,,393927,Relet,Suburban,,,,,,,,,,,,,,,2024-Q3,Small,Financial_Services_and_Insurance_Small
2024,Q3,7.0,Denver,Plaza 300,Denver_Southwest_Highlands Ranch_Plaza 300_300 Plaza Dr,300 Plaza Dr,Midwest/Central,Highlands Ranch,CO,80129.0,Southwest,O,1370.0,Edward Jones,Financial Services and Insurance,Renewal,,393927,Relet,Suburban,,,,,,,,,,,,,,,2024-Q3,Small,Financial_Services_and_Insurance_Small
2024,Q3,7.0,Detroit,Troy Place,Detroit_Troy South_Troy_Troy Place_3221 W Big Beaver Rd,3221 W Big Beaver Rd,Midwest/Central,Troy,MI,48084.0,Troy South,O,10949.0,Lit Financial,Financial Services and Insurance,TBD,Suburban Detroit,455773,Relet,Suburban,48274462.0,11573004.0,0.239733464041505,19.9592768036846,21.6385459522153,10396553.0,0.1224,20.294146,21.992432,1176451.0,0.0138,16.364146,17.464776,532404.0,2024-Q3,Small,Financial_Services_and_Insurance_Small
2024,Q3,7.0,Los Angeles,Agoura Gateway,Los Angeles_West San Fernando Valley_Agoura Hills_Agoura Gateway_28632 Roadside Dr,28632 Roadside Dr,West,Agoura Hills,CA,91301.0,West San Fernando Valley,O,3178.0,Grant & Weber,Financial Services and Insurance,Renewal,San Fernando Valley,656944,Relet,Suburban,70973458.0,18490079.0,0.260521038724082,41.1596724093086,46.8546568289022,15679818.0,0.0719,41.931004,48.705689,2810261.0,0.0129,36.858983,38.344446,1239955.0,2024-Q3,Small,Financial_Services_and_Insurance_Small
2024,Q3,7.0,Los Angeles,Corsa Professional Plaza,Los Angeles_West San Fernando Valley_Westlake Village_Corsa Professional Plaza_5716 Corsa Ave,5716 Corsa Ave,West,Westlake Village,CA,91362.0,West San Fernando Valley,O,250.0,Allstate,Financial Services and Insurance,New,San Fernando Valley,254231,Relet,Suburban,70973458.0,18490079.0,0.260521038724082,41.1596724093086,46.8546568289022,15679818.0,0.0719,41.931004,48.705689,2810261.0,0.0129,36.858983,38.344446,1239955.0,2024-Q3,Small,Financial_Services_and_Insurance_Small
2024,Q3,7.0,Los Angeles,Farmers Plaza,Los Angeles_West San Fernando Valley_Woodland Hills_Farmers Plaza_6303 Owensmouth Ave,6303 Owensmouth Ave,West,Woodland Hills,CA,91367.0,West San Fernando Valley,A,500.0,Wellington Partners Insurance Services,Financial Services and Insurance,New,San Fernando Valley,362386,Relet,Suburban,146975428.0,43221217.0,0.294071040228575,49.2853585835328,46.8546568289022,34993305.0,0.1606,51.732574,48.705689,8227912.0,0.0378,38.851934,38.344446,2572570.0,2024-Q3,Small,Financial_Services_and_Insurance_Small
2024,Q3,7.0,Manhattan,100110 32nd St,Manhattan_Park Avenue South_New York_100110 32nd St_475 Park Ave S,475 Park Ave S,Northeast,New York,NY,10016.0,Park Avenue South,O,6305.0,Christopher Street Financial,Financial Services and Insurance,Renewal,Midtown South,157188,Relet,CBD,198553779.0,39959005.0,0.201250286956261,61.65304255607,75.9093678931504,33133297.0,0.0711,64.788593,80.836168,6825708.0,0.0146,45.467794,57.972647,3818375.0,2024-Q3,Small,Financial_Services_and_Insurance_Small
2024,Q3,7.0,Manhattan,13411357 Sixth Ave,Manhattan_Columbus Circle_New York_13411357 Sixth Ave_1345 Avenue of the Americas,1345 Avenue of the Americas,Northeast,New York,NY,10105.0,Columbus Circle,A,8992.0,Indivia Capital Management,Financial Services and Insurance,New,Midtown,157055,Sublet,CBD,267569157.0,51717931.0,0.193288088880887,85.4876840476282,75.9093678931504,38788015.0,0.0832,92.898646,80.836168,12929916.0,0.0277,63.399877,57.972647,5697897.0,2024-Q3,Small,Financial_Services_and_Insurance_Small
2024,Q3,7.0,Manhattan,2 Astor Pl,Manhattan_Greenwich Village_New York_2 Astor Pl_740 Broadway,740 Broadway,Northeast,New York,NY,10003.0,Greenwich Village,O,6032.0,Exbo Group,Financial Services and Insurance,Relocation,Midtown South,158163,Relet,CBD,198553779.0,39959005.0,0.201250286956261,61.65304255607,75.9093678931504,33133297.0,0.0711,64.788593,80.836168,6825708.0,0.0146,45.467794,57.972647,3818375.0,2024-Q3,Small,Financial_Services_and_Insurance_Small
2024,Q3,7.0,Manhattan,23 Pine St,Manhattan_Financial District_New York_23 Pine St_30 Wall St,30 Wall St,Northeast,New York,NY,10005.0,Financial District,O,10887.0,Capstone Executive Offices,Financial Services and Insurance,New,Downtown,158050,Relet,CBD,198553779.0,39959005.0,0.201250286956261,61.65304255607,75.9093678931504,33133297.0,0.0711,64.788593,80.836168,6825708.0,0.0146,45.467794,57.972647,3818375.0,2024-Q3,Small,Financial_Services_and_Insurance_Small
2024,Q3,7.0,Manhattan,267 W 54th St,Manhattan_Columbus Circle_New York_267 W 54th St_250 W 55th St,250 W 55th St,Northeast,New York,NY,10019.0,Columbus Circle,A,9723.0,Aperture Investors,Financial Services and Insurance,Relocation,Midtown,6324221,New,CBD,267569157.0,51717931.0,0.193288088880887,85.4876840476282,75.9093678931504,38788015.0,0.0832,92.898646,80.836168,12929916.0,0.0277,63.399877,57.972647,5697897.0,2024-Q3,Small,Financial_Services_and_Insurance_Small
2024,Q3,7.0,Manhattan,316330 Madison Ave,Manhattan_Grand Central_New York_316330 Madison Ave_330 Madison Ave,330 Madison Ave,Northeast,New York,NY,10017.0,Grand Central,A,6911.0,Twg Global Holdings,Financial Services and Insurance,New,Midtown,157151,Relet,CBD,267569157.0,51717931.0,0.193288088880887,85.4876840476282,75.9093678931504,38788015.0,0.0832,92.898646,80.836168,12929916.0,0.0277,63.399877,57.972647,5697897.0,2024-Q3,Small,Financial_Services_and_Insurance_Small
2024,Q3,7.0,Manhattan,553561 Fifth Ave,Manhattan_Grand Central_New York_553561 Fifth Ave_555 Fifth Ave,555 Fifth Ave,Northeast,New York,NY,10017.0,Grand Central,O,6031.0,Maritime Capital,Financial Services and Insurance,Renewal,Midtown,157549,Relet,CBD,198553779.0,39959005.0,0.201250286956261,61.65304255607,75.9093678931504,33133297.0,0.0711,64.788593,80.836168,6825708.0,0.0146,45.467794,57.972647,3818375.0,2024-Q3,Small,Financial_Services_and_Insurance_Small
2024,Q3,7.0,Manhattan,5759 W 53rd St,Manhattan_Plaza South_New York_5759 W 53rd St_1330 Avenue of the Americas,1330 Avenue of the Americas,Northeast,New York,NY,10019.0,Plaza South,A,8656.0,William Hood &,Financial Services and Insurance,New,Midtown,157131,Sublet,CBD,267569157.0,51717931.0,0.193288088880887,85.4876840476282,75.9093678931504,38788015.0,0.0832,92.898646,80.836168,12929916.0,0.0277,63.399877,57.972647,5697897.0,2024-Q3,Small,Financial_Services_and_Insurance_Small
2024,Q3,7.0,Manhattan,675 3rd Ave,Manhattan_Grand Central_New York_675 3rd Ave_675 Third Ave,675 Third Ave,Northeast,New York,NY,10017.0,Grand Central,A,10279.0,National Life Insurance,Financial Services and Insurance,Renewal,Midtown,157236,Relet,CBD,267569157.0,51717931.0,0.193288088880887,85.4876840476282,75.9093678931504,38788015.0,0.0832,92.898646,80.836168,12929916.0,0.0277,63.399877,57.972647,5697897.0,2024-Q3,Small,Financial_Services_and_Insurance_Small
2024,Q3,7.0,Manhattan,ColgatePalmolive Bldg,Manhattan_Plaza South_New York_ColgatePalmolive Bldg_300 Park Ave,300 Park Ave,Northeast,New York,NY,10022.0,Plaza South,A,6729.0,Taula Capital,Financial Services and Insurance,New,Midtown,157344,Relet,CBD,267569157.0,51717931.0,0.193288088880887,85.4876840476282,75.9093678931504,38788015.0,0.0832,92.898646,80.836168,12929916.0,0.0277,63.399877,57.972647,5697897.0,2024-Q3,Small,Financial_Services_and_Insurance_Small
2024,Q3,7.0,Manhattan,Rockefeller Center,Manhattan_Plaza South_New York_Rockefeller Center_1270 Avenue of the Americas,1270 Avenue of the Americas,Northeast,New York,NY,10020.0,Plaza South,A,3652.0,Pitcairn Trust,Financial Services and Insurance,New,Midtown,52858,Relet,CBD,267569157.0,51717931.0,0.193288088880887,85.4876840476282,75.9093678931504,38788015.0,0.0832,92.898646,80.836168,12929916.0,0.0277,63.399877,57.972647,5697897.0,2024-Q3,Small,Financial_Services_and_Insurance_Small
2024,Q3,7.0,Manhattan,Simon  Schuster Bldg,Manhattan_Plaza South_New York_Simon  Schuster Bldg_1230 Avenue of the Americas,1230 Avenue of the Americas,Northeast,New York,NY,10020.0,Plaza South,A,2000.0,Weiss Asset Management,Financial Services and Insurance,New,Midtown,52969,Relet,CBD,267569157.0,51717931.0,0.193288088880887,85.4876840476282,75.9093678931504,38788015.0,0.0832,92.898646,80.836168,12929916.0,0.0277,63.399877,57.972647,5697897.0,2024-Q3,Small,Financial_Services_and_Insurance_Small
2024,Q3,7.0,Manhattan,The General Motors Building,Manhattan_Plaza North_New York_The General Motors Building_767 Fifth Ave,767 Fifth Ave,Northeast,New York,NY,10153.0,Plaza North,A,7393.0,Arini,Financial Services and Insurance,New,Midtown,2628,Relet,CBD,267569157.0,51717931.0,0.193288088880887,85.4876840476282,75.9093678931504,38788015.0,0.0832,92.898646,80.836168,12929916.0,0.0277,63.399877,57.972647,5697897.0,2024-Q3,Small,Financial_Services_and_Insurance_Small
2024,Q3,7.0,Orange County,Century Centre,Orange County_Airport Area_Irvine_Century Centre_2601 Main St,2601 Main St,West,Irvine,CA,92614.0,Airport Area,A,500.0,The Ibrahim Family Trust,Financial Services and Insurance,New,,280110,,Suburban,,,,,,,,,,,,,,,2024-Q3,Small,Financial_Services_and_Insurance_Small
2024,Q3,7.0,Phoenix,Hayden Professional Park,Phoenix_Scottsdale South_Scottsdale_Hayden Professional Park_3200 N Hayden Rd,3200 N Hayden Rd,West,Scottsdale,AZ,85251.0,Scottsdale South,O,4095.0,Home Protect Usa,Financial Services and Insurance,New,Scottsdale,42013,Relet,Suburban,55520545.0,11827237.0,0.213024511917165,27.5421324927156,30.5173389876834,9327906.0,0.0886,28.064692,31.593573,2499331.0,0.0237,25.543868,26.68151,618098.0,2024-Q3,Small,Financial_Services_and_Insurance_Small
2024,Q3,7.0,Raleigh/Durham,North Raleigh Business Center,Raleigh/Durham_6 Forks Falls of Neuse_Raleigh_North Raleigh Business Center_4030 Wake Forest Rd,4030 Wake Forest Rd,South,Raleigh,NC,27609.0,6 Forks Falls of Neuse,O,800.0,Berkadia,Financial Services and Insurance,New,,68014,Relet,Suburban,,,,,,,,,,,,,,,2024-Q3,Small,Financial_Services_and_Insurance_Small
2024,Q3,7.0,Seattle,Logan Bldg,Seattle_Seattle CBD_Seattle_Logan Bldg_500 Union St,500 Union St,West,Seattle,WA,98101.0,Seattle CBD,O,1446.0,Liberty Ridge Advisors,Financial Services and Insurance,Renewal,,470554,Relet,CBD,52318235.0,13070540.0,0.249827617464542,35.5271752536807,44.2772895897853,10713630.0,0.0871,36.365381,46.271885,2356910.0,0.0192,31.715701,36.338047,588142.0,2024-Q3,Small,Financial_Services_and_Insurance_Small
2024,Q3,7.0,South Bay/San Jose,The Almaden,South Bay/San Jose_Downtown San Jose_San Jose_The Almaden_99 Almaden Blvd,99 Almaden Blvd,West,San Jose,CA,95113.0,Downtown San Jose,O,1856.0,Jtc Americas,Financial Services and Insurance,Renewal,,42588,Relet,CBD,,,,,,,,,,,,,,,2024-Q3,Small,Financial_Services_and_Insurance_Small
2024,Q3,7.0,South Florida,Cornerstone One,South Florida_Sunrise/Plantation_Plantation_Cornerstone One_1200 S Pine Island Rd,1200 S Pine Island Rd,South,Plantation,FL,33324.0,Sunrise/Plantation,A,5400.0,Amerant Bancorp,Financial Services and Insurance,New,Broward County,378951,Sublet,Suburban,55208986.0,11452359.0,0.207436503180841,52.638180370186,45.6168749796374,9837601.0,0.0922,52.608146,45.645608,1614758.0,0.0151,52.992592,45.395623,1405444.0,2024-Q3,Small,Financial_Services_and_Insurance_Small
2024,Q3,7.0,Tampa,Park Place,Tampa_North Pinellas_Clearwater_Park Place_311 Park Place Blvd,311 Park Place Blvd,South,Clearwater,FL,33759.0,North Pinellas,A,3788.0,Edward Jones,Financial Services and Insurance,New,Pinellas,382109,Relet,Suburban,25106444.0,6272033.0,0.249817656375391,33.6312984859457,30.2040414076123,4396567.0,0.0813,34.457689,30.7281,1875466.0,0.0347,25.827943,24.690256,580823.0,2024-Q3,Small,Financial_Services_and_Insurance_Small
2024,Q3,7.0,Washington D.C.,,Washington D.C._Central Business District_Washington_NA_800 Connecticut Ave NW,800 Connecticut Ave NW,Northeast,Washington,DC,20006.0,Central Business District,A,3985.0,Applied Underwriters,Financial Services and Insurance,New,,129842,Relet,CBD,,,,,,,,,,,,,,,2024-Q3,Small,Financial_Services_and_Insurance_Small
2024,Q3,8.0,Atlanta,King,Atlanta_Central Perimeter_Atlanta_King_6 Concourse Pky NE,6 Concourse Pky NE,South,Atlanta,GA,30328.0,Central Perimeter,A,2630.0,Everest,Financial Services and Insurance,New,,113004,Relet,Suburban,113141200.0,40048984.0,0.353973477389315,35.0552203004165,32.5692065343474,33723658.0,0.1905,36.216166,33.704949,6325326.0,0.0357,28.330026,26.181667,1761038.0,2024-Q3,Small,Financial_Services_and_Insurance_Small
2024,Q3,8.0,Atlanta,King,Atlanta_Central Perimeter_Atlanta_King_6 Concourse Pky NE,6 Concourse Pky NE,South,Atlanta,GA,30328.0,Central Perimeter,A,3901.0,Everest,Financial Services and Insurance,New,,113004,Relet,Suburban,113141200.0,40048984.0,0.353973477389315,35.0552203004165,32.5692065343474,33723658.0,0.1905,36.216166,33.704949,6325326.0,0.0357,28.330026,26.181667,1761038.0,2024-Q3,Small,Financial_Services_and_Insurance_Small
2024,Q3,8.0,Atlanta,The Triangle Building,Atlanta_Northwest_Atlanta_The Triangle Building_1775 The Exchange SE,1775 The Exchange SE,South,Atlanta,GA,30339.0,Northwest,O,1893.0,Finance Of America Reverse,Financial Services and Insurance,New,,13065,Sublet,Suburban,63894083.0,14102954.0,0.220723944030936,24.9352769365695,32.5692065343474,11823777.0,0.0668,25.859398,33.704949,2279177.0,0.0129,20.198097,26.181667,422109.0,2024-Q3,Small,Financial_Services_and_Insurance_Small
2024,Q3,8.0,Chicago Suburbs,Washington Commons II,Chicago Suburbs_East-West Corridor_Naperville_Washington Commons II_550-700 E Diehl Rd,550-700 E Diehl Rd,Midwest/Central,Naperville,IL,60563.0,East-West Corridor,O,1729.0,Ameriprise Financial,Financial Services and Insurance,New,,204815,Relet,Suburban,44481807.0,12156242.0,0.273285705322178,22.0696163703652,27.1199277785149,11523622.0,0.119,22.191171,27.516841,632620.0,0.0065,18.992978,19.603286,262808.0,2024-Q3,Small,Financial_Services_and_Insurance_Small
2024,Q3,8.0,Denver,Sheridan Park 8,Denver_Northwest_Westminster_Sheridan Park 8_8670 Wolff Ct,8670 Wolff Ct,Midwest/Central,Westminster,CO,80031.0,Northwest,O,1012.0,Allstate,Financial Services and Insurance,New,,18415,Relet,Suburban,,,,,,,,,,,,,,,2024-Q3,Small,Financial_Services_and_Insurance_Small
2024,Q3,8.0,Detroit,Liberty Center,Detroit_Troy South_Troy_Liberty Center_50 W Big Beaver Rd,50 W Big Beaver Rd,Midwest/Central,Troy,MI,48084.0,Troy South,A,5703.0,Newrez,Financial Services and Insurance,New,Suburban Detroit,455822,Relet,Suburban,36684001.0,9776349.0,0.266501710105176,23.6363991472463,21.6385459522153,8529865.0,0.1004,23.979394,21.992432,1246484.0,0.0147,19.063798,17.464776,561095.0,2024-Q3,Small,Financial_Services_and_Insurance_Small
2024,Q3,8.0,Detroit,Travelers Tower I,Detroit_Southfield_Southfield_Travelers Tower I_26555 Evergreen Rd,26555 Evergreen Rd,Midwest/Central,Southfield,MI,48076.0,Southfield,A,10019.0,Metlife Services & Solutions,Financial Services and Insurance,TBD,Suburban Detroit,455778,Relet,Suburban,36684001.0,9776349.0,0.266501710105176,23.6363991472463,21.6385459522153,8529865.0,0.1004,23.979394,21.992432,1246484.0,0.0147,19.063798,17.464776,561095.0,2024-Q3,Small,Financial_Services_and_Insurance_Small
2024,Q3,8.0,Manhattan,100108 E 59 St,Manhattan_Plaza North_New York_100108 E 59 St_499 Park Ave,499 Park Ave,Northeast,New York,NY,10022.0,Plaza North,A,5553.0,Empyrean Capital Partners,Financial Services and Insurance,Renewal,Midtown,157298,Relet,CBD,267569157.0,51717931.0,0.193288088880887,85.4876840476282,75.9093678931504,38788015.0,0.0832,92.898646,80.836168,12929916.0,0.0277,63.399877,57.972647,5697897.0,2024-Q3,Small,Financial_Services_and_Insurance_Small
2024,Q3,8.0,Manhattan,153157 E 45th St,Manhattan_Grand Central_New York_153157 E 45th St_730 3rd Ave,730 3rd Ave,Northeast,New York,NY,10017.0,Grand Central,A,8424.0,Greenbelt Capital,Financial Services and Insurance,Relocation,Midtown,157300,Relet,CBD,267569157.0,51717931.0,0.193288088880887,85.4876840476282,75.9093678931504,38788015.0,0.0832,92.898646,80.836168,12929916.0,0.0277,63.399877,57.972647,5697897.0,2024-Q3,Small,Financial_Services_and_Insurance_Small
2024,Q3,8.0,Manhattan,1820 W 21st St,Manhattan_Flatiron_New York_1820 W 21st St_18-20 W 21st St,18-20 W 21st St,Northeast,New York,NY,10010.0,Flatiron,O,5150.0,Gemini,Financial Services and Insurance,New,Midtown South,41417,Relet,CBD,198553779.0,39959005.0,0.201250286956261,61.65304255607,75.9093678931504,33133297.0,0.0711,64.788593,80.836168,6825708.0,0.0146,45.467794,57.972647,3818375.0,2024-Q3,Small,Financial_Services_and_Insurance_Small
2024,Q3,8.0,Manhattan,28 W 56th St,Manhattan_Plaza North_New York_28 W 56th St_712 Fifth Ave,712 Fifth Ave,Northeast,New York,NY,10019.0,Plaza North,A,9833.0,Graham Capital Management,Financial Services and Insurance,New,Midtown,157047,Relet,CBD,267569157.0,51717931.0,0.193288088880887,85.4876840476282,75.9093678931504,38788015.0,0.0832,92.898646,80.836168,12929916.0,0.0277,63.399877,57.972647,5697897.0,2024-Q3,Small,Financial_Services_and_Insurance_Small
2024,Q3,8.0,Manhattan,287  322 7th Ave,Manhattan_Chelsea_New York_287  322 7th Ave_205 W 28th St,205 W 28th St,Northeast,New York,NY,10001.0,Chelsea,A,8685.0,Injective Labs,Financial Services and Insurance,Relocation,Midtown South,11253225,Relet,CBD,267569157.0,51717931.0,0.193288088880887,85.4876840476282,75.9093678931504,38788015.0,0.0832,92.898646,80.836168,12929916.0,0.0277,63.399877,57.972647,5697897.0,2024-Q3,Small,Financial_Services_and_Insurance_Small
2024,Q3,8.0,Manhattan,777793 Third Ave,Manhattan_East Side / UN_New York_777793 Third Ave_777 Third Ave,777 Third Ave,Northeast,New York,NY,10017.0,East Side / UN,A,8404.0,New Holland Capital,Financial Services and Insurance,Relocation,Midtown,157161,Relet,CBD,267569157.0,51717931.0,0.193288088880887,85.4876840476282,75.9093678931504,38788015.0,0.0832,92.898646,80.836168,12929916.0,0.0277,63.399877,57.972647,5697897.0,2024-Q3,Small,Financial_Services_and_Insurance_Small
2024,Q3,8.0,Manhattan,950 3rd Ave,Manhattan_East Side / UN_New York_950 3rd Ave_950 Third Ave,950 Third Ave,Northeast,New York,NY,10022.0,East Side / UN,A,7500.0,Backcast Partners,Financial Services and Insurance,Relocation,Midtown,157238,Sublet,CBD,267569157.0,51717931.0,0.193288088880887,85.4876840476282,75.9093678931504,38788015.0,0.0832,92.898646,80.836168,12929916.0,0.0277,63.399877,57.972647,5697897.0,2024-Q3,Small,Financial_Services_and_Insurance_Small
2024,Q3,8.0,Manhattan,Buchmann Tower,Manhattan_Plaza South_New York_Buchmann Tower_680 Fifth Ave,680 Fifth Ave,Northeast,New York,NY,10019.0,Plaza South,A,11091.0,Azora Bank,Financial Services and Insurance,Relocation,Midtown,157323,Sublet,CBD,267569157.0,51717931.0,0.193288088880887,85.4876840476282,75.9093678931504,38788015.0,0.0832,92.898646,80.836168,12929916.0,0.0277,63.399877,57.972647,5697897.0,2024-Q3,Small,Financial_Services_and_Insurance_Small
2024,Q3,8.0,Manhattan,International Plaza,Manhattan_East Side / UN_New York_International Plaza_750 Lexington Ave,750 Lexington Ave,Northeast,New York,NY,10022.0,East Side / UN,A,3000.0,Bryan Garnier Securities,Financial Services and Insurance,Renewal,Midtown,157254,Relet,CBD,267569157.0,51717931.0,0.193288088880887,85.4876840476282,75.9093678931504,38788015.0,0.0832,92.898646,80.836168,12929916.0,0.0277,63.399877,57.972647,5697897.0,2024-Q3,Small,Financial_Services_and_Insurance_Small
2024,Q3,8.0,Manhattan,Kiamie Arcade Building,Manhattan_Park Avenue South_New York_Kiamie Arcade Building_118 E 28th St,118 E 28th St,Northeast,New York,NY,10016.0,Park Avenue South,O,1500.0,Margolis Associates,Financial Services and Insurance,New,Midtown South,158246,Relet,CBD,198553779.0,39959005.0,0.201250286956261,61.65304255607,75.9093678931504,33133297.0,0.0711,64.788593,80.836168,6825708.0,0.0146,45.467794,57.972647,3818375.0,2024-Q3,Small,Financial_Services_and_Insurance_Small
2024,Q3,8.0,Manhattan,One Vanderbilt,Manhattan_Grand Central_New York_One Vanderbilt_1 Vanderbilt Ave,1 Vanderbilt Ave,Northeast,New York,NY,10017.0,Grand Central,A,6454.0,United Healthcare,Financial Services and Insurance,New,Midtown,9526014,Relet,CBD,267569157.0,51717931.0,0.193288088880887,85.4876840476282,75.9093678931504,38788015.0,0.0832,92.898646,80.836168,12929916.0,0.0277,63.399877,57.972647,5697897.0,2024-Q3,Small,Financial_Services_and_Insurance_Small
2024,Q3,8.0,Manhattan,Rockefeller Center,Manhattan_Plaza South_New York_Rockefeller Center_75 Rockefeller Plaza,75 Rockefeller Plaza,Northeast,New York,NY,10019.0,Plaza South,A,4724.0,Nch Capital,Financial Services and Insurance,Relocation,Midtown,157211,Relet,CBD,267569157.0,51717931.0,0.193288088880887,85.4876840476282,75.9093678931504,38788015.0,0.0832,92.898646,80.836168,12929916.0,0.0277,63.399877,57.972647,5697897.0,2024-Q3,Small,Financial_Services_and_Insurance_Small
2024,Q3,8.0,Manhattan,The Art of American Building,Manhattan_Plaza North_New York_The Art of American Building_535 Madison Ave,535 Madison Ave,Northeast,New York,NY,10022.0,Plaza North,A,9493.0,Rafferty Capital,Financial Services and Insurance,Relocation,Midtown,157174,Relet,CBD,267569157.0,51717931.0,0.193288088880887,85.4876840476282,75.9093678931504,38788015.0,0.0832,92.898646,80.836168,12929916.0,0.0277,63.399877,57.972647,5697897.0,2024-Q3,Small,Financial_Services_and_Insurance_Small
2024,Q3,8.0,Manhattan,The Park House,Manhattan_Penn Plaza/Times Square South_New York_The Park House_104 W 40th St,104 W 40th St,Northeast,New York,NY,10018.0,Penn Plaza/Times Square South,A,10000.0,Huntington Bank,Financial Services and Insurance,New,Midtown,157486,Relet,CBD,267569157.0,51717931.0,0.193288088880887,85.4876840476282,75.9093678931504,38788015.0,0.0832,92.898646,80.836168,12929916.0,0.0277,63.399877,57.972647,5697897.0,2024-Q3,Small,Financial_Services_and_Insurance_Small
2024,Q3,8.0,Manhattan,,Manhattan_Flatiron_New York_NA_15-17 W 18th St,15-17 W 18th St,Northeast,New York,NY,10011.0,Flatiron,O,5400.0,Turnkey Global,Financial Services and Insurance,Relocation,Midtown South,41419,Relet,CBD,198553779.0,39959005.0,0.201250286956261,61.65304255607,75.9093678931504,33133297.0,0.0711,64.788593,80.836168,6825708.0,0.0146,45.467794,57.972647,3818375.0,2024-Q3,Small,Financial_Services_and_Insurance_Small
2024,Q3,8.0,Manhattan,,Manhattan_Park Avenue South_New York_NA_373 Park Ave S,373 Park Ave S,Northeast,New York,NY,10016.0,Park Avenue South,O,8732.0,Aegis Venture Partners,Financial Services and Insurance,Renewal,Midtown South,158078,Relet,CBD,198553779.0,39959005.0,0.201250286956261,61.65304255607,75.9093678931504,33133297.0,0.0711,64.788593,80.836168,6825708.0,0.0146,45.467794,57.972647,3818375.0,2024-Q3,Small,Financial_Services_and_Insurance_Small
2024,Q3,8.0,Northern New Jersey,1750 Merrill Lynch Dr,Northern New Jersey_Princeton_Pennington_1750 Merrill Lynch Dr_1750 American Blvd,1750 American Blvd,Northeast,Pennington,NJ,8560.0,Princeton,A,5809.0,Randstad,Financial Services and Insurance,New,,9197223,Relet,Suburban,114304619.0,32302488.0,0.282600023363885,32.6759192544602,31.357191562086,25475084.0,0.1696,33.3167,31.797385,6827404.0,0.0454,28.696563,28.211692,2097653.0,2024-Q3,Small,Financial_Services_and_Insurance_Small
2024,Q3,8.0,Northern New Jersey,30 Montgomery,Northern New Jersey_Waterfront_Jersey City_30 Montgomery_30 Montgomery St,30 Montgomery St,Northeast,Jersey City,NJ,7302.0,Waterfront,A,5589.0,Fulcrum Hospitality,Financial Services and Insurance,Renewal,,166340,Relet,CBD,114304619.0,32302488.0,0.282600023363885,32.6759192544602,31.357191562086,25475084.0,0.1696,33.3167,31.797385,6827404.0,0.0454,28.696563,28.211692,2097653.0,2024-Q3,Small,Financial_Services_and_Insurance_Small
2024,Q3,8.0,Northern New Jersey,Glenpointe Centre East,Northern New Jersey_East Bergen_Teaneck_Glenpointe Centre East_300 Frank W Burr Blvd,300 Frank W Burr Blvd,Northeast,Teaneck,NJ,7666.0,East Bergen,A,5295.0,Castle Financial Management,Financial Services and Insurance,Renewal,,161732,Relet,Suburban,114304619.0,32302488.0,0.282600023363885,32.6759192544602,31.357191562086,25475084.0,0.1696,33.3167,31.797385,6827404.0,0.0454,28.696563,28.211692,2097653.0,2024-Q3,Small,Financial_Services_and_Insurance_Small
