year,quarter,monthsigned,market,building_name,building_id,address,region,city,state,zip,internal_submarket,internal_class,leasedSF,company_name,internal_industry,transaction_type,internal_market_cluster,costarID,space_type,CBD_suburban,RBA,available_space,availability_proportion,internal_class_rent,overall_rent,direct_available_space,direct_availability_proportion,direct_internal_class_rent,direct_overall_rent,sublet_available_space,sublet_availability_proportion,sublet_internal_class_rent,sublet_overall_rent,leasing,year-quarter,company_size,industry_size
2024,Q2,5.0,Manhattan,One World Trade Center,Manhattan_WTC/Brookfield Place_New York_One World Trade Center_One World Trade Center,One World Trade Center,Northeast,New York,NY,10007.0,WTC/Brookfield Place,A,10804.0,Venerable,Financial Services and Insurance,Relocation,Downtown,1130742,Relet,CBD,267787350.0,53537225.0,0.199924398968062,86.0903147571715,76.6259509200918,39664181.0,0.085,94.170351,81.800437,13873044.0,0.0297,63.282968,58.567878,5869995.0,2024-Q2,Small,Financial_Services_and_Insurance_Small
2024,Q2,5.0,Nashville,Burton Hills IV,Nashville_Green Hills/Music Row_Nashville_Burton Hills IV_40 Burton Hills Blvd,40 Burton Hills Blvd,South,Nashville,TN,37215.0,Green Hills/Music Row,O,4543.0,Gen Cap America,Financial Services and Insurance,Renewal,Green Hills/Music Row,810529,New,Suburban,22536095.0,3737294.0,0.165835917890832,29.6941622069764,34.4029769124653,3149265.0,0.0638,29.987391,34.982836,588029.0,0.0119,27.692712,31.166408,94818.0,2024-Q2,Small,Financial_Services_and_Insurance_Small
2024,Q2,5.0,Nashville,,Nashville_Green Hills/Music Row_Nashville_NA_54-60 Music Sq E,54-60 Music Sq E,South,Nashville,TN,37203.0,Green Hills/Music Row,O,1855.0,Castle & Cooke Mortgage,Financial Services and Insurance,New,Green Hills/Music Row,6374917,,Suburban,22536095.0,3737294.0,0.165835917890832,29.6941622069764,34.4029769124653,3149265.0,0.0638,29.987391,34.982836,588029.0,0.0119,27.692712,31.166408,94818.0,2024-Q2,Small,Financial_Services_and_Insurance_Small
2024,Q2,5.0,Northern New Jersey,,Northern New Jersey_Princeton_Princeton_NA_902 Carnegie Ctr,902 Carnegie Ctr,Northeast,Princeton,NJ,8540.0,Princeton,A,4886.0,Odyssey Reinsurance,Financial Services and Insurance,New,,167868,Relet,Suburban,114586211.0,32040766.0,0.279621480808018,32.7557516577412,31.4765902519741,25377922.0,0.1688,33.412962,31.928076,6662844.0,0.0443,29.215098,28.684072,1331014.0,2024-Q2,Small,Financial_Services_and_Insurance_Small
2024,Q2,5.0,Northern Virginia,Fort Evans Plaza II,Northern Virginia_Loudoun County_Leesburg_Fort Evans Plaza II_540 Fort Evans Rd NE,540 Fort Evans Rd NE,Northeast,Leesburg,VA,20176.0,Loudoun County,A,2626.0,John Marshall Bank,Financial Services and Insurance,New,Loudoun/Stafford/Prince William,5761326,Relet,Suburban,102964063.0,27824417.0,0.270234256392932,36.2818975531959,35.2572608740939,23936070.0,0.1592,37.037827,35.86277,3888347.0,0.0259,31.370433,30.585632,1450081.0,2024-Q2,Small,Financial_Services_and_Insurance_Small
2024,Q2,5.0,Northern Virginia,Tysons Tower,Northern Virginia_Tysons Corner_McLean_Tysons Tower_7900 Tysons One Pl,7900 Tysons One Pl,Northeast,McLean,VA,22102.0,Tysons Corner,A,9668.0,Raymond James,Financial Services and Insurance,New,Fairfax County,8066305,Relet,Suburban,102964063.0,27824417.0,0.270234256392932,36.2818975531959,35.2572608740939,23936070.0,0.1592,37.037827,35.86277,3888347.0,0.0259,31.370433,30.585632,1450081.0,2024-Q2,Small,Financial_Services_and_Insurance_Small
2024,Q2,5.0,Philadelphia,161 Washington Street,Philadelphia_Conshohocken_Conshohocken_161 Washington Street_161 Washington St,161 Washington St,Northeast,Conshohocken,PA,19428.0,Conshohocken,A,9998.0,Copeland Capital,Financial Services and Insurance,Renewal,,382627,,Suburban,86816155.0,22939591.0,0.264231824134575,33.8091456898495,32.1924140675547,18287516.0,0.139,34.411176,32.772904,4652075.0,0.0353,29.047255,27.551989,720647.0,2024-Q2,Small,Financial_Services_and_Insurance_Small
2024,Q2,5.0,Philadelphia,VEVA 18,Philadelphia_Blue Bell_Blue Bell_VEVA 18_1787 Sentry Pky W,1787 Sentry Pky W,Northeast,Blue Bell,PA,19422.0,Blue Bell,A,3175.0,Trustmark,Financial Services and Insurance,New,,297488,Relet,Suburban,86816155.0,22939591.0,0.264231824134575,33.8091456898495,32.1924140675547,18287516.0,0.139,34.411176,32.772904,4652075.0,0.0353,29.047255,27.551989,720647.0,2024-Q2,Small,Financial_Services_and_Insurance_Small
2024,Q2,5.0,Phoenix,Bldg A,Phoenix_Arrowhead_Peoria_Bldg A_15396 N 83rd Ave,15396 N 83rd Ave,West,Peoria,AZ,85381.0,Arrowhead,O,2420.0,Edward Jones,Financial Services and Insurance,New,,5028414,Relet,Suburban,55520545.0,11943717.0,0.21512247403191,27.4252087628835,30.488540939592,9113028.0,0.0866,28.092672,31.763895,2830689.0,0.0269,25.150937,26.264815,569846.0,2024-Q2,Small,Financial_Services_and_Insurance_Small
2024,Q2,5.0,San Diego,The Plaza,San Diego_UTC_San Diego_The Plaza_4365 Executive Dr,4365 Executive Dr,West,San Diego,CA,92121.0,UTC,A,4029.0,Everbank,Financial Services and Insurance,New,,313249,Relet,Suburban,32442692.0,8497695.0,0.261929404625239,45.8807516969865,41.4691127669684,6867906.0,0.1068,47.779105,42.62223,1629789.0,0.0254,37.865377,35.855324,491144.0,2024-Q2,Small,Financial_Services_and_Insurance_Small
2024,Q2,5.0,South Bay/San Jose,610 Jarvis Drive,South Bay/San Jose_Morgan Hill/Gilroy_Morgan Hill_610 Jarvis Drive_610 Jarvis Dr,610 Jarvis Dr,West,Morgan Hill,CA,95037.0,Morgan Hill/Gilroy,O,9689.0,Amwins,Financial Services and Insurance,New,,516786,Relet,Suburban,,,,,,,,,,,,,,,2024-Q2,Small,Financial_Services_and_Insurance_Small
2024,Q2,5.0,South Florida,360 Rosemary,South Florida_Palm Beach_West Palm Beach_360 Rosemary_360 Rosemary Ave,360 Rosemary Ave,South,West Palm Beach,FL,33401.0,Palm Beach,A,500.0,JP Morgan,Financial Services and Insurance,New,Palm Beach County,10644298,Relet,Suburban,54943330.0,11353999.0,0.206649269347162,51.2260596059396,44.5195114089092,9868109.0,0.0933,51.665404,44.940155,1485890.0,0.014,45.971959,39.226152,1169244.0,2024-Q2,Small,Financial_Services_and_Insurance_Small
2024,Q2,5.0,South Florida,Cypress Corporate Center,South Florida_Cypress Creek/Fort Lauderdale_Fort Lauderdale_Cypress Corporate Center_1901 W Cypress Creek Rd,1901 W Cypress Creek Rd,South,Fort Lauderdale,FL,33309.0,Cypress Creek/Fort Lauderdale,O,500.0,Morgan Fidelity Associates,Financial Services and Insurance,Renewal,Broward County,379050,Relet,Suburban,50859929.0,8270424.0,0.162611788152516,35.6709787672828,44.5195114089092,7177651.0,0.0678,36.145431,44.940155,1092773.0,0.0103,29.262489,39.226152,557689.0,2024-Q2,Small,Financial_Services_and_Insurance_Small
2024,Q2,5.0,Tampa,Bank of America Plaza,Tampa_Tampa CBD_Tampa_Bank of America Plaza_101 E Kennedy Blvd,101 E Kennedy Blvd,South,Tampa,FL,33602.0,Tampa CBD,A,9803.0,Alliancebernstein,Financial Services and Insurance,Renewal,Hillsborough,380221,,CBD,24886444.0,6253909.0,0.251297814987147,33.3529519523426,29.6334634986274,4297922.0,0.0798,34.358104,30.081937,1955987.0,0.0363,24.975098,24.52427,505743.0,2024-Q2,Small,Financial_Services_and_Insurance_Small
2024,Q2,5.0,Washington D.C.,Republic Place,Washington D.C._Central Business District_Washington_Republic Place_1776 I St NW,1776 I St NW,Northeast,Washington,DC,20006.0,Central Business District,A,11087.0,Stifel,Financial Services and Insurance,New,,129069,Relet,CBD,,,,,,,,,,,,,,,2024-Q2,Small,Financial_Services_and_Insurance_Small
2024,Q2,6.0,Boston,Bldg 2,Boston_Route 128 South_Quincy_Bldg 2_2 Batterymarch Park,2 Batterymarch Park,Northeast,Quincy,MA,2169.0,Route 128 South,A,9260.0,Abington Bank,Financial Services and Insurance,New,Route 128 Corridor,219151,,Suburban,150846043.0,35446338.0,0.234983545441759,56.6276814988861,47.9903732537181,25614042.0,0.096,58.588263,49.388691,9832296.0,0.0369,44.490656,40.094155,1050068.0,2024-Q2,Small,Financial_Services_and_Insurance_Small
2024,Q2,6.0,Chicago,71 S Franklin St,Chicago_West Loop_Chicago_71 S Franklin St_71 S Wacker Dr,71 S Wacker Dr,Midwest/Central,Chicago,IL,60606.0,West Loop,A,5159.0,Hill Capital Group,Financial Services and Insurance,Restructure,,728654,,CBD,,,,,,,,,,,,,,,2024-Q2,Small,Financial_Services_and_Insurance_Small
2024,Q2,6.0,Chicago,,Chicago_River North_Chicago_NA_325 W Huron St,325 W Huron St,Midwest/Central,Chicago,IL,60654.0,River North,O,4750.0,Rocketcoin,Financial Services and Insurance,New,,144595,,CBD,,,,,,,,,,,,,,,2024-Q2,Small,Financial_Services_and_Insurance_Small
2024,Q2,6.0,Denver,Building 3,Denver_Northwest_Westminster_Building 3_10155 Westmoor Dr,10155 Westmoor Dr,Midwest/Central,Westminster,CO,80021.0,Northwest,A,2117.0,Liberty Mutual,Financial Services and Insurance,New,,393968,New,Suburban,,,,,,,,,,,,,,,2024-Q2,Small,Financial_Services_and_Insurance_Small
2024,Q2,6.0,Detroit,,Detroit_Birmingham Area_Birmingham_NA_260 E Brown St,260 E Brown St,Midwest/Central,Birmingham,MI,48009.0,Birmingham Area,A,1322.0,Mid-States Advisors,Financial Services and Insurance,TBD,Suburban Detroit,455111,Relet,Suburban,36621501.0,9453054.0,0.258128524005611,24.0132090964122,21.8355579030725,8185040.0,0.0968,24.420782,22.225199,1268014.0,0.015,18.908594,17.407312,526413.0,2024-Q2,Small,Financial_Services_and_Insurance_Small
2024,Q2,6.0,Manhattan,10 Grand Central,Manhattan_Grand Central_New York_10 Grand Central_155 E 44th St,155 E 44th St,Northeast,New York,NY,10017.0,Grand Central,A,3096.0,Kokino,Financial Services and Insurance,New,Midtown,157192,Relet,CBD,267787350.0,53537225.0,0.199924398968062,86.0903147571715,76.6259509200918,39664181.0,0.085,94.170351,81.800437,13873044.0,0.0297,63.282968,58.567878,5869995.0,2024-Q2,Small,Financial_Services_and_Insurance_Small
2024,Q2,6.0,Manhattan,450 Park Ave,Manhattan_Plaza North_New York_450 Park Ave_450 Park Ave,450 Park Ave,Northeast,New York,NY,10022.0,Plaza North,A,10777.0,Dubin &,Financial Services and Insurance,Relocation,Midtown,157220,Sublet,CBD,267787350.0,53537225.0,0.199924398968062,86.0903147571715,76.6259509200918,39664181.0,0.085,94.170351,81.800437,13873044.0,0.0297,63.282968,58.567878,5869995.0,2024-Q2,Small,Financial_Services_and_Insurance_Small
2024,Q2,6.0,Manhattan,50 Hudson Yards,Manhattan_Hudson Yards_New York_50 Hudson Yards_50 Hudson Yards,50 Hudson Yards,Northeast,New York,NY,10001.0,Hudson Yards,A,9890.0,Cinctive Capital Management,Financial Services and Insurance,New,Midtown,8226798,Relet,CBD,267787350.0,53537225.0,0.199924398968062,86.0903147571715,76.6259509200918,39664181.0,0.085,94.170351,81.800437,13873044.0,0.0297,63.282968,58.567878,5869995.0,2024-Q2,Small,Financial_Services_and_Insurance_Small
2024,Q2,6.0,Manhattan,894900 Broadway,Manhattan_Union Square_New York_894900 Broadway_900 Broadway,900 Broadway,Northeast,New York,NY,10003.0,Union Square,O,3000.0,Balance Payments,Financial Services and Insurance,Renewal,Midtown South,158322,Relet,CBD,198703233.0,39963264.0,0.201120351172142,62.0443224895677,76.6259509200918,33139125.0,0.071,64.990536,81.800437,6824139.0,0.0146,46.897569,58.567878,2807110.0,2024-Q2,Small,Financial_Services_and_Insurance_Small
2024,Q2,6.0,Manhattan,American Express Building,Manhattan_WTC/Brookfield Place_New York_American Express Building_65 Broadway,65 Broadway,Northeast,New York,NY,10006.0,WTC/Brookfield Place,O,2969.0,Atri Insurance Services,Financial Services and Insurance,Renewal,Downtown,157481,Relet,CBD,198703233.0,39963264.0,0.201120351172142,62.0443224895677,76.6259509200918,33139125.0,0.071,64.990536,81.800437,6824139.0,0.0146,46.897569,58.567878,2807110.0,2024-Q2,Small,Financial_Services_and_Insurance_Small
2024,Q2,6.0,Manhattan,Tower 52,Manhattan_East Side / UN_New York_Tower 52_150 E 52nd St,150 E 52nd St,Northeast,New York,NY,10022.0,East Side / UN,A,2250.0,Tensile Capital,Financial Services and Insurance,Renewal,Midtown,157182,Relet,CBD,267787350.0,53537225.0,0.199924398968062,86.0903147571715,76.6259509200918,39664181.0,0.085,94.170351,81.800437,13873044.0,0.0297,63.282968,58.567878,5869995.0,2024-Q2,Small,Financial_Services_and_Insurance_Small
2024,Q2,6.0,Philadelphia,Exton Corporate Center,Philadelphia_Exton/West Chester_Exton_Exton Corporate Center_102 Pickering Way,102 Pickering Way,Northeast,Exton,PA,19341.0,Exton/West Chester,A,4003.0,Ryan Specialty Group,Financial Services and Insurance,Renewal,,51693,,Suburban,86816155.0,22939591.0,0.264231824134575,33.8091456898495,32.1924140675547,18287516.0,0.139,34.411176,32.772904,4652075.0,0.0353,29.047255,27.551989,720647.0,2024-Q2,Small,Financial_Services_and_Insurance_Small
2024,Q2,6.0,Salt Lake City,South Towne Center II,Salt Lake City_Southeast_Sandy_South Towne Center II_10150 Centennial Pky,10150 Centennial Pky,West,Sandy,UT,84070.0,Southeast,O,10404.0,Progressive Insurance,Financial Services and Insurance,New,,1064411,,Suburban,25447497.0,4692157.0,0.18438579637125,24.0213709931736,27.3051102023729,4144829.0,0.0874,24.606774,28.242337,547328.0,0.0115,20.4946,23.665011,187181.0,2024-Q2,Small,Financial_Services_and_Insurance_Small
2024,Q2,6.0,South Bay/San Jose,,South Bay/San Jose_Palo Alto_Palo Alto_NA_435 Tasso St,435 Tasso St,West,Palo Alto,CA,94301.0,Palo Alto,O,3032.0,Lazard,Financial Services and Insurance,New,,302702,Relet,CBD,,,,,,,,,,,,,,,2024-Q2,Small,Financial_Services_and_Insurance_Small
2024,Q2,6.0,Washington D.C.,,Washington D.C._East End_Washington_NA_1001 Pennsylvania Ave NW,1001 Pennsylvania Ave NW,Northeast,Washington,DC,20004.0,East End,A,9163.0,Unicare Life & Health Insurance,Financial Services and Insurance,,,129241,Relet,CBD,,,,,,,,,,,,,,,2024-Q2,Small,Financial_Services_and_Insurance_Small
2018,Q3,6.0,Atlanta,Bldg 2100,Atlanta_Northeast_Duluth_Bldg 2100_2425 Commerce Ave,2425 Commerce Ave,South,Duluth,GA,30096.0,Northeast,O,9181.0,Agency Matrix,Financial Services and Insurance,New,,448105,Relet,Suburban,65945176.0,12669083.0,0.192115386878337,20.3634671584452,26.3933334340637,,,,,,,,,432794.0,2018-Q3,Small,Financial_Services_and_Insurance_Small
2018,Q3,6.0,Atlanta,Hillside,Atlanta_North Fulton_Alpharetta_Hillside_1150 Sanctuary Pky,1150 Sanctuary Pky,South,Alpharetta,GA,30009.0,North Fulton,A,3833.0,The Navigators Group,Financial Services and Insurance,Renewal,,5860656,Relet,Suburban,103659328.0,22206503.0,0.214225805129665,29.5072586063214,26.3933334340637,,,,,,,,,1929820.0,2018-Q3,Small,Financial_Services_and_Insurance_Small
2018,Q3,6.0,Charlotte,Northlake I,Charlotte_South Carolina_Rock Hill_Northlake I_452 Lakeshore Pky,452 Lakeshore Pky,South,Rock Hill,SC,29730.0,South Carolina,O,2149.0,Guild Mortgage,Financial Services and Insurance,New,,119148,Relet,Suburban,27835480.0,3056498.0,0.109805830544327,22.157185983305,27.4602238556114,,,,,,,,,247663.0,2018-Q3,Small,Financial_Services_and_Insurance_Small
2018,Q3,6.0,Dallas/Ft Worth,Bent Tree Tower I,Dallas/Ft Worth_North Dallas Corridor_Addison_Bent Tree Tower I_16475 N Dallas Pky,16475 N Dallas Pky,South,Addison,TX,75001.0,North Dallas Corridor,O,7357.0,Guaranty Bank,Financial Services and Insurance,New,,409521,Relet,Suburban,,,,,,,,,,,,,,,2018-Q3,Small,Financial_Services_and_Insurance_Small
2018,Q3,6.0,Dallas/Ft Worth,Hidden Grove,Dallas/Ft Worth_LBJ_Dallas_Hidden Grove_12404 Park Central Dr,12404 Park Central Dr,South,Dallas,TX,75251.0,LBJ,A,4500.0,Fidelity National Financial,Financial Services and Insurance,New,,410116,Relet,Suburban,,,,,,,,,,,,,,,2018-Q3,Small,Financial_Services_and_Insurance_Small
2018,Q3,6.0,Denver,201 Columbine St,Denver_Cherry Creek_Denver_201 Columbine St_201 Columbine St,201 Columbine St,Midwest/Central,Denver,CO,80206.0,Cherry Creek,O,5063.0,Stifel,Financial Services and Insurance,Renewal,,756643,,CBD,,,,,,,,,,,,,,,2018-Q3,Small,Financial_Services_and_Insurance_Small
2018,Q3,6.0,Denver,Axis Tower,Denver_Southeast_Greenwood Village_Axis Tower_5613 Dtc Pky,5613 Dtc Pky,Midwest/Central,Greenwood Village,CO,80111.0,Southeast,A,4584.0,Mj Smith & Associates,Financial Services and Insurance,Renewal,,393036,Relet,Suburban,,,,,,,,,,,,,,,2018-Q3,Small,Financial_Services_and_Insurance_Small
2018,Q3,6.0,Denver,US Bank,Denver_Cherry Creek_Denver_US Bank_210 University Blvd,210 University Blvd,Midwest/Central,Denver,CO,80206.0,Cherry Creek,O,6929.0,Denver Agency Co,Financial Services and Insurance,Renewal,,393919,Relet,CBD,,,,,,,,,,,,,,,2018-Q3,Small,Financial_Services_and_Insurance_Small
2018,Q3,6.0,Houston,811 Louisiana,Houston_CBD_Houston_811 Louisiana_811 Louisiana St,811 Louisiana St,South,Houston,TX,77002.0,CBD,A,11346.0,Allstate,Financial Services and Insurance,New,,233960,Relet,CBD,114154896.0,31590818.0,0.276736426618093,33.4397149273622,28.5122604771179,,,,,,,,,2858821.0,2018-Q3,Small,Financial_Services_and_Insurance_Small
2018,Q3,6.0,Los Angeles,West Wilshire Center,Los Angeles_Westwood/West LA_Los Angeles_West Wilshire Center_11620 Wilshire Blvd,11620 Wilshire Blvd,West,Los Angeles,CA,90025.0,Westwood/West LA,A,2000.0,"Perennial Financial Services,",Financial Services and Insurance,Renewal,Westside,246921,,CBD,144098024.0,24940147.0,0.17307764747697,41.8809174441537,39.4800003545481,,,,,,,,,2295256.0,2018-Q3,Small,Financial_Services_and_Insurance_Small
2018,Q3,6.0,Manhattan,17 State Street,Manhattan_Financial District_New York_17 State Street_17 State St,17 State St,Northeast,New York,NY,10004.0,Financial District,A,6007.0,Mashreq Bank,Financial Services and Insurance,New,Downtown,157109,Relet,CBD,244542518.0,30684926.0,0.125478899338069,82.0305648880271,74.6320855266435,,,,,,,,,4198889.0,2018-Q3,Small,Financial_Services_and_Insurance_Small
2018,Q3,6.0,Manhattan,Times Square Plaza,Manhattan_Times Square_New York_Times Square Plaza_1500 Broadway,1500 Broadway,Northeast,New York,NY,10036.0,Times Square,A,4414.0,China Overseas,Financial Services and Insurance,Renewal,Midtown,157215,,CBD,244542518.0,30684926.0,0.125478899338069,82.0305648880271,74.6320855266435,,,,,,,,,4198889.0,2018-Q3,Small,Financial_Services_and_Insurance_Small
2018,Q3,6.0,Northern New Jersey,Bldg A,Northern New Jersey_Morris_Florham Park_Bldg A_25 Hanover Rd,25 Hanover Rd,Northeast,Florham Park,NJ,7932.0,Morris,O,2123.0,Ameriprise Financial,Financial Services and Insurance,New,,171743,Relet,Suburban,33439279.0,7687782.0,0.229902744015503,23.9804999420255,27.1155870884333,,,,,,,,,151979.0,2018-Q3,Small,Financial_Services_and_Insurance_Small
2018,Q3,6.0,Northern New Jersey,Court Plaza North,Northern New Jersey_East Bergen_Hackensack_Court Plaza North_25 Main St,25 Main St,Northeast,Hackensack,NJ,7601.0,East Bergen,A,2895.0,Metlife,Financial Services and Insurance,New,,708662,Relet,Suburban,112430880.0,28781089.0,0.255989181975628,28.2037743342289,27.1155870884333,,,,,,,,,1962510.0,2018-Q3,Small,Financial_Services_and_Insurance_Small
2018,Q3,6.0,Phoenix,Offices on High Street  A10,Phoenix_Paradise Valley_Phoenix_Offices on High Street  A10_5415 E High St,5415 E High St,West,Phoenix,AZ,85054.0,Paradise Valley,A,7505.0,Sprout Financial,Financial Services and Insurance,New,,6148432,Relet,Suburban,45540054.0,9098116.0,0.199782723138624,30.7286629269632,26.8166952935553,,,,,,,,,607730.0,2018-Q3,Small,Financial_Services_and_Insurance_Small
2018,Q3,6.0,Phoenix,The Alamos Building,Phoenix_N Scottsdale/Carefree_Scottsdale_The Alamos Building_8787 E Pinnacle Peak Rd,8787 E Pinnacle Peak Rd,West,Scottsdale,AZ,85255.0,N Scottsdale/Carefree,O,2553.0,Driggs Title Agency,Financial Services and Insurance,New,Scottsdale,117251,Relet,Suburban,55671065.0,10433823.0,0.187573816645587,23.2256613101691,26.8166952935553,,,,,,,,,944183.0,2018-Q3,Small,Financial_Services_and_Insurance_Small
2018,Q3,6.0,Phoenix,,Phoenix_West I-10_Goodyear_NA_1646 N Litchfield Rd,1646 N Litchfield Rd,West,Goodyear,AZ,85395.0,West I-10,O,2581.0,Academy Mortgage,Financial Services and Insurance,New,,507186,Relet,Suburban,55671065.0,10433823.0,0.187573816645587,23.2256613101691,26.8166952935553,,,,,,,,,944183.0,2018-Q3,Small,Financial_Services_and_Insurance_Small
2018,Q3,6.0,Raleigh/Durham,Crabtree Overlook,Raleigh/Durham_Glenwood/Creedmoor_Raleigh_Crabtree Overlook_2301 Sugar Bush Rd,2301 Sugar Bush Rd,South,Raleigh,NC,27612.0,Glenwood/Creedmoor,A,10884.0,Marsh & Mclennan Agency,Financial Services and Insurance,New,,583036,Relet,Suburban,,,,,,,,,,,,,,,2018-Q3,Small,Financial_Services_and_Insurance_Small
2018,Q3,6.0,Raleigh/Durham,WestChase II,Raleigh/Durham_West Raleigh_Raleigh_WestChase II_4000 Westchase Blvd,4000 Westchase Blvd,South,Raleigh,NC,27607.0,West Raleigh,A,3026.0,Mass Mutual Financial Group,Financial Services and Insurance,New,,549740,Relet,Suburban,,,,,,,,,,,,,,,2018-Q3,Small,Financial_Services_and_Insurance_Small
2018,Q3,6.0,South Florida,Fairway Financial Center,South Florida_North Broward_Deerfield Beach_Fairway Financial Center_10 Fairway Dr,10 Fairway Dr,South,Deerfield Beach,FL,33441.0,North Broward,O,980.0,Consolidated Insurance Group,Financial Services and Insurance,Renewal,Broward County,378901,,Suburban,51137809.0,8067220.0,0.157754509975193,28.9477406008124,33.9199561457898,,,,,,,,,900868.0,2018-Q3,Small,Financial_Services_and_Insurance_Small
2018,Q3,6.0,Tampa,Corporate Square,Tampa_North Pinellas_Clearwater_Corporate Square_28050 US Hwy 19 N,28050 US Hwy 19 N,South,Clearwater,FL,33761.0,North Pinellas,A,1139.0,Aflac,Financial Services and Insurance,New,Pinellas,382073,Relet,Suburban,22886282.0,2707233.0,0.118290642403165,28.972419485277,24.1469056423103,,,,,,,,,420570.0,2018-Q3,Small,Financial_Services_and_Insurance_Small
2018,Q3,6.0,Washington D.C.,Farragut Park,Washington D.C._Central Business District_Washington_Farragut Park_1701 K St NW,1701 K St NW,Northeast,Washington,DC,20006.0,Central Business District,O,835.0,Wachtel &,Financial Services and Insurance,New,,129080,Relet,CBD,,,,,,,,,,,,,,,2018-Q3,Small,Financial_Services_and_Insurance_Small
2018,Q3,7.0,Atlanta,3344 Peachtree,Atlanta_Buckhead_Atlanta_3344 Peachtree_3344 Peachtree Rd NE,3344 Peachtree Rd NE,South,Atlanta,GA,30326.0,Buckhead,A,5250.0,Hodges Ward Elliott,Financial Services and Insurance,Renewal,,518239,Relet,CBD,103659328.0,22206503.0,0.214225805129665,29.5072586063214,26.3933334340637,,,,,,,,,1929820.0,2018-Q3,Small,Financial_Services_and_Insurance_Small
2018,Q3,7.0,Atlanta,One Overton Park,Atlanta_Northwest_Atlanta_One Overton Park_3625 Cumberland Blvd SE,3625 Cumberland Blvd SE,South,Atlanta,GA,30339.0,Northwest,A,7322.0,"Onebeacon Insurance Group, Ltd",Financial Services and Insurance,Renewal,,436866,Relet,Suburban,103659328.0,22206503.0,0.214225805129665,29.5072586063214,26.3933334340637,,,,,,,,,1929820.0,2018-Q3,Small,Financial_Services_and_Insurance_Small
2018,Q3,7.0,Atlanta,,Atlanta_Northeast_Duluth_NA_2170 Satellite Blvd,2170 Satellite Blvd,South,Duluth,GA,30097.0,Northeast,A,3000.0,New York Life Insurance,Financial Services and Insurance,Renewal,,448068,Relet,Suburban,103659328.0,22206503.0,0.214225805129665,29.5072586063214,26.3933334340637,,,,,,,,,1929820.0,2018-Q3,Small,Financial_Services_and_Insurance_Small
2018,Q3,7.0,Charlotte,7401 Carmel Executive Park,Charlotte_Ballantyne / Highway 51_Charlotte_7401 Carmel Executive Park_7401 Carmel Executive Park,7401 Carmel Executive Park,South,Charlotte,NC,28226.0,Ballantyne / Highway 51,A,1200.0,Wfg National Insurance,Financial Services and Insurance,Renewal,,479818,Relet,Suburban,37279246.0,6131532.0,0.16447575146772,30.0780011074304,27.4602238556114,,,,,,,,,506425.0,2018-Q3,Small,Financial_Services_and_Insurance_Small
2018,Q3,7.0,Denver,Denver Corporate Center II,Denver_Southeast_Denver_Denver Corporate Center II_7800 E Union Ave,7800 E Union Ave,Midwest/Central,Denver,CO,80237.0,Southeast,O,4503.0,Wfg National Title,Financial Services and Insurance,New,,393677,Relet,Suburban,,,,,,,,,,,,,,,2018-Q3,Small,Financial_Services_and_Insurance_Small
2018,Q3,7.0,Manhattan,505 Fifth,Manhattan_Grand Central_New York_505 Fifth_505 Fifth Ave,505 Fifth Ave,Northeast,New York,NY,10017.0,Grand Central,A,8471.0,VFM,Financial Services and Insurance,New,Midtown,520821,Sublet,CBD,244542518.0,30684926.0,0.125478899338069,82.0305648880271,74.6320855266435,,,,,,,,,4198889.0,2018-Q3,Small,Financial_Services_and_Insurance_Small
2018,Q3,7.0,Manhattan,8589 Pine St,Manhattan_Financial District_New York_8589 Pine St_100 Wall St,100 Wall St,Northeast,New York,NY,10005.0,Financial District,A,4060.0,Octavian,Financial Services and Insurance,New,Downtown,157269,Relet,CBD,244542518.0,30684926.0,0.125478899338069,82.0305648880271,74.6320855266435,,,,,,,,,4198889.0,2018-Q3,Small,Financial_Services_and_Insurance_Small
2018,Q3,7.0,Manhattan,One Forty Broadway,Manhattan_Financial District_New York_One Forty Broadway_140 Broadway,140 Broadway,Northeast,New York,NY,10005.0,Financial District,A,4049.0,Sabr Group,Financial Services and Insurance,New,Downtown,157049,Relet,CBD,244542518.0,30684926.0,0.125478899338069,82.0305648880271,74.6320855266435,,,,,,,,,4198889.0,2018-Q3,Small,Financial_Services_and_Insurance_Small
2018,Q3,7.0,Manhattan,The Equitable Building,Manhattan_Financial District_New York_The Equitable Building_120 Broadway,120 Broadway,Northeast,New York,NY,10271.0,Financial District,A,6993.0,Mega International Commercial Bank,Financial Services and Insurance,,Downtown,157128,Relet,CBD,244542518.0,30684926.0,0.125478899338069,82.0305648880271,74.6320855266435,,,,,,,,,4198889.0,2018-Q3,Small,Financial_Services_and_Insurance_Small
2018,Q3,7.0,Manhattan,Tower 56,Manhattan_East Side / UN_New York_Tower 56_126 E 56th St,126 E 56th St,Northeast,New York,NY,10022.0,East Side / UN,A,5882.0,The Invus Group,Financial Services and Insurance,Renewal,Midtown,157213,Relet,CBD,244542518.0,30684926.0,0.125478899338069,82.0305648880271,74.6320855266435,,,,,,,,,4198889.0,2018-Q3,Small,Financial_Services_and_Insurance_Small
