year,quarter,monthsigned,market,building_name,building_id,address,region,city,state,zip,internal_submarket,internal_class,leasedSF,company_name,internal_industry,transaction_type,internal_market_cluster,costarID,space_type,CBD_suburban,RBA,available_space,availability_proportion,internal_class_rent,overall_rent,direct_available_space,direct_availability_proportion,direct_internal_class_rent,direct_overall_rent,sublet_available_space,sublet_availability_proportion,sublet_internal_class_rent,sublet_overall_rent,leasing,year-quarter,company_size,industry_size
2024,Q3,7.0,Northern New Jersey,,Northern New Jersey_Meadowlands_Lyndhurst_NA_125 Chubb Ave,125 Chubb Ave,Northeast,Lyndhurst,NJ,7071.0,Meadowlands,A,16210.0,Canon U.s.a,"Technology, Advertising, Media, and Information",Renewal,,161430,Relet,Suburban,114304619.0,32302488.0,0.282600023363885,32.6759192544602,31.357191562086,25475084.0,0.1696,33.3167,31.797385,6827404.0,0.0454,28.696563,28.211692,2097653.0,2024-Q3,Medium,Technology_Advertising_Media_and_Information_Medium
2024,Q3,7.0,Northern Virginia,Hallmark Building,Northern Virginia_Route 28 South / Chantilly_Herndon_Hallmark Building_13873 Park Center Rd,13873 Park Center Rd,Northeast,Herndon,VA,20171.0,Route 28 South / Chantilly,A,13296.0,Dexter Edward,"Technology, Advertising, Media, and Information",Renewal,Fairfax County,134884,Relet,Suburban,102893538.0,28913622.0,0.281005226975478,36.5510508834729,35.4774200018329,25123791.0,0.1672,37.286403,36.113798,3789831.0,0.0252,31.304471,30.298121,1927006.0,2024-Q3,Medium,Technology_Advertising_Media_and_Information_Medium
2024,Q3,7.0,Northern Virginia,,Northern Virginia_Merrifield / Route 50_Falls Church_NA_3120 Fairview Park Dr,3120 Fairview Park Dr,Northeast,Falls Church,VA,22042.0,Merrifield / Route 50,A,24505.0,Spinsys,"Technology, Advertising, Media, and Information",Renewal,Arlington County,136815,Relet,Suburban,102893538.0,28913622.0,0.281005226975478,36.5510508834729,35.4774200018329,25123791.0,0.1672,37.286403,36.113798,3789831.0,0.0252,31.304471,30.298121,1927006.0,2024-Q3,Medium,Technology_Advertising_Media_and_Information_Medium
2024,Q3,7.0,Orange County,,Orange County_Central County_Orange_NA_999 W Town and Country Rd,999 W Town and Country Rd,West,Orange,CA,92868.0,Central County,O,24390.0,Apn Software Services,"Technology, Advertising, Media, and Information",New,,280686,Sublet,Suburban,,,,,,,,,,,,,,,2024-Q3,Medium,Technology_Advertising_Media_and_Information_Medium
2024,Q3,7.0,Phoenix,Papago Spectrum Office Building,Phoenix_Tempe_Tempe_Papago Spectrum Office Building_1225 W Washington St,1225 W Washington St,West,Tempe,AZ,85281.0,Tempe,A,15054.0,Crexendo,"Technology, Advertising, Media, and Information",New,East Valley,224714,Sublet,Suburban,49727660.0,16841862.0,0.338681972970375,32.5092652798307,30.5173389876834,12972075.0,0.1233,34.01643,31.593573,3869787.0,0.0368,27.37704,26.68151,767860.0,2024-Q3,Medium,Technology_Advertising_Media_and_Information_Medium
2024,Q3,7.0,Salt Lake City,Six Gateway,Salt Lake City_CBD-Periphery_Salt Lake City_Six Gateway_460 W 50 N,460 W 50 N,West,Salt Lake City,UT,84101.0,CBD-Periphery,A,19327.0,Addepar,"Technology, Advertising, Media, and Information",Renewal,,6585106,Relet,Suburban,21820276.0,4888642.0,0.22404125410696,30.2189197630707,27.3415666720641,3540015.0,0.0752,32.062879,28.205337,1348627.0,0.0286,25.094579,23.906419,478344.0,2024-Q3,Medium,Technology_Advertising_Media_and_Information_Medium
2024,Q3,7.0,Seattle,411 First,Seattle_Pioneer Sq/SoDo_Seattle_411 First_411 1st Ave S,411 1st Ave S,West,Seattle,WA,98104.0,Pioneer Sq/SoDo,O,19000.0,WPP,"Technology, Advertising, Media, and Information",New,,470448,Relet,CBD,52318235.0,13070540.0,0.249827617464542,35.5271752536807,44.2772895897853,10713630.0,0.0871,36.365381,46.271885,2356910.0,0.0192,31.715701,36.338047,588142.0,2024-Q3,Medium,Technology_Advertising_Media_and_Information_Medium
2024,Q3,7.0,South Bay/San Jose,2033 Concourse Dr,South Bay/San Jose_North San Jose_San Jose_2033 Concourse Dr_2160 Lundy Ave,2160 Lundy Ave,West,San Jose,CA,95131.0,North San Jose,O,22629.0,Pcow,"Technology, Advertising, Media, and Information",New,,308699,Relet,Suburban,,,,,,,,,,,,,,,2024-Q3,Medium,Technology_Advertising_Media_and_Information_Medium
2024,Q3,7.0,South Bay/San Jose,Sunnyvale CityLine,South Bay/San Jose_Sunnyvale/Cupertino_Sunnyvale_Sunnyvale CityLine_150 Mathilda Pl,150 Mathilda Pl,West,Sunnyvale,CA,94086.0,Sunnyvale/Cupertino,A,22663.0,Uber,"Technology, Advertising, Media, and Information",New,,505344,Relet,CBD,,,,,,,,,,,,,,,2024-Q3,Medium,Technology_Advertising_Media_and_Information_Medium
2024,Q3,7.0,South Bay/San Jose,,South Bay/San Jose_Campbell/Los Gatos_Saratoga_NA_12900 Saratoga Ave,12900 Saratoga Ave,West,Saratoga,CA,95070.0,Campbell/Los Gatos,O,22995.0,Eridu Ai,"Technology, Advertising, Media, and Information",New,,303438,Relet,Suburban,,,,,,,,,,,,,,,2024-Q3,Medium,Technology_Advertising_Media_and_Information_Medium
2024,Q3,7.0,Southern Maryland,,Southern Maryland_Rockville_Rockville_NA_77 Upper Rock Cir,77 Upper Rock Cir,Northeast,Rockville,MD,20850.0,Rockville,A,22363.0,Cisco,"Technology, Advertising, Media, and Information",New,,132309,Relet,Suburban,,,,,,,,,,,,,,,2024-Q3,Medium,Technology_Advertising_Media_and_Information_Medium
2024,Q3,7.0,Tampa,Truist Place,Tampa_Tampa CBD_Tampa_Truist Place_401 E Jackson St,401 E Jackson St,South,Tampa,FL,33602.0,Tampa CBD,A,13999.0,Justworks,"Technology, Advertising, Media, and Information",New,Hillsborough,380228,Sublet,CBD,25106444.0,6272033.0,0.249817656375391,33.6312984859457,30.2040414076123,4396567.0,0.0813,34.457689,30.7281,1875466.0,0.0347,25.827943,24.690256,580823.0,2024-Q3,Medium,Technology_Advertising_Media_and_Information_Medium
2024,Q3,7.0,Washington D.C.,,Washington D.C._East End_Washington_NA_1331 F St NW,1331 F St NW,Northeast,Washington,DC,20004.0,East End,A,11896.0,Teleport Communications America,"Technology, Advertising, Media, and Information",Renewal and Expansion,,129201,Relet,CBD,,,,,,,,,,,,,,,2024-Q3,Medium,Technology_Advertising_Media_and_Information_Medium
2024,Q3,7.0,Washington D.C.,,Washington D.C._Capitol Hill_Washington_NA_601 New Jersey Ave NW,601 New Jersey Ave NW,Northeast,Washington,DC,20001.0,Capitol Hill,A,14789.0,Ncs Pearson,"Technology, Advertising, Media, and Information",Renewal,,130671,Relet,CBD,,,,,,,,,,,,,,,2024-Q3,Medium,Technology_Advertising_Media_and_Information_Medium
2024,Q3,8.0,Atlanta,Ponce City Market  Main Building,Atlanta_Midtown_Atlanta_Ponce City Market  Main Building_675 Ponce de Leon Ave NE,675 Ponce de Leon Ave NE,South,Atlanta,GA,30308.0,Midtown,A,16442.0,Samsara,"Technology, Advertising, Media, and Information",New,,8277016,Sublet,CBD,113141200.0,40048984.0,0.353973477389315,35.0552203004165,32.5692065343474,33723658.0,0.1905,36.216166,33.704949,6325326.0,0.0357,28.330026,26.181667,1761038.0,2024-Q3,Medium,Technology_Advertising_Media_and_Information_Medium
2024,Q3,8.0,Austin,Centro  Northern,Austin_East_Austin_Centro  Northern_1401 E 6th St,1401 E 6th St,South,Austin,TX,78702.0,East,A,16903.0,Qualia,"Technology, Advertising, Media, and Information",New,,11162910,Relet,Suburban,46533411.0,16009071.0,0.34403390286605,51.258086067257,46.5241772824577,12085512.0,0.1605,52.531993,47.521234,3923559.0,0.0521,47.55274,43.375982,997318.0,2024-Q3,Medium,Technology_Advertising_Media_and_Information_Medium
2024,Q3,8.0,Austin,Frost Bank Tower,Austin_CBD_Austin_Frost Bank Tower_401 Congress Ave,401 Congress Ave,South,Austin,TX,78701.0,CBD,A,26607.0,Rapid7,"Technology, Advertising, Media, and Information",Restructure,,668362,Relet,CBD,46533411.0,16009071.0,0.34403390286605,51.258086067257,46.5241772824577,12085512.0,0.1605,52.531993,47.521234,3923559.0,0.0521,47.55274,43.375982,997318.0,2024-Q3,Medium,Technology_Advertising_Media_and_Information_Medium
2024,Q3,8.0,Austin,The Park,Austin_Northwest_Austin_The Park_8300 N MoPac Expy,8300 N MoPac Expy,South,Austin,TX,78759.0,Northwest,A,22022.0,Av Ride,"Technology, Advertising, Media, and Information",Relocation,,591634,Sublet,Suburban,46533411.0,16009071.0,0.34403390286605,51.258086067257,46.5241772824577,12085512.0,0.1605,52.531993,47.521234,3923559.0,0.0521,47.55274,43.375982,997318.0,2024-Q3,Medium,Technology_Advertising_Media_and_Information_Medium
2024,Q3,8.0,Austin,Victory Plaza,Austin_Central_Austin_Victory Plaza_5209 Burnet Rd,5209 Burnet Rd,South,Austin,TX,78756.0,Central,A,11684.0,Realwork Labs,"Technology, Advertising, Media, and Information",New,,11383857,Relet,Suburban,46533411.0,16009071.0,0.34403390286605,51.258086067257,46.5241772824577,12085512.0,0.1605,52.531993,47.521234,3923559.0,0.0521,47.55274,43.375982,997318.0,2024-Q3,Medium,Technology_Advertising_Media_and_Information_Medium
2024,Q3,8.0,Denver,McGregor Square Office,Denver_LoDo / Platte / RiNo_Denver_McGregor Square Office_1601 19th St,1601 19th St,Midwest/Central,Denver,CO,80202.0,LoDo / Platte / RiNo,A,25000.0,Redaptive,"Technology, Advertising, Media, and Information",Relocation,Downtown Denver,11130518,Sublet,CBD,,,,,,,,,,,,,,,2024-Q3,Medium,Technology_Advertising_Media_and_Information_Medium
2024,Q3,8.0,Los Angeles,5915 Sepulveda Blvd,Los Angeles_Culver City_Culver City_5915 Sepulveda Blvd_5995 S Sepulveda Blvd,5995 S Sepulveda Blvd,West,Culver City,CA,90230.0,Culver City,O,27090.0,Woo You Dating App,"Technology, Advertising, Media, and Information",New,Westside,121587,Relet,CBD,70973458.0,18490079.0,0.260521038724082,41.1596724093086,46.8546568289022,15679818.0,0.0719,41.931004,48.705689,2810261.0,0.0129,36.858983,38.344446,1239955.0,2024-Q3,Medium,Technology_Advertising_Media_and_Information_Medium
2024,Q3,8.0,Los Angeles,,Los Angeles_Hollywood_Los Angeles_NA_706-720 N Cahuenga Blvd,706-720 N Cahuenga Blvd,West,Los Angeles,CA,90038.0,Hollywood,O,25609.0,Passes,"Technology, Advertising, Media, and Information",New,Westside,9522101,Relet,CBD,70973458.0,18490079.0,0.260521038724082,41.1596724093086,46.8546568289022,15679818.0,0.0719,41.931004,48.705689,2810261.0,0.0129,36.858983,38.344446,1239955.0,2024-Q3,Medium,Technology_Advertising_Media_and_Information_Medium
2024,Q3,8.0,Manhattan,1115 Broadway,Manhattan_Flatiron_New York_1115 Broadway_16 Madison Square W,16 Madison Square W,Northeast,New York,NY,10010.0,Flatiron,O,24005.0,Wellcom Worldwide,"Technology, Advertising, Media, and Information",Relocation,Midtown South,157897,Relet,CBD,198553779.0,39959005.0,0.201250286956261,61.65304255607,75.9093678931504,33133297.0,0.0711,64.788593,80.836168,6825708.0,0.0146,45.467794,57.972647,3818375.0,2024-Q3,Medium,Technology_Advertising_Media_and_Information_Medium
2024,Q3,8.0,Manhattan,1239 Broadway,Manhattan_Penn Plaza/Times Square South_New York_1239 Broadway_1237-1239 Broadway,1237-1239 Broadway,Northeast,New York,NY,10001.0,Penn Plaza/Times Square South,O,12040.0,Middesk,"Technology, Advertising, Media, and Information",Relocation,Midtown,157618,Relet,CBD,198553779.0,39959005.0,0.201250286956261,61.65304255607,75.9093678931504,33133297.0,0.0711,64.788593,80.836168,6825708.0,0.0146,45.467794,57.972647,3818375.0,2024-Q3,Medium,Technology_Advertising_Media_and_Information_Medium
2024,Q3,8.0,Nashville,Cool Springs Commons I  II,Nashville_Cool Springs_Brentwood_Cool Springs Commons I  II_7100 Commerce Way,7100 Commerce Way,South,Brentwood,TN,37027.0,Cool Springs,A,27507.0,Flexential,"Technology, Advertising, Media, and Information",Renewal,South Nashville,810553,,Suburban,28459423.0,7490660.0,0.263204914590152,37.7100713136719,34.8796449614342,6367446.0,0.1242,38.657609,35.521388,1123214.0,0.0219,32.403955,31.038434,759522.0,2024-Q3,Medium,Technology_Advertising_Media_and_Information_Medium
2024,Q3,8.0,Northern Virginia,SOMA  C at Reston Town Center,Northern Virginia_Reston / Herndon_Reston_SOMA  C at Reston Town Center_1818 Library St,1818 Library St,Northeast,Reston,VA,20190.0,Reston / Herndon,A,23509.0,Meta,"Technology, Advertising, Media, and Information",Renewal,Fairfax County,781080,Relet,Suburban,102893538.0,28913622.0,0.281005226975478,36.5510508834729,35.4774200018329,25123791.0,0.1672,37.286403,36.113798,3789831.0,0.0252,31.304471,30.298121,1927006.0,2024-Q3,Medium,Technology_Advertising_Media_and_Information_Medium
2024,Q3,8.0,San Francisco,Phelan Building,San Francisco_Union Square/Civic Center_San Francisco_Phelan Building_760 Market St,760 Market St,West,San Francisco,CA,94102.0,Union Square/Civic Center,O,24723.0,Volley,"Technology, Advertising, Media, and Information",New,,320652,Sublet,CBD,32205896.0,13105930.0,0.406941946282134,57.9138513964807,68.2170675700458,9632459.0,0.1084,58.358791,71.752706,3473471.0,0.0391,56.687956,57.653946,366237.0,2024-Q3,Medium,Technology_Advertising_Media_and_Information_Medium
2024,Q3,8.0,San Francisco,Stevenson Place,San Francisco_Financial District South_San Francisco_Stevenson Place_71 Stevenson St,71 Stevenson St,West,San Francisco,CA,94105.0,Financial District South,A,14450.0,Sprig,"Technology, Advertising, Media, and Information",New,,320908,Relet,CBD,56633008.0,19441595.0,0.343290877291914,75.1027032458946,68.2170675700458,14768384.0,0.1662,80.400491,71.752706,4673211.0,0.0526,58.368366,57.653946,1345703.0,2024-Q3,Medium,Technology_Advertising_Media_and_Information_Medium
2024,Q3,8.0,San Francisco,,San Francisco_Financial District South_San Francisco_NA_350 Mission St,350 Mission St,West,San Francisco,CA,94105.0,Financial District South,A,17894.0,Walkme,"Technology, Advertising, Media, and Information",Relocation,,6856267,Sublet,CBD,56633008.0,19441595.0,0.343290877291914,75.1027032458946,68.2170675700458,14768384.0,0.1662,80.400491,71.752706,4673211.0,0.0526,58.368366,57.653946,1345703.0,2024-Q3,Medium,Technology_Advertising_Media_and_Information_Medium
2024,Q3,8.0,South Bay/San Jose,One Santana West,South Bay/San Jose_South San Jose_San Jose_One Santana West_3155 Olsen Dr,3155 Olsen Dr,West,San Jose,CA,95101.0,South San Jose,A,23684.0,Couchbase,"Technology, Advertising, Media, and Information",New,,11074531,Relet,Suburban,,,,,,,,,,,,,,,2024-Q3,Medium,Technology_Advertising_Media_and_Information_Medium
2024,Q3,8.0,South Bay/San Jose,,South Bay/San Jose_Mountain View/Los Altos_Mountain View_NA_401 Castro St,401 Castro St,West,Mountain View,CA,94041.0,Mountain View/Los Altos,O,12821.0,Id.me,"Technology, Advertising, Media, and Information",New,,53939,Relet,Suburban,,,,,,,,,,,,,,,2024-Q3,Medium,Technology_Advertising_Media_and_Information_Medium
2024,Q3,8.0,South Florida,6100 Waterford Office,South Florida_West Miami/Airport_Miami_6100 Waterford Office_6100 Waterford District Dr,6100 Waterford District Dr,South,Miami,FL,33126.0,West Miami/Airport,O,12482.0,Cloud Software Group,"Technology, Advertising, Media, and Information",New,Miami-Dade County,379132,,Suburban,51435120.0,8708642.0,0.169313146348254,36.2721833646185,45.6168749796374,7507398.0,0.0704,36.32649,45.645608,1201244.0,0.0113,35.772617,45.395623,959832.0,2024-Q3,Medium,Technology_Advertising_Media_and_Information_Medium
2024,Q3,8.0,South Florida,The Plaza Coral Gables  North Tower Office,South Florida_Coral Gables/Grove_Coral Gables_The Plaza Coral Gables  North Tower Office_2811 Ponce de Leon Blvd,2811 Ponce de Leon Blvd,South,Coral Gables,FL,33134.0,Coral Gables/Grove,A,27712.0,KANDJI,"Technology, Advertising, Media, and Information",New,Miami-Dade County,10573297,,CBD,55208986.0,11452359.0,0.207436503180841,52.638180370186,45.6168749796374,9837601.0,0.0922,52.608146,45.645608,1614758.0,0.0151,52.992592,45.395623,1405444.0,2024-Q3,Medium,Technology_Advertising_Media_and_Information_Medium
2024,Q3,8.0,Southern Maryland,One Washingtonian Center,Southern Maryland_Rockville_Gaithersburg_One Washingtonian Center_9801 Washingtonian Blvd,9801 Washingtonian Blvd,Northeast,Gaithersburg,MD,20878.0,Rockville,A,15959.0,General Dynamics Information Technology,"Technology, Advertising, Media, and Information",New,,130832,Relet,Suburban,,,,,,,,,,,,,,,2024-Q3,Medium,Technology_Advertising_Media_and_Information_Medium
2024,Q3,9.0,Chicago Suburbs,Cumberland Centre,Chicago Suburbs_O'Hare Area_Chicago_Cumberland Centre_5440 N Cumberland Ave,5440 N Cumberland Ave,Midwest/Central,Chicago,IL,60656.0,O'Hare Area,O,13977.0,Zynga,"Technology, Advertising, Media, and Information",Relocation,,145104,Relet,Suburban,44481807.0,12156242.0,0.273285705322178,22.0696163703652,27.1199277785149,11523622.0,0.119,22.191171,27.516841,632620.0,0.0065,18.992978,19.603286,262808.0,2024-Q3,Medium,Technology_Advertising_Media_and_Information_Medium
2024,Q3,9.0,Manhattan,52 W 53rd St,Manhattan_Plaza South_New York_52 W 53rd St_51 W 52nd St,51 W 52nd St,Northeast,New York,NY,10019.0,Plaza South,A,24252.0,Computershare,"Technology, Advertising, Media, and Information",Relocation,Midtown,91488,Relet,CBD,267569157.0,51717931.0,0.193288088880887,85.4876840476282,75.9093678931504,38788015.0,0.0832,92.898646,80.836168,12929916.0,0.0277,63.399877,57.972647,5697897.0,2024-Q3,Medium,Technology_Advertising_Media_and_Information_Medium
2018,Q4,9.0,Dallas/Ft Worth,,Dallas/Ft Worth_North Dallas Corridor_Plano_NA_6100 W Plano Pky,6100 W Plano Pky,South,Plano,TX,75093.0,North Dallas Corridor,A,20792.0,Keste,"Technology, Advertising, Media, and Information",Renewal,,5646135,,Suburban,,,,,,,,,,,,,,,2018-Q4,Medium,Technology_Advertising_Media_and_Information_Medium
2018,Q4,9.0,Los Angeles,1999 Avenue of the Stars,Los Angeles_Century City_Los Angeles_1999 Avenue of the Stars_1999 Avenue of the Stars,1999 Avenue of the Stars,West,Los Angeles,CA,90067.0,Century City,A,20684.0,Factual,"Technology, Advertising, Media, and Information",New,Westside,42172,Relet,CBD,144721671.0,24918510.0,0.172182298807205,41.501803130904,38.758575652246,,,,,,,,,3679718.0,2018-Q4,Medium,Technology_Advertising_Media_and_Information_Medium
2018,Q4,9.0,Northern Virginia,Arlington Gateway,Northern Virginia_Ballston_Arlington_Arlington Gateway_901 N Glebe Rd,901 N Glebe Rd,Northeast,Arlington,VA,22203.0,Ballston,A,16527.0,Rapid7,"Technology, Advertising, Media, and Information",New,Arlington County,137456,Relet,Suburban,98785668.0,22201031.0,0.224739392358009,34.3963200551224,32.6030846355442,,,,,,,,,2807514.0,2018-Q4,Medium,Technology_Advertising_Media_and_Information_Medium
2018,Q4,9.0,Northern Virginia,Dulles View South,Northern Virginia_Reston / Herndon_Herndon_Dulles View South_2553 Dulles View Dr,2553 Dulles View Dr,Northeast,Herndon,VA,20171.0,Reston / Herndon,A,23478.0,Amdocs,"Technology, Advertising, Media, and Information",New,Fairfax County,361631,Relet,Suburban,98785668.0,22201031.0,0.224739392358009,34.3963200551224,32.6030846355442,,,,,,,,,2807514.0,2018-Q4,Medium,Technology_Advertising_Media_and_Information_Medium
2018,Q4,9.0,Northern Virginia,,Northern Virginia_Old Town Alexandria_Alexandria_NA_1900 Duke St,1900 Duke St,Northeast,Alexandria,VA,22314.0,Old Town Alexandria,A,15954.0,Fireeye,"Technology, Advertising, Media, and Information",New,Alexandria,138132,Relet,Suburban,98785668.0,22201031.0,0.224739392358009,34.3963200551224,32.6030846355442,,,,,,,,,2807514.0,2018-Q4,Medium,Technology_Advertising_Media_and_Information_Medium
2018,Q4,9.0,South Bay/San Jose,Bldg 3,South Bay/San Jose_Sunnyvale/Cupertino_Cupertino_Bldg 3_20400 Stevens Creek Blvd,20400 Stevens Creek Blvd,West,Cupertino,CA,95014.0,Sunnyvale/Cupertino,A,23549.0,Amazon,"Technology, Advertising, Media, and Information",New,,311733,Relet,CBD,,,,,,,,,,,,,,,2018-Q4,Medium,Technology_Advertising_Media_and_Information_Medium
2018,Q4,9.0,South Bay/San Jose,Bldg 3,South Bay/San Jose_Sunnyvale/Cupertino_Cupertino_Bldg 3_20400 Stevens Creek Blvd,20400 Stevens Creek Blvd,West,Cupertino,CA,95014.0,Sunnyvale/Cupertino,A,24704.0,Amazon,"Technology, Advertising, Media, and Information",New,,311733,Relet,CBD,,,,,,,,,,,,,,,2018-Q4,Medium,Technology_Advertising_Media_and_Information_Medium
2018,Q4,9.0,South Bay/San Jose,Bldg 3,South Bay/San Jose_Sunnyvale/Cupertino_Cupertino_Bldg 3_20400 Stevens Creek Blvd,20400 Stevens Creek Blvd,West,Cupertino,CA,95014.0,Sunnyvale/Cupertino,A,27125.0,Amazon,"Technology, Advertising, Media, and Information",New,,311733,Relet,CBD,,,,,,,,,,,,,,,2018-Q4,Medium,Technology_Advertising_Media_and_Information_Medium
2018,Q4,9.0,South Florida,Fountain Square 3,South Florida_Boca Raton_Boca Raton_Fountain Square 3_2700 N Military Trl,2700 N Military Trl,South,Boca Raton,FL,33431.0,Boca Raton,A,11681.0,Orbcomm,"Technology, Advertising, Media, and Information",New,Palm Beach County,381128,Relet,Suburban,51924594.0,9297579.0,0.179059252730989,38.6694463158087,34.0042246658206,,,,,,,,,707773.0,2018-Q4,Medium,Technology_Advertising_Media_and_Information_Medium
2018,Q4,10.0,Atlanta,,Atlanta_Northeast_Duluth_NA_4375 River Green Pky,4375 River Green Pky,South,Duluth,GA,30096.0,Northeast,O,23000.0,Ccur Holdings,"Technology, Advertising, Media, and Information",Renewal,,448126,Relet,Suburban,66210064.0,11722491.0,0.177049987446017,20.9968023073047,26.4885667259604,,,,,,,,,733452.0,2018-Q4,Medium,Technology_Advertising_Media_and_Information_Medium
2018,Q4,10.0,Dallas/Ft Worth,Building D,Dallas/Ft Worth_Richardson Telecom Corridor_Richardson_Building D_2400 N Glenville Dr,2400 N Glenville Dr,South,Richardson,TX,75082.0,Richardson Telecom Corridor,A,24309.0,Calamp,"Technology, Advertising, Media, and Information",New,,680662,Relet,Suburban,,,,,,,,,,,,,,,2018-Q4,Medium,Technology_Advertising_Media_and_Information_Medium
2018,Q4,10.0,Manhattan,111123 38th St,Manhattan_Penn Plaza/Times Square South_New York_111123 38th St_1400 Broadway,1400 Broadway,Northeast,New York,NY,10018.0,Penn Plaza/Times Square South,O,14307.0,Uber,"Technology, Advertising, Media, and Information",Expansion,Midtown,157163,Relet,CBD,199870492.0,18953645.0,0.0948296309792443,61.4446490070472,77.408112510696,,,,,,,,,5143430.0,2018-Q4,Medium,Technology_Advertising_Media_and_Information_Medium
2018,Q4,10.0,Manhattan,17 State Street,Manhattan_Financial District_New York_17 State Street_17 State St,17 State St,Northeast,New York,NY,10004.0,Financial District,A,13100.0,Ddcd & Partners,"Technology, Advertising, Media, and Information",Renewal,Downtown,157109,,CBD,246759127.0,28690887.0,0.116270823895401,86.498436481122,77.408112510696,,,,,,,,,6598763.0,2018-Q4,Medium,Technology_Advertising_Media_and_Information_Medium
2018,Q4,10.0,Manhattan,32 OS,Manhattan_Financial District_New York_32 OS_32 Old Slip,32 Old Slip,Northeast,New York,NY,10005.0,Financial District,A,15518.0,Decoded Advertising,"Technology, Advertising, Media, and Information",New,Downtown,157172,Relet,CBD,246759127.0,28690887.0,0.116270823895401,86.498436481122,77.408112510696,,,,,,,,,6598763.0,2018-Q4,Medium,Technology_Advertising_Media_and_Information_Medium
2018,Q4,10.0,Manhattan,4 World Trade Center,Manhattan_WTC/Brookfield Place_New York_4 World Trade Center_4 World Trade Center,4 World Trade Center,Northeast,New York,NY,10280.0,WTC/Brookfield Place,A,19000.0,Digital Asset,"Technology, Advertising, Media, and Information",Relocation,Downtown,5010977,,CBD,246759127.0,28690887.0,0.116270823895401,86.498436481122,77.408112510696,,,,,,,,,6598763.0,2018-Q4,Medium,Technology_Advertising_Media_and_Information_Medium
2018,Q4,10.0,Manhattan,One Liberty Plaza,Manhattan_WTC/Brookfield Place_New York_One Liberty Plaza_1 Liberty Plz,1 Liberty Plz,Northeast,New York,NY,10006.0,WTC/Brookfield Place,A,14851.0,Stylus Styles,"Technology, Advertising, Media, and Information",Renewal,Downtown,157043,Relet,CBD,246759127.0,28690887.0,0.116270823895401,86.498436481122,77.408112510696,,,,,,,,,6598763.0,2018-Q4,Medium,Technology_Advertising_Media_and_Information_Medium
2018,Q4,10.0,Northern Virginia,EastBoro III,Northern Virginia_Tysons Corner_Tysons_EastBoro III_8281 Greensboro Dr,8281 Greensboro Dr,Northeast,Tysons,VA,22102.0,Tysons Corner,A,23493.0,Alarm.com,"Technology, Advertising, Media, and Information",Expansion,Fairfax County,136301,,Suburban,98785668.0,22201031.0,0.224739392358009,34.3963200551224,32.6030846355442,,,,,,,,,2807514.0,2018-Q4,Medium,Technology_Advertising_Media_and_Information_Medium
2018,Q4,10.0,Northern Virginia,Westpark Corporate Center Building I,Northern Virginia_Tysons Corner_McLean_Westpark Corporate Center Building I_8484 Westpark Dr,8484 Westpark Dr,Northeast,McLean,VA,22102.0,Tysons Corner,A,26784.0,Aireon,"Technology, Advertising, Media, and Information",New,Fairfax County,135821,Relet,Suburban,98785668.0,22201031.0,0.224739392358009,34.3963200551224,32.6030846355442,,,,,,,,,2807514.0,2018-Q4,Medium,Technology_Advertising_Media_and_Information_Medium
2018,Q4,10.0,Seattle,US Bank Plaza,Seattle_Bellevue CBD_Bellevue_US Bank Plaza_10800 NE 8th St,10800 NE 8th St,West,Bellevue,WA,98004.0,Bellevue CBD,A,14941.0,Auth0,"Technology, Advertising, Media, and Information",New,,470011,Relet,CBD,60100882.0,7413798.0,0.123355893512511,47.4470494606347,37.718775402664,,,,,,,,,1493062.0,2018-Q4,Medium,Technology_Advertising_Media_and_Information_Medium
2018,Q4,10.0,South Bay/San Jose,100 Mathilda Pl,South Bay/San Jose_Sunnyvale/Cupertino_Sunnyvale_100 Mathilda Pl_100 Mathilda Pl,100 Mathilda Pl,West,Sunnyvale,CA,94086.0,Sunnyvale/Cupertino,A,12825.0,Niantic,"Technology, Advertising, Media, and Information",New,,505394,Relet,CBD,,,,,,,,,,,,,,,2018-Q4,Medium,Technology_Advertising_Media_and_Information_Medium
2018,Q4,10.0,South Bay/San Jose,,South Bay/San Jose_Palo Alto_Palo Alto_NA_395 Page Mill Rd,395 Page Mill Rd,West,Palo Alto,CA,94306.0,Palo Alto,O,12082.0,Jumio,"Technology, Advertising, Media, and Information",New,,311927,Sublet,CBD,,,,,,,,,,,,,,,2018-Q4,Medium,Technology_Advertising_Media_and_Information_Medium
