year,quarter,monthsigned,market,building_name,building_id,address,region,city,state,zip,internal_submarket,internal_class,leasedSF,company_name,internal_industry,transaction_type,internal_market_cluster,costarID,space_type,CBD_suburban,RBA,available_space,availability_proportion,internal_class_rent,overall_rent,direct_available_space,direct_availability_proportion,direct_internal_class_rent,direct_overall_rent,sublet_available_space,sublet_availability_proportion,sublet_internal_class_rent,sublet_overall_rent,leasing,year-quarter,company_size,industry_size
2018,Q2,3.0,Seattle,Skyline Tower,Seattle_Bellevue CBD_Bellevue_Skyline Tower_10900 NE 4th St,10900 NE 4th St,West,Bellevue,WA,98004.0,Bellevue CBD,A,18534.0,Dassault Systemes,"Technology, Advertising, Media, and Information",New,,469978,Relet,CBD,59888882.0,6949260.0,0.116035894608953,46.3665820388765,35.245030932464,,,,,,,,,1033678.0,2018-Q2,Medium,Technology_Advertising_Media_and_Information_Medium
2018,Q2,3.0,Washington D.C.,Hall of the States Building,Washington D.C._Capitol Hill_Washington_Hall of the States Building_400-444 N Capitol St NW,400-444 N Capitol St NW,Northeast,Washington,DC,20001.0,Capitol Hill,O,12098.0,Nbc News,"Technology, Advertising, Media, and Information",New,,129661,Relet,CBD,,,,,,,,,,,,,,,2018-Q2,Medium,Technology_Advertising_Media_and_Information_Medium
2018,Q2,4.0,Atlanta,King,Atlanta_Central Perimeter_Atlanta_King_6 Concourse Pky NE,6 Concourse Pky NE,South,Atlanta,GA,30328.0,Central Perimeter,A,25234.0,Codemettle,"Technology, Advertising, Media, and Information",New,,113004,Relet,Suburban,103299677.0,21402315.0,0.207186659451026,29.2519005754806,26.0678750972516,,,,,,,,,1440017.0,2018-Q2,Medium,Technology_Advertising_Media_and_Information_Medium
2018,Q2,4.0,Boston,25 Thomson Place,Boston_Seaport/South Boston_Boston_25 Thomson Place_25-29 Thomson Pl,25-29 Thomson Pl,Northeast,Boston,MA,2210.0,Seaport/South Boston,O,26961.0,Seismic Software,"Technology, Advertising, Media, and Information",New,Boston/Suffolk County,223594,Relet,CBD,116186937.0,15267730.0,0.131406596939551,21.9669104443961,35.2171633843862,,,,,,,,,1126223.0,2018-Q2,Medium,Technology_Advertising_Media_and_Information_Medium
2018,Q2,4.0,Denver,Dairy Block,Denver_LoDo / Platte / RiNo_Denver_Dairy Block_1800-1890 Wazee St,1800-1890 Wazee St,Midwest/Central,Denver,CO,80202.0,LoDo / Platte / RiNo,A,18653.0,Apple,"Technology, Advertising, Media, and Information",New,Downtown Denver,9159550,New,CBD,,,,,,,,,,,,,,,2018-Q2,Medium,Technology_Advertising_Media_and_Information_Medium
2018,Q2,4.0,Los Angeles,Hollywood Production Center 4,Los Angeles_Hollywood_Los Angeles_Hollywood Production Center 4_6350 Santa Monica Blvd,6350 Santa Monica Blvd,West,Los Angeles,CA,90038.0,Hollywood,O,25999.0,Hollywood Production Center,"Technology, Advertising, Media, and Information",New,Westside,254983,New,CBD,69043674.0,11504788.0,0.166630588053585,31.8206520058974,36.5813015155726,,,,,,,,,1003714.0,2018-Q2,Medium,Technology_Advertising_Media_and_Information_Medium
2018,Q2,4.0,Manhattan,17 State Street,Manhattan_Financial District_New York_17 State Street_17 State St,17 State St,Northeast,New York,NY,10004.0,Financial District,A,17000.0,Aaptiv,"Technology, Advertising, Media, and Information",Relocation,Downtown,157109,Relet,CBD,244192517.0,29535879.0,0.120953251814838,82.0331156463172,73.9042202835504,,,,,,,,,6703076.0,2018-Q2,Medium,Technology_Advertising_Media_and_Information_Medium
2018,Q2,4.0,Manhattan,259263 Fifth Ave,Manhattan_Park Avenue South_New York_259263 Fifth Ave_261 Fifth Ave,261 Fifth Ave,Northeast,New York,NY,10016.0,Park Avenue South,O,23396.0,Media Iq Digital,"Technology, Advertising, Media, and Information",New,Midtown South,157312,Relet,CBD,199870492.0,20756796.0,0.103851227824065,62.1751199680751,73.9042202835504,,,,,,,,,4324015.0,2018-Q2,Medium,Technology_Advertising_Media_and_Information_Medium
2018,Q2,4.0,Manhattan,5359 25th St,Manhattan_Park Avenue South_New York_5359 25th St_352 Park Ave S,352 Park Ave S,Northeast,New York,NY,10010.0,Park Avenue South,O,12200.0,Magrino Pr,"Technology, Advertising, Media, and Information",Relocation,Midtown South,157652,Relet,CBD,199870492.0,20756796.0,0.103851227824065,62.1751199680751,73.9042202835504,,,,,,,,,4324015.0,2018-Q2,Medium,Technology_Advertising_Media_and_Information_Medium
2018,Q2,4.0,San Francisco,551 Kearny St,San Francisco_Financial District North_San Francisco_551 Kearny St_600 California St,600 California St,West,San Francisco,CA,94108.0,Financial District North,A,14642.0,Zignal Labs,"Technology, Advertising, Media, and Information",New,,320445,Sublet,CBD,46050495.0,4027372.0,0.087455563724125,68.9639384422598,66.5293843664807,,,,,,,,,2194536.0,2018-Q2,Medium,Technology_Advertising_Media_and_Information_Medium
2018,Q2,4.0,San Francisco,,San Francisco_Financial District South_San Francisco_NA_301 Howard St,301 Howard St,West,San Francisco,CA,94105.0,Financial District South,A,15574.0,Algolia,"Technology, Advertising, Media, and Information",New,,320570,Relet,CBD,46050495.0,4027372.0,0.087455563724125,68.9639384422598,66.5293843664807,,,,,,,,,2194536.0,2018-Q2,Medium,Technology_Advertising_Media_and_Information_Medium
2018,Q2,4.0,South Florida,,South Florida_Boca Raton_Boca Raton_NA_5050 Conference Way N,5050 Conference Way N,South,Boca Raton,FL,33431.0,Boca Raton,O,14750.0,Cogent Communications,"Technology, Advertising, Media, and Information",New,Palm Beach County,9349045,,Suburban,51137809.0,8032140.0,0.157068520475721,28.9804475377944,33.4349320475774,,,,,,,,,836465.0,2018-Q2,Medium,Technology_Advertising_Media_and_Information_Medium
2018,Q2,5.0,Atlanta,Bank of America Plaza,Atlanta_Downtown_Atlanta_Bank of America Plaza_600 Peachtree St NE,600 Peachtree St NE,South,Atlanta,GA,30308.0,Downtown,A,25547.0,Riskalyze,"Technology, Advertising, Media, and Information",New,,442458,Relet,CBD,103299677.0,21402315.0,0.207186659451026,29.2519005754806,26.0678750972516,,,,,,,,,1440017.0,2018-Q2,Medium,Technology_Advertising_Media_and_Information_Medium
2018,Q2,5.0,Austin,Braker Pointe II,Austin_North_Austin_Braker Pointe II_10801 MoPac Expy N,10801 MoPac Expy N,South,Austin,TX,78759.0,North,A,13766.0,Social Solutions,"Technology, Advertising, Media, and Information",New,,591698,Relet,Suburban,37106334.0,4709924.0,0.126930458826787,39.659272025382,35.7442116138143,,,,,,,,,1131284.0,2018-Q2,Medium,Technology_Advertising_Media_and_Information_Medium
2018,Q2,5.0,Charlotte,Morehead Place,Charlotte_Midtown/ South End_Charlotte_Morehead Place_521 E Morehead St,521 E Morehead St,South,Charlotte,NC,28202.0,Midtown/ South End,A,14022.0,Charter Communications,"Technology, Advertising, Media, and Information",New,,479482,Sublet,CBD,37279246.0,6442771.0,0.172824605948307,29.3791009452546,26.8226604382563,,,,,,,,,522574.0,2018-Q2,Medium,Technology_Advertising_Media_and_Information_Medium
2018,Q2,5.0,Chicago,Knight Building,Chicago_West Loop_Chicago_Knight Building_549 W Randolph St,549 W Randolph St,Midwest/Central,Chicago,IL,60661.0,West Loop,O,12086.0,Opinion Lab,"Technology, Advertising, Media, and Information",Renewal,,144660,,CBD,,,,,,,,,,,,,,,2018-Q2,Medium,Technology_Advertising_Media_and_Information_Medium
2018,Q2,5.0,Denver,Flatirons North  Bldg D,Denver_Boulder County_Boulder_Flatirons North  Bldg D_2580 55th St,2580 55th St,Midwest/Central,Boulder,CO,80301.0,Boulder County,O,15213.0,Tendril,"Technology, Advertising, Media, and Information",Renewal,Greater Boulder,430860,Relet,Suburban,,,,,,,,,,,,,,,2018-Q2,Medium,Technology_Advertising_Media_and_Information_Medium
2018,Q2,5.0,Los Angeles,,Los Angeles_Hollywood_Los Angeles_NA_953 N Sycamore Ave,953 N Sycamore Ave,West,Los Angeles,CA,90038.0,Hollywood,A,21814.0,Sirius Xm,"Technology, Advertising, Media, and Information",New,Westside,10036266,New,CBD,144098024.0,25837665.0,0.179306171471165,39.0330756919583,36.5813015155726,,,,,,,,,2418566.0,2018-Q2,Medium,Technology_Advertising_Media_and_Information_Medium
2018,Q2,5.0,Manhattan,119 W 40th St,Manhattan_Penn Plaza/Times Square South_New York_119 W 40th St_114 W 41st St,114 W 41st St,Northeast,New York,NY,10036.0,Penn Plaza/Times Square South,O,16183.0,Celonis,"Technology, Advertising, Media, and Information",New,Midtown,157417,Relet,CBD,199870492.0,20756796.0,0.103851227824065,62.1751199680751,73.9042202835504,,,,,,,,,4324015.0,2018-Q2,Medium,Technology_Advertising_Media_and_Information_Medium
2018,Q2,5.0,Manhattan,1719 Union Sq W,Manhattan_Union Square_New York_1719 Union Sq W_19 Union Sq W,19 Union Sq W,Northeast,New York,NY,10003.0,Union Square,O,18600.0,Updater,"Technology, Advertising, Media, and Information",Expansion,Midtown South,157853,Relet,CBD,199870492.0,20756796.0,0.103851227824065,62.1751199680751,73.9042202835504,,,,,,,,,4324015.0,2018-Q2,Medium,Technology_Advertising_Media_and_Information_Medium
2018,Q2,5.0,Manhattan,50 W 23rd Street,Manhattan_Flatiron_New York_50 W 23rd Street_50 W 23rd St,50 W 23rd St,Northeast,New York,NY,10010.0,Flatiron,O,21657.0,Dailymotion,"Technology, Advertising, Media, and Information",Relocation,Midtown South,41371,Sublet,CBD,199870492.0,20756796.0,0.103851227824065,62.1751199680751,73.9042202835504,,,,,,,,,4324015.0,2018-Q2,Medium,Technology_Advertising_Media_and_Information_Medium
2018,Q2,5.0,Manhattan,7 World Trade Center,Manhattan_WTC/Brookfield Place_New York_7 World Trade Center_7 World Trade Center,7 World Trade Center,Northeast,New York,NY,10007.0,WTC/Brookfield Place,A,20671.0,HBO,"Technology, Advertising, Media, and Information",New,Downtown,759788,Relet,CBD,244192517.0,29535879.0,0.120953251814838,82.0331156463172,73.9042202835504,,,,,,,,,6703076.0,2018-Q2,Medium,Technology_Advertising_Media_and_Information_Medium
2018,Q2,5.0,Manhattan,Lords Court Building,Manhattan_Financial District_New York_Lords Court Building_40 Exchange Pl,40 Exchange Pl,Northeast,New York,NY,10005.0,Financial District,O,20077.0,Multicultural Radio Broadcasting,"Technology, Advertising, Media, and Information",Renewal,Downtown,157518,Relet,CBD,199870492.0,20756796.0,0.103851227824065,62.1751199680751,73.9042202835504,,,,,,,,,4324015.0,2018-Q2,Medium,Technology_Advertising_Media_and_Information_Medium
2018,Q2,5.0,Manhattan,One State Street,Manhattan_Financial District_New York_One State Street_One State Street Plz,One State Street Plz,Northeast,New York,NY,10004.0,Financial District,A,11744.0,Wibbitc,"Technology, Advertising, Media, and Information",New,Downtown,157186,Relet,CBD,244192517.0,29535879.0,0.120953251814838,82.0331156463172,73.9042202835504,,,,,,,,,6703076.0,2018-Q2,Medium,Technology_Advertising_Media_and_Information_Medium
2018,Q2,5.0,Manhattan,Tower 46,Manhattan_Grand Central_New York_Tower 46_55 W 46th St,55 W 46th St,Northeast,New York,NY,10036.0,Grand Central,A,22522.0,Travelclick,"Technology, Advertising, Media, and Information",Relocation,Midtown,8267593,Relet,CBD,244192517.0,29535879.0,0.120953251814838,82.0331156463172,73.9042202835504,,,,,,,,,6703076.0,2018-Q2,Medium,Technology_Advertising_Media_and_Information_Medium
2018,Q2,5.0,Northern New Jersey,Liberty Hall,Northern New Jersey_Route 22_Union_Liberty Hall_1095 Morris Ave,1095 Morris Ave,Northeast,Union,NJ,7083.0,Route 22,A,14500.0,Ss&C Technologies,"Technology, Advertising, Media, and Information",New,,175388,Relet,Suburban,112490880.0,30215591.0,0.268604806007385,28.4283263168331,27.20733577737,,,,,,,,,1754265.0,2018-Q2,Medium,Technology_Advertising_Media_and_Information_Medium
2018,Q2,5.0,Northern New Jersey,Liberty Hall,Northern New Jersey_Route 22_Union_Liberty Hall_1095 Morris Ave,1095 Morris Ave,Northeast,Union,NJ,7083.0,Route 22,A,20006.0,Ss&C Technologies,"Technology, Advertising, Media, and Information",New,,175388,Relet,Suburban,112490880.0,30215591.0,0.268604806007385,28.4283263168331,27.20733577737,,,,,,,,,1754265.0,2018-Q2,Medium,Technology_Advertising_Media_and_Information_Medium
2018,Q2,5.0,San Francisco,,San Francisco_Financial District South_San Francisco_NA_555 Mission St,555 Mission St,West,San Francisco,CA,94105.0,Financial District South,A,20962.0,Zoosk,"Technology, Advertising, Media, and Information",New,,738548,Relet,CBD,46050495.0,4027372.0,0.087455563724125,68.9639384422598,66.5293843664807,,,,,,,,,2194536.0,2018-Q2,Medium,Technology_Advertising_Media_and_Information_Medium
2018,Q2,6.0,Manhattan,147163 W 26th St,Manhattan_Chelsea_New York_147163 W 26th St_151 W 26th St,151 W 26th St,Northeast,New York,NY,10001.0,Chelsea,O,17610.0,Theatreworks Usa,"Technology, Advertising, Media, and Information",Renewal,Midtown South,157962,Relet,CBD,199870492.0,20756796.0,0.103851227824065,62.1751199680751,73.9042202835504,,,,,,,,,4324015.0,2018-Q2,Medium,Technology_Advertising_Media_and_Information_Medium
2018,Q2,6.0,Manhattan,Gramercy Park Building,Manhattan_Union Square_New York_Gramercy Park Building_257 Park Ave S,257 Park Ave S,Northeast,New York,NY,10010.0,Union Square,O,12617.0,Bulletproof,"Technology, Advertising, Media, and Information",Relocation,Midtown South,157507,Relet,CBD,199870492.0,20756796.0,0.103851227824065,62.1751199680751,73.9042202835504,,,,,,,,,4324015.0,2018-Q2,Medium,Technology_Advertising_Media_and_Information_Medium
2018,Q2,6.0,Manhattan,,Manhattan_Grand Central_New York_NA_228 E 45th St,228 E 45th St,Northeast,New York,NY,10017.0,Grand Central,O,11610.0,Makovsky &,"Technology, Advertising, Media, and Information",Relocation,Midtown,157572,Relet,CBD,199870492.0,20756796.0,0.103851227824065,62.1751199680751,73.9042202835504,,,,,,,,,4324015.0,2018-Q2,Medium,Technology_Advertising_Media_and_Information_Medium
2018,Q2,6.0,Manhattan,,Manhattan_Hudson Square_New York_NA_250 Hudson St,250 Hudson St,Northeast,New York,NY,10013.0,Hudson Square,O,27280.0,Mekanism,"Technology, Advertising, Media, and Information",Relocation,Midtown South,157782,Relet,CBD,199870492.0,20756796.0,0.103851227824065,62.1751199680751,73.9042202835504,,,,,,,,,4324015.0,2018-Q2,Medium,Technology_Advertising_Media_and_Information_Medium
2018,Q2,6.0,Manhattan,,Manhattan_WTC/Brookfield Place_New York_NA_61 Broadway,61 Broadway,Northeast,New York,NY,10006.0,WTC/Brookfield Place,O,24479.0,Collibra,"Technology, Advertising, Media, and Information",Expansion,Downtown,157222,Relet,CBD,199870492.0,20756796.0,0.103851227824065,62.1751199680751,73.9042202835504,,,,,,,,,4324015.0,2018-Q2,Medium,Technology_Advertising_Media_and_Information_Medium
2018,Q2,6.0,Northern Virginia,Boro Station III,Northern Virginia_Tysons Corner_McLean_Boro Station III_1785 Greensboro Station Pl,1785 Greensboro Station Pl,Northeast,McLean,VA,22102.0,Tysons Corner,O,23369.0,Cvent,"Technology, Advertising, Media, and Information",Expansion,Fairfax County,9066254,,Suburban,50820827.0,11186620.0,0.220118810738755,28.7155514061252,32.3010111130319,,,,,,,,,602817.0,2018-Q2,Medium,Technology_Advertising_Media_and_Information_Medium
2018,Q2,6.0,Northern Virginia,North Tower,Northern Virginia_Tysons Corner_Falls Church_North Tower_7799 Leesburg Pike,7799 Leesburg Pike,Northeast,Falls Church,VA,22043.0,Tysons Corner,A,18200.0,Creative Information Technology,"Technology, Advertising, Media, and Information",Restructure,Fairfax County,136108,,Suburban,98610960.0,21315720.0,0.216159745326483,34.4448668610663,32.3010111130319,,,,,,,,,2188728.0,2018-Q2,Medium,Technology_Advertising_Media_and_Information_Medium
2018,Q2,6.0,Northern Virginia,Stonecroft at Westfields,Northern Virginia_Route 28 South / Chantilly_Chantilly_Stonecroft at Westfields_4803 Stonecroft Blvd,4803 Stonecroft Blvd,Northeast,Chantilly,VA,20151.0,Route 28 South / Chantilly,A,21200.0,Cogeco Peer 1,"Technology, Advertising, Media, and Information",Renewal,Fairfax County,836681,,Suburban,98610960.0,21315720.0,0.216159745326483,34.4448668610663,32.3010111130319,,,,,,,,,2188728.0,2018-Q2,Medium,Technology_Advertising_Media_and_Information_Medium
2018,Q2,6.0,Northern Virginia,,Northern Virginia_Tysons Corner_McLean_NA_7901 Jones Branch Dr,7901 Jones Branch Dr,Northeast,McLean,VA,22102.0,Tysons Corner,A,23240.0,Abila (Avectra),"Technology, Advertising, Media, and Information",New,Fairfax County,135949,,Suburban,98610960.0,21315720.0,0.216159745326483,34.4448668610663,32.3010111130319,,,,,,,,,2188728.0,2018-Q2,Medium,Technology_Advertising_Media_and_Information_Medium
2018,Q2,,Austin,Bridgepoint Square 5,Austin_Northwest_Austin_Bridgepoint Square 5_6011 W Courtyard Dr,6011 W Courtyard Dr,South,Austin,TX,78730.0,Northwest,A,20421.0,Erelevance,"Technology, Advertising, Media, and Information",Relocation,,591573,,Suburban,37106334.0,4709924.0,0.126930458826787,39.659272025382,35.7442116138143,,,,,,,,,1131284.0,2018-Q2,Medium,Technology_Advertising_Media_and_Information_Medium
2018,Q2,,Austin,Capitol Tower,Austin_CBD_Austin_Capitol Tower_206 E 9th St,206 E 9th St,South,Austin,TX,78701.0,CBD,A,25804.0,Youearnedit,"Technology, Advertising, Media, and Information",New,,591178,,CBD,37106334.0,4709924.0,0.126930458826787,39.659272025382,35.7442116138143,,,,,,,,,1131284.0,2018-Q2,Medium,Technology_Advertising_Media_and_Information_Medium
2018,Q2,,Phoenix,SkySong Innovation Center 3,Phoenix_Scottsdale South_Scottsdale_SkySong Innovation Center 3_1365 N Scottsdale Rd,1365 N Scottsdale Rd,West,Scottsdale,AZ,85257.0,Scottsdale South,A,15000.0,Oracle,"Technology, Advertising, Media, and Information",New,Scottsdale,6567405,,Suburban,44911958.0,8355559.0,0.186043080107975,30.4077891933069,26.2318194631733,,,,,,,,,850371.0,2018-Q2,Medium,Technology_Advertising_Media_and_Information_Medium
2019,Q2,3.0,Atlanta,King,Atlanta_Central Perimeter_Atlanta_King_6 Concourse Pky NE,6 Concourse Pky NE,South,Atlanta,GA,30328.0,Central Perimeter,A,25234.0,Codemettle,"Technology, Advertising, Media, and Information",New,,113004,Relet,Suburban,103866928.0,20867317.0,0.200904343680984,29.9445463104943,26.9054257174279,18391134.0,0.108,30.525283,27.272135,2476183.0,0.0145,23.278305,22.134262,1532604.0,2019-Q2,Medium,Technology_Advertising_Media_and_Information_Medium
2019,Q2,3.0,Baltimore,,Baltimore_Howard County_Columbia_NA_10490 Little Patuxent Pky,10490 Little Patuxent Pky,Northeast,Columbia,MD,21044.0,Howard County,A,15097.0,Resolution Health,"Technology, Advertising, Media, and Information",Renewal,South Suburbs,142030,Relet,Suburban,41915202.0,7204407.0,0.171880526783576,26.5263722547327,23.9286856277536,6565679.0,0.0798,26.515443,23.898512,638728.0,0.0078,26.796712,24.529739,419460.0,2019-Q2,Medium,Technology_Advertising_Media_and_Information_Medium
2019,Q2,3.0,Dallas/Ft Worth,Colonnade II,Dallas/Ft Worth_North Dallas Corridor_Addison_Colonnade II_15303 N Dallas Pky,15303 N Dallas Pky,South,Addison,TX,75001.0,North Dallas Corridor,A,25153.0,Google,"Technology, Advertising, Media, and Information",New,,409785,Relet,Suburban,,,,,,,,,,,,,,,2019-Q2,Medium,Technology_Advertising_Media_and_Information_Medium
2019,Q2,3.0,Denver,390 Interlocken Crescent,Denver_Northwest_Broomfield_390 Interlocken Crescent_390 Interlocken Cres,390 Interlocken Cres,Midwest/Central,Broomfield,CO,80021.0,Northwest,A,25110.0,Sierra Nevada,"Technology, Advertising, Media, and Information",New,,521579,Sublet,Suburban,,,,,,,,,,,,,,,2019-Q2,Medium,Technology_Advertising_Media_and_Information_Medium
2019,Q2,3.0,Manhattan,1357 Broadway,Manhattan_Penn Plaza/Times Square South_New York_1357 Broadway_1359 Broadway,1359 Broadway,Northeast,New York,NY,10018.0,Penn Plaza/Times Square South,O,24171.0,Sisense,"Technology, Advertising, Media, and Information",Expansion,Midtown,157491,Sublet,CBD,200026077.0,18165113.0,0.0908137242525633,61.4046508004938,80.4832380705748,14086664.0,0.0315,61.723811,83.104269,4078449.0,0.0091,57.206137,57.587003,3477494.0,2019-Q2,Medium,Technology_Advertising_Media_and_Information_Medium
2019,Q2,3.0,Manhattan,44 WALL,Manhattan_Financial District_New York_44 WALL_44 Wall St,44 Wall St,Northeast,New York,NY,10005.0,Financial District,O,13146.0,Contently,"Technology, Advertising, Media, and Information",New,Downtown,157373,Relet,CBD,200026077.0,18165113.0,0.0908137242525633,61.4046508004938,80.4832380705748,14086664.0,0.0315,61.723811,83.104269,4078449.0,0.0091,57.206137,57.587003,3477494.0,2019-Q2,Medium,Technology_Advertising_Media_and_Information_Medium
2019,Q2,3.0,Manhattan,4448 W 18th St,Manhattan_Flatiron_New York_4448 W 18th St_44 W 18th St,44 W 18th St,Northeast,New York,NY,10011.0,Flatiron,O,16625.0,Dashlane,"Technology, Advertising, Media, and Information",Relocation,Midtown South,158101,Relet,CBD,200026077.0,18165113.0,0.0908137242525633,61.4046508004938,80.4832380705748,14086664.0,0.0315,61.723811,83.104269,4078449.0,0.0091,57.206137,57.587003,3477494.0,2019-Q2,Medium,Technology_Advertising_Media_and_Information_Medium
2019,Q2,3.0,Manhattan,,Manhattan_Park Avenue South_New York_NA_136 Madison Ave,136 Madison Ave,Northeast,New York,NY,10016.0,Park Avenue South,O,18364.0,Complysci,"Technology, Advertising, Media, and Information",Relocation,Midtown South,157622,Relet,CBD,200026077.0,18165113.0,0.0908137242525633,61.4046508004938,80.4832380705748,14086664.0,0.0315,61.723811,83.104269,4078449.0,0.0091,57.206137,57.587003,3477494.0,2019-Q2,Medium,Technology_Advertising_Media_and_Information_Medium
2019,Q2,3.0,Northern Virginia,Boro Tower,Northern Virginia_Tysons Corner_McLean_Boro Tower_8350 Broad St,8350 Broad St,Northeast,McLean,VA,22102.0,Tysons Corner,A,12680.0,Forescout,"Technology, Advertising, Media, and Information",,Fairfax County,136037,New,Suburban,99808997.0,21917539.0,0.2195948226992,36.1948400156354,34.0640594340501,19885391.0,0.132,36.735759,34.432424,2032148.0,0.0135,31.130498,30.011829,2047241.0,2019-Q2,Medium,Technology_Advertising_Media_and_Information_Medium
2019,Q2,3.0,Northern Virginia,Pinnacle Towers  North Tower,Northern Virginia_Tysons Corner_McLean_Pinnacle Towers  North Tower_1751 Pinnacle Dr,1751 Pinnacle Dr,Northeast,McLean,VA,22102.0,Tysons Corner,O,14736.0,Verato,"Technology, Advertising, Media, and Information",New,Fairfax County,136891,Relet,Suburban,50820827.0,9668985.0,0.1902563490358,29.2051328314762,34.0640594340501,9169755.0,0.0609,29.421762,34.432424,499230.0,0.0033,25.521706,30.011829,1268590.0,2019-Q2,Medium,Technology_Advertising_Media_and_Information_Medium
2019,Q2,3.0,Northern Virginia,,Northern Virginia_Reston / Herndon_Herndon_NA_2355 Dulles Corner Blvd,2355 Dulles Corner Blvd,Northeast,Herndon,VA,20171.0,Reston / Herndon,A,17637.0,Synopsis,"Technology, Advertising, Media, and Information",Relocation,Fairfax County,136352,Relet,Suburban,99808997.0,21917539.0,0.2195948226992,36.1948400156354,34.0640594340501,19885391.0,0.132,36.735759,34.432424,2032148.0,0.0135,31.130498,30.011829,2047241.0,2019-Q2,Medium,Technology_Advertising_Media_and_Information_Medium
2019,Q2,3.0,Northern Virginia,,Northern Virginia_Tysons Corner_Vienna_NA_8150 Leesburg Pike,8150 Leesburg Pike,Northeast,Vienna,VA,22182.0,Tysons Corner,O,15024.0,Next Tier Concepts,"Technology, Advertising, Media, and Information",Relocation,Fairfax County,135379,Relet,Suburban,50820827.0,9668985.0,0.1902563490358,29.2051328314762,34.0640594340501,9169755.0,0.0609,29.421762,34.432424,499230.0,0.0033,25.521706,30.011829,1268590.0,2019-Q2,Medium,Technology_Advertising_Media_and_Information_Medium
2019,Q2,3.0,Philadelphia,1 Radnor Corporate Center,Philadelphia_Radnor_Radnor_1 Radnor Corporate Center_100 Matsonford Rd,100 Matsonford Rd,Northeast,Radnor,PA,19087.0,Radnor,A,23363.0,Syapse,"Technology, Advertising, Media, and Information",New,,295681,Relet,Suburban,85439454.0,14512127.0,0.169852759124608,29.4664384139111,28.0457017660982,12109183.0,0.0926,30.100849,28.329098,2402944.0,0.0184,25.443865,24.242128,1574637.0,2019-Q2,Medium,Technology_Advertising_Media_and_Information_Medium
2019,Q2,3.0,Raleigh/Durham,Lakeridge North,Raleigh/Durham_6 Forks Falls of Neuse_Raleigh_Lakeridge North_900 Ridgefield Dr,900 Ridgefield Dr,South,Raleigh,NC,27609.0,6 Forks Falls of Neuse,O,12784.0,Sysomos Expion,"Technology, Advertising, Media, and Information",Renewal and Expansion,,67766,Relet,Suburban,,,,,,,,,,,,,,,2019-Q2,Medium,Technology_Advertising_Media_and_Information_Medium
2019,Q2,3.0,San Diego,Summit Pointe,San Diego_I-15 Corridor_San Diego_Summit Pointe_10641 Scripps Summit Ct,10641 Scripps Summit Ct,West,San Diego,CA,92131.0,I-15 Corridor,A,26920.0,Trellisware Technologies,"Technology, Advertising, Media, and Information",New,,359761,New,Suburban,30643491.0,5032300.0,0.164220845464376,38.8122620574825,35.1185315699248,4430362.0,0.0693,39.811416,35.875061,601938.0,0.0094,30.91568,30.803734,728137.0,2019-Q2,Medium,Technology_Advertising_Media_and_Information_Medium
2019,Q2,4.0,Atlanta,Brookside One,Atlanta_North Fulton_Alpharetta_Brookside One_3625 Brookside Pky,3625 Brookside Pky,South,Alpharetta,GA,30022.0,North Fulton,A,20324.0,Zoom,"Technology, Advertising, Media, and Information",New,,445438,Sublet,Suburban,103866928.0,20867317.0,0.200904343680984,29.9445463104943,26.9054257174279,18391134.0,0.108,30.525283,27.272135,2476183.0,0.0145,23.278305,22.134262,1532604.0,2019-Q2,Medium,Technology_Advertising_Media_and_Information_Medium
2019,Q2,4.0,Baltimore,Court Towers,Baltimore_Towson_Towson_Court Towers_210 W Pennsylvania Ave,210 W Pennsylvania Ave,Northeast,Towson,MD,21204.0,Towson,A,18058.0,Imre,"Technology, Advertising, Media, and Information",Relocation,North Suburbs,138465,Relet,Suburban,41915202.0,7204407.0,0.171880526783576,26.5263722547327,23.9286856277536,6565679.0,0.0798,26.515443,23.898512,638728.0,0.0078,26.796712,24.529739,419460.0,2019-Q2,Medium,Technology_Advertising_Media_and_Information_Medium
