year,quarter,monthsigned,market,building_name,building_id,address,region,city,state,zip,internal_submarket,internal_class,leasedSF,company_name,internal_industry,transaction_type,internal_market_cluster,costarID,space_type,CBD_suburban,RBA,available_space,availability_proportion,internal_class_rent,overall_rent,direct_available_space,direct_availability_proportion,direct_internal_class_rent,direct_overall_rent,sublet_available_space,sublet_availability_proportion,sublet_internal_class_rent,sublet_overall_rent,leasing,year-quarter,company_size,industry_size
2024,Q2,4.0,Manhattan,,Manhattan_Flatiron_New York_NA_18 W 18th St,18 W 18th St,Northeast,New York,NY,10011.0,Flatiron,O,17705.0,Runway,"Technology, Advertising, Media, and Information",New,Midtown South,157988,Relet,CBD,198703233.0,39963264.0,0.201120351172142,62.0443224895677,76.6259509200918,33139125.0,0.071,64.990536,81.800437,6824139.0,0.0146,46.897569,58.567878,2807110.0,2024-Q2,Medium,Technology_Advertising_Media_and_Information_Medium
2024,Q2,4.0,Northern Virginia,Greenwood,Northern Virginia_Fairfax / Oakton / Vienna_Fairfax_Greenwood_12015 Lee Jackson Memorial Hwy,12015 Lee Jackson Memorial Hwy,Northeast,Fairfax,VA,22033.0,Fairfax / Oakton / Vienna,A,19926.0,Tiber Creek Consulting,"Technology, Advertising, Media, and Information",Renewal,Fairfax County,135465,Relet,Suburban,102964063.0,27824417.0,0.270234256392932,36.2818975531959,35.2572608740939,23936070.0,0.1592,37.037827,35.86277,3888347.0,0.0259,31.370433,30.585632,1450081.0,2024-Q2,Medium,Technology_Advertising_Media_and_Information_Medium
2024,Q2,4.0,Northern Virginia,Quantico Corporate Center,Northern Virginia_Loudoun County_Stafford_Quantico Corporate Center_800 Corporate Dr,800 Corporate Dr,Northeast,Stafford,VA,22554.0,Loudoun County,A,18049.0,Digital Cloak,"Technology, Advertising, Media, and Information",Renewal,Loudoun/Stafford/Prince William,7587964,Relet,Suburban,102964063.0,27824417.0,0.270234256392932,36.2818975531959,35.2572608740939,23936070.0,0.1592,37.037827,35.86277,3888347.0,0.0259,31.370433,30.585632,1450081.0,2024-Q2,Medium,Technology_Advertising_Media_and_Information_Medium
2024,Q2,4.0,Northern Virginia,Summit 2,Northern Virginia_Reston / Herndon_Reston_Summit 2_2000 Edmund Halley Dr,2000 Edmund Halley Dr,Northeast,Reston,VA,20191.0,Reston / Herndon,A,23967.0,Active Navigation,"Technology, Advertising, Media, and Information",New,Fairfax County,135164,Relet,Suburban,102964063.0,27824417.0,0.270234256392932,36.2818975531959,35.2572608740939,23936070.0,0.1592,37.037827,35.86277,3888347.0,0.0259,31.370433,30.585632,1450081.0,2024-Q2,Medium,Technology_Advertising_Media_and_Information_Medium
2024,Q2,4.0,Northern Virginia,The Navy League Building,Northern Virginia_Courthouse / Clarendon / Virginia Square_Arlington_The Navy League Building_2300 Wilson Blvd,2300 Wilson Blvd,Northeast,Arlington,VA,22201.0,Courthouse / Clarendon / Virginia Square,A,22420.0,Serco,"Technology, Advertising, Media, and Information",New,Arlington County,649276,Relet,Suburban,102964063.0,27824417.0,0.270234256392932,36.2818975531959,35.2572608740939,23936070.0,0.1592,37.037827,35.86277,3888347.0,0.0259,31.370433,30.585632,1450081.0,2024-Q2,Medium,Technology_Advertising_Media_and_Information_Medium
2024,Q2,4.0,Orange County,,Orange County_Irvine Spectrum_Irvine_NA_400 Spectrum Center Dr,400 Spectrum Center Dr,West,Irvine,CA,92618.0,Irvine Spectrum,A,22267.0,Blackberry,"Technology, Advertising, Media, and Information",Renewal,,9686506,New,Suburban,,,,,,,,,,,,,,,2024-Q2,Medium,Technology_Advertising_Media_and_Information_Medium
2024,Q2,4.0,Phoenix,One Agave Center,Phoenix_South Tempe/Ahwatukee_Tempe_One Agave Center_8950 S 52nd St,8950 S 52nd St,West,Tempe,AZ,85284.0,South Tempe/Ahwatukee,A,16996.0,Paycompass,"Technology, Advertising, Media, and Information",Relocation,,519006,Sublet,Suburban,49727660.0,16556895.0,0.33295141979333,32.5112967883257,30.488540939592,12442591.0,0.1182,34.214514,31.763895,4114304.0,0.0391,26.974218,26.264815,921938.0,2024-Q2,Medium,Technology_Advertising_Media_and_Information_Medium
2024,Q2,4.0,Raleigh/Durham,311 S Harrington St,Raleigh/Durham_Downtown Raleigh_Raleigh_311 S Harrington St_319 W Martin St,319 W Martin St,South,Raleigh,NC,27601.0,Downtown Raleigh,O,12000.0,Ndustrial,"Technology, Advertising, Media, and Information",New,Raleigh & Durham Downtowns Total,68013,Relet,CBD,,,,,,,,,,,,,,,2024-Q2,Medium,Technology_Advertising_Media_and_Information_Medium
2024,Q2,4.0,Salt Lake City,US Bank,Salt Lake City_CBD_Salt Lake City_US Bank_170 S Main St,170 S Main St,West,Salt Lake City,UT,84101.0,CBD,A,16587.0,Mettel,"Technology, Advertising, Media, and Information",New,,1057972,Sublet,CBD,21958686.0,4681828.0,0.213210754049673,30.2151782942971,27.3051102023729,3386530.0,0.0714,31.976642,28.242337,1295298.0,0.0273,25.203067,23.665011,463178.0,2024-Q2,Medium,Technology_Advertising_Media_and_Information_Medium
2024,Q2,4.0,San Francisco,One Post,San Francisco_Financial District North_San Francisco_One Post_1 Post St,1 Post St,West,San Francisco,CA,94104.0,Financial District North,A,11772.0,Mechanical Orchard,"Technology, Advertising, Media, and Information",Relocation,,320807,Sublet,CBD,56296653.0,19716669.0,0.350228085495598,74.76542580684,68.5585782246516,14620194.0,0.1652,80.420989,72.296592,5096475.0,0.0576,58.575177,57.721118,913850.0,2024-Q2,Medium,Technology_Advertising_Media_and_Information_Medium
2024,Q2,4.0,Seattle,West8,Seattle_Seattle CBD_Seattle_West8_2001 8th Ave,2001 8th Ave,West,Seattle,WA,98121.0,Seattle CBD,A,19705.0,Databricks,"Technology, Advertising, Media, and Information",New,,1470165,Sublet,CBD,71749675.0,21182133.0,0.295222703099352,51.4530498925043,46.0959935640364,16802454.0,0.1356,53.996489,47.639411,4379679.0,0.0353,38.994395,37.552424,1325199.0,2024-Q2,Medium,Technology_Advertising_Media_and_Information_Medium
2024,Q2,4.0,South Bay/San Jose,2560 N First St,South Bay/San Jose_North San Jose_San Jose_2560 N First St_2560 N 1st St,2560 N 1st St,West,San Jose,CA,95131.0,North San Jose,O,18805.0,Futurewei Technologies,"Technology, Advertising, Media, and Information",New,,308877,Relet,Suburban,,,,,,,,,,,,,,,2024-Q2,Medium,Technology_Advertising_Media_and_Information_Medium
2024,Q2,4.0,South Bay/San Jose,Metro Plaza,South Bay/San Jose_North San Jose_San Jose_Metro Plaza_181 Metro Dr,181 Metro Dr,West,San Jose,CA,95110.0,North San Jose,A,23135.0,Indie Semiconductor,"Technology, Advertising, Media, and Information",New,,308787,Relet,Suburban,,,,,,,,,,,,,,,2024-Q2,Medium,Technology_Advertising_Media_and_Information_Medium
2024,Q2,4.0,Washington D.C.,,Washington D.C._East End_Washington_NA_1325 G St NW,1325 G St NW,Northeast,Washington,DC,20005.0,East End,O,12766.0,Millnet,"Technology, Advertising, Media, and Information",Renewal,,94482,Relet,CBD,,,,,,,,,,,,,,,2024-Q2,Medium,Technology_Advertising_Media_and_Information_Medium
2024,Q2,5.0,Austin,Las Cimas II,Austin_Southwest_Austin_Las Cimas II_807 Las Cimas Pky,807 Las Cimas Pky,South,Austin,TX,78746.0,Southwest,A,19606.0,Ansys,"Technology, Advertising, Media, and Information",Renewal,,95158,Relet,Suburban,46749922.0,15386010.0,0.329113062477409,51.2054375714065,46.4701179559498,11544716.0,0.1528,52.618438,47.473588,3841294.0,0.0508,47.204496,43.296281,637036.0,2024-Q2,Medium,Technology_Advertising_Media_and_Information_Medium
2024,Q2,5.0,Denver,Waterview III,Denver_Southeast_Centennial_Waterview III_8000 S Chester St,8000 S Chester St,Midwest/Central,Centennial,CO,80112.0,Southeast,A,13043.0,Dell Emc,"Technology, Advertising, Media, and Information",New,,400161,Relet,Suburban,,,,,,,,,,,,,,,2024-Q2,Medium,Technology_Advertising_Media_and_Information_Medium
2024,Q2,5.0,Houston,,Houston_West Loop/Galleria_Houston_NA_1300 Post Oak Blvd,1300 Post Oak Blvd,South,Houston,TX,77056.0,West Loop/Galleria,A,16960.0,Costar Group,"Technology, Advertising, Media, and Information",New,,233973,New,Suburban,117823966.0,36853620.0,0.312785431106605,36.7731442685278,31.8158165925787,32779438.0,0.1672,37.331674,32.328914,4074182.0,0.0208,28.10854,23.873878,1588147.0,2024-Q2,Medium,Technology_Advertising_Media_and_Information_Medium
2024,Q2,5.0,Manhattan,354360 Park Ave S,Manhattan_Park Avenue South_New York_354360 Park Ave S_360 Park Ave S,360 Park Ave S,Northeast,New York,NY,10010.0,Park Avenue South,O,23038.0,Ziff-David Media,"Technology, Advertising, Media, and Information",Relocation,Midtown South,157516,Relet,CBD,198703233.0,39963264.0,0.201120351172142,62.0443224895677,76.6259509200918,33139125.0,0.071,64.990536,81.800437,6824139.0,0.0146,46.897569,58.567878,2807110.0,2024-Q2,Medium,Technology_Advertising_Media_and_Information_Medium
2024,Q2,5.0,Manhattan,Nomad Tower,Manhattan_Penn Plaza/Times Square South_New York_Nomad Tower_1250 Broadway,1250 Broadway,Northeast,New York,NY,10001.0,Penn Plaza/Times Square South,A,14906.0,Elastic Ai,"Technology, Advertising, Media, and Information",New,Midtown,157146,Relet,CBD,267787350.0,53537225.0,0.199924398968062,86.0903147571715,76.6259509200918,39664181.0,0.085,94.170351,81.800437,13873044.0,0.0297,63.282968,58.567878,5869995.0,2024-Q2,Medium,Technology_Advertising_Media_and_Information_Medium
2024,Q2,5.0,Nashville,May Hosiery,Nashville_Airport South_Nashville_May Hosiery_431 Chestnut St,431 Chestnut St,South,Nashville,TN,37203.0,Airport South,O,25338.0,Apple,"Technology, Advertising, Media, and Information",Renewal,Airport,10034170,Relet,Suburban,22536095.0,3737294.0,0.165835917890832,29.6941622069764,34.4029769124653,3149265.0,0.0638,29.987391,34.982836,588029.0,0.0119,27.692712,31.166408,94818.0,2024-Q2,Medium,Technology_Advertising_Media_and_Information_Medium
2024,Q2,5.0,Nashville,,Nashville_Cool Springs_Franklin_NA_5030 Carothers Pky,5030 Carothers Pky,South,Franklin,TN,37067.0,Cool Springs,A,15000.0,Integrity Music,"Technology, Advertising, Media, and Information",New,South Nashville,11204623,,Suburban,26791624.0,6418033.0,0.23955371275739,37.1725470468682,34.4029769124653,5298908.0,0.1074,38.056167,34.982836,1119125.0,0.0227,32.737761,31.166408,560969.0,2024-Q2,Medium,Technology_Advertising_Media_and_Information_Medium
2024,Q2,5.0,Northern New Jersey,,Northern New Jersey_I-78_Bridgewater_NA_1150 Route 22 E,1150 Route 22 E,Northeast,Bridgewater,NJ,8807.0,I-78,A,11728.0,Aba Ventures,"Technology, Advertising, Media, and Information",New,,175017,Relet,Suburban,114586211.0,32040766.0,0.279621480808018,32.7557516577412,31.4765902519741,25377922.0,0.1688,33.412962,31.928076,6662844.0,0.0443,29.215098,28.684072,1331014.0,2024-Q2,Medium,Technology_Advertising_Media_and_Information_Medium
2024,Q2,5.0,Northern Virginia,,Northern Virginia_Reston / Herndon_Herndon_NA_2201 Cooperative Way,2201 Cooperative Way,Northeast,Herndon,VA,20171.0,Reston / Herndon,A,23048.0,Edgeconnex,"Technology, Advertising, Media, and Information",Extension,Fairfax County,134893,Relet,Suburban,102964063.0,27824417.0,0.270234256392932,36.2818975531959,35.2572608740939,23936070.0,0.1592,37.037827,35.86277,3888347.0,0.0259,31.370433,30.585632,1450081.0,2024-Q2,Medium,Technology_Advertising_Media_and_Information_Medium
2024,Q2,5.0,Philadelphia,Main Building,Philadelphia_Conshohocken_Conshohocken_Main Building_555 E North Ln,555 E North Ln,Northeast,Conshohocken,PA,19428.0,Conshohocken,O,15035.0,Onair Entertainment,"Technology, Advertising, Media, and Information",New,,297467,Relet,Suburban,44794487.0,9748985.0,0.217638054432904,28.3854169905413,32.1924140675547,8407264.0,0.0639,28.930456,32.772904,1341721.0,0.0102,23.916744,27.551989,206143.0,2024-Q2,Medium,Technology_Advertising_Media_and_Information_Medium
2024,Q2,5.0,Phoenix,The Drinkwater  4150 Building,Phoenix_Scottsdale South_Scottsdale_The Drinkwater  4150 Building_4150 N Drinkwater Blvd,4150 N Drinkwater Blvd,West,Scottsdale,AZ,85251.0,Scottsdale South,A,20879.0,Nerdwallet,"Technology, Advertising, Media, and Information",Relocation,Scottsdale,227036,Relet,Suburban,49727660.0,16556895.0,0.33295141979333,32.5112967883257,30.488540939592,12442591.0,0.1182,34.214514,31.763895,4114304.0,0.0391,26.974218,26.264815,921938.0,2024-Q2,Medium,Technology_Advertising_Media_and_Information_Medium
2024,Q2,5.0,Salt Lake City,Kearns Building,Salt Lake City_CBD_Salt Lake City_Kearns Building_136 S Main St,136 S Main St,West,Salt Lake City,UT,84101.0,CBD,A,16164.0,Plaid,"Technology, Advertising, Media, and Information",Renewal,,1057671,Relet,CBD,21958686.0,4681828.0,0.213210754049673,30.2151782942971,27.3051102023729,3386530.0,0.0714,31.976642,28.242337,1295298.0,0.0273,25.203067,23.665011,463178.0,2024-Q2,Medium,Technology_Advertising_Media_and_Information_Medium
2024,Q2,5.0,Seattle,Bellevue Place Building,Seattle_Bellevue CBD_Bellevue_Bellevue Place Building_10500 NE 8th St,10500 NE 8th St,West,Bellevue,WA,98004.0,Bellevue CBD,A,19871.0,Xenon Arc,"Technology, Advertising, Media, and Information",New,,469938,Sublet,CBD,71749675.0,21182133.0,0.295222703099352,51.4530498925043,46.0959935640364,16802454.0,0.1356,53.996489,47.639411,4379679.0,0.0353,38.994395,37.552424,1325199.0,2024-Q2,Medium,Technology_Advertising_Media_and_Information_Medium
2024,Q2,5.0,Seattle,US Bank Plaza,Seattle_Bellevue CBD_Bellevue_US Bank Plaza_10800 NE 8th St,10800 NE 8th St,West,Bellevue,WA,98004.0,Bellevue CBD,A,14941.0,Cognitiv,"Technology, Advertising, Media, and Information",New,,470011,Relet,CBD,71749675.0,21182133.0,0.295222703099352,51.4530498925043,46.0959935640364,16802454.0,0.1356,53.996489,47.639411,4379679.0,0.0353,38.994395,37.552424,1325199.0,2024-Q2,Medium,Technology_Advertising_Media_and_Information_Medium
2024,Q2,5.0,South Bay/San Jose,2099 Gateway,South Bay/San Jose_North San Jose_San Jose_2099 Gateway_2099 Gateway Pl,2099 Gateway Pl,West,San Jose,CA,95110.0,North San Jose,A,18152.0,Sapeon,"Technology, Advertising, Media, and Information",New,,305964,Relet,Suburban,,,,,,,,,,,,,,,2024-Q2,Medium,Technology_Advertising_Media_and_Information_Medium
2024,Q2,5.0,South Bay/San Jose,Mission Towers II,South Bay/San Jose_Santa Clara_Santa Clara_Mission Towers II_3979 Freedom Cir,3979 Freedom Cir,West,Santa Clara,CA,95054.0,Santa Clara,A,13573.0,NSFOCUS,"Technology, Advertising, Media, and Information",New,,311399,Relet,Suburban,,,,,,,,,,,,,,,2024-Q2,Medium,Technology_Advertising_Media_and_Information_Medium
2024,Q2,5.0,Southern Maryland,Bethesda Place I,Southern Maryland_Bethesda / Chevy Chase_Bethesda_Bethesda Place I_7700 Wisconsin Ave,7700 Wisconsin Ave,Northeast,Bethesda,MD,20814.0,Bethesda / Chevy Chase,A,18909.0,Employee Navigator,"Technology, Advertising, Media, and Information",New,,130774,Relet,Suburban,,,,,,,,,,,,,,,2024-Q2,Medium,Technology_Advertising_Media_and_Information_Medium
2024,Q2,5.0,Washington D.C.,2100 L,Washington D.C._Central Business District_Washington_2100 L_2100 L St NW,2100 L St NW,Northeast,Washington,DC,20037.0,Central Business District,A,16408.0,Ard Channels International,"Technology, Advertising, Media, and Information",New,,9575910,Relet,CBD,,,,,,,,,,,,,,,2024-Q2,Medium,Technology_Advertising_Media_and_Information_Medium
2024,Q2,6.0,Austin,San Jacinto Center,Austin_CBD_Austin_San Jacinto Center_98 San Jacinto Blvd,98 San Jacinto Blvd,South,Austin,TX,78701.0,CBD,A,19921.0,Logicmonitor,"Technology, Advertising, Media, and Information",Renewal,,591333,Relet,CBD,46749922.0,15386010.0,0.329113062477409,51.2054375714065,46.4701179559498,11544716.0,0.1528,52.618438,47.473588,3841294.0,0.0508,47.204496,43.296281,637036.0,2024-Q2,Medium,Technology_Advertising_Media_and_Information_Medium
2024,Q2,6.0,Chicago,1 North Dearborn,Chicago_Central Loop_Chicago_1 North Dearborn_1 N Dearborn St,1 N Dearborn St,Midwest/Central,Chicago,IL,60602.0,Central Loop,O,13854.0,Powerreviews,"Technology, Advertising, Media, and Information",Expansion,,144460,,CBD,,,,,,,,,,,,,,,2024-Q2,Medium,Technology_Advertising_Media_and_Information_Medium
2024,Q2,6.0,Chicago,,Chicago_Far West Loop/Fulton Market_Chicago_NA_320 N Elizabeth St,320 N Elizabeth St,Midwest/Central,Chicago,IL,60607.0,Far West Loop/Fulton Market,O,17342.0,Cameo,"Technology, Advertising, Media, and Information",Relocation,,627056,,CBD,,,,,,,,,,,,,,,2024-Q2,Medium,Technology_Advertising_Media_and_Information_Medium
2024,Q2,6.0,Denver,Building 2,Denver_West_Lakewood_Building 2_14123 Denver West Pky,14123 Denver West Pky,Midwest/Central,Lakewood,CO,80401.0,West,O,18218.0,The Tomorrow,"Technology, Advertising, Media, and Information",New,,398940,New,Suburban,,,,,,,,,,,,,,,2024-Q2,Medium,Technology_Advertising_Media_and_Information_Medium
2024,Q2,6.0,Detroit,,Detroit_Royal Oak Area_Royal Oak_NA_150 W 2nd St,150 W 2nd St,Midwest/Central,Royal Oak,MI,48067.0,Royal Oak Area,O,12600.0,The Trade Desk,"Technology, Advertising, Media, and Information",Relocation,Suburban Detroit,9836280,,Suburban,47916089.0,11606325.0,0.242221876664433,19.9356203152231,21.8355579030725,10327776.0,0.1222,20.28238,22.225199,1278549.0,0.0151,16.293118,17.407312,280756.0,2024-Q2,Medium,Technology_Advertising_Media_and_Information_Medium
2024,Q2,6.0,Manhattan,539545 Fifth Ave,Manhattan_Grand Central_New York_539545 Fifth Ave_545 Fifth Ave,545 Fifth Ave,Northeast,New York,NY,10017.0,Grand Central,O,13118.0,Oxford University Press,"Technology, Advertising, Media, and Information",New,Midtown,157875,Relet,CBD,198703233.0,39963264.0,0.201120351172142,62.0443224895677,76.6259509200918,33139125.0,0.071,64.990536,81.800437,6824139.0,0.0146,46.897569,58.567878,2807110.0,2024-Q2,Medium,Technology_Advertising_Media_and_Information_Medium
2024,Q2,6.0,Northern New Jersey,Somerset Corporate Center II,Northern New Jersey_I-78_Bridgewater_Somerset Corporate Center II_200 Somerset Corporate Blvd,200 Somerset Corporate Blvd,Northeast,Bridgewater,NJ,8807.0,I-78,A,18841.0,Cognizant,"Technology, Advertising, Media, and Information",Renewal,,175095,Relet,Suburban,114586211.0,32040766.0,0.279621480808018,32.7557516577412,31.4765902519741,25377922.0,0.1688,33.412962,31.928076,6662844.0,0.0443,29.215098,28.684072,1331014.0,2024-Q2,Medium,Technology_Advertising_Media_and_Information_Medium
2018,Q3,6.0,Atlanta,271 17th,Atlanta_Midtown_Atlanta_271 17th_271 17th St NW,271 17th St NW,South,Atlanta,GA,30363.0,Midtown,A,13095.0,Square,"Technology, Advertising, Media, and Information",New,,5993371,Relet,CBD,103659328.0,22206503.0,0.214225805129665,29.5072586063214,26.3933334340637,,,,,,,,,1929820.0,2018-Q3,Medium,Technology_Advertising_Media_and_Information_Medium
2018,Q3,6.0,Atlanta,,Atlanta_North Fulton_Johns Creek_NA_6455 E Johns Xing,6455 E Johns Xing,South,Johns Creek,GA,30097.0,North Fulton,A,12238.0,Vsoft,"Technology, Advertising, Media, and Information",Renewal,,444977,Relet,Suburban,103659328.0,22206503.0,0.214225805129665,29.5072586063214,26.3933334340637,,,,,,,,,1929820.0,2018-Q3,Medium,Technology_Advertising_Media_and_Information_Medium
2018,Q3,6.0,Phoenix,3 S 2nd St,Phoenix_Downtown_Phoenix_3 S 2nd St_201 E Washington St,201 E Washington St,West,Phoenix,AZ,85004.0,Downtown,A,21344.0,Uber,"Technology, Advertising, Media, and Information",New,Central Corridor,224565,Sublet,CBD,45540054.0,9098116.0,0.199782723138624,30.7286629269632,26.8166952935553,,,,,,,,,607730.0,2018-Q3,Medium,Technology_Advertising_Media_and_Information_Medium
2018,Q3,6.0,Raleigh/Durham,Park 40 Plaza,Raleigh/Durham_RTP/RDU_Durham_Park 40 Plaza_1000 Park Forty Plaza Dr,1000 Park Forty Plaza Dr,South,Durham,NC,27713.0,RTP/RDU,A,26272.0,Charter Communications,"Technology, Advertising, Media, and Information",New,,67200,Relet,Suburban,,,,,,,,,,,,,,,2018-Q3,Medium,Technology_Advertising_Media_and_Information_Medium
2018,Q3,6.0,Raleigh/Durham,The Dillon  Office,Raleigh/Durham_Downtown Raleigh_Raleigh_The Dillon  Office_223 S West St,223 S West St,South,Raleigh,NC,27603.0,Downtown Raleigh,A,26875.0,Analog Devices,"Technology, Advertising, Media, and Information",New,Raleigh & Durham Downtowns Total,9822891,New,CBD,,,,,,,,,,,,,,,2018-Q3,Medium,Technology_Advertising_Media_and_Information_Medium
2018,Q3,6.0,Raleigh/Durham,Westchase I,Raleigh/Durham_West Raleigh_Raleigh_Westchase I_4020 Westchase Blvd,4020 Westchase Blvd,South,Raleigh,NC,27607.0,West Raleigh,A,15390.0,Qualys,"Technology, Advertising, Media, and Information",,,67533,New,Suburban,,,,,,,,,,,,,,,2018-Q3,Medium,Technology_Advertising_Media_and_Information_Medium
2018,Q3,7.0,Chicago,111 North Canal,Chicago_West Loop_Chicago_111 North Canal_111 N Canal St,111 N Canal St,Midwest/Central,Chicago,IL,60606.0,West Loop,O,27592.0,Pinterest,"Technology, Advertising, Media, and Information",New,,144438,Relet,CBD,,,,,,,,,,,,,,,2018-Q3,Medium,Technology_Advertising_Media_and_Information_Medium
2018,Q3,7.0,Houston,1455 West Loop South,Houston_West Loop/Galleria_Houston_1455 West Loop South_1455 West Loop S,1455 West Loop S,South,Houston,TX,77027.0,West Loop/Galleria,A,19038.0,Penn Well,"Technology, Advertising, Media, and Information",Renewal,,238832,,Suburban,114154896.0,31590818.0,0.276736426618093,33.4397149273622,28.5122604771179,,,,,,,,,2858821.0,2018-Q3,Medium,Technology_Advertising_Media_and_Information_Medium
2018,Q3,7.0,Manhattan,100104 Fifth Avenue,Manhattan_Flatiron_New York_100104 Fifth Avenue_100-104 5th Ave,100-104 5th Ave,Northeast,New York,NY,10011.0,Flatiron,O,16244.0,Adobe,"Technology, Advertising, Media, and Information",Expansion,Midtown South,41360,Relet,CBD,199870492.0,20133493.0,0.100732693448316,61.9900826547471,74.6320855266435,,,,,,,,,4550078.0,2018-Q3,Medium,Technology_Advertising_Media_and_Information_Medium
2018,Q3,7.0,Manhattan,110 E 24th St,Manhattan_Park Avenue South_New York_110 E 24th St_315 Park Ave S,315 Park Ave S,Northeast,New York,NY,10010.0,Park Avenue South,O,17000.0,Fullscreen Media,"Technology, Advertising, Media, and Information",Expansion,Midtown South,157511,Relet,CBD,199870492.0,20133493.0,0.100732693448316,61.9900826547471,74.6320855266435,,,,,,,,,4550078.0,2018-Q3,Medium,Technology_Advertising_Media_and_Information_Medium
2018,Q3,7.0,Manhattan,1127 W 42nd St,Manhattan_Grand Central_New York_1127 W 42nd St_11 W 42nd St,11 W 42nd St,Northeast,New York,NY,10036.0,Grand Central,O,20016.0,National Public Radio,"Technology, Advertising, Media, and Information",Extension,Midtown,157226,Relet,CBD,199870492.0,20133493.0,0.100732693448316,61.9900826547471,74.6320855266435,,,,,,,,,4550078.0,2018-Q3,Medium,Technology_Advertising_Media_and_Information_Medium
2018,Q3,7.0,Manhattan,153155 Spring St,Manhattan_Soho_New York_153155 Spring St_155 Spring St,155 Spring St,Northeast,New York,NY,10012.0,Soho,O,16113.0,Anonymous Content,"Technology, Advertising, Media, and Information",Expansion,Midtown South,158541,Relet,CBD,199870492.0,20133493.0,0.100732693448316,61.9900826547471,74.6320855266435,,,,,,,,,4550078.0,2018-Q3,Medium,Technology_Advertising_Media_and_Information_Medium
2018,Q3,7.0,Manhattan,200 E 42nd St,Manhattan_Grand Central_New York_200 E 42nd St_655 Third Ave,655 Third Ave,Northeast,New York,NY,10017.0,Grand Central,O,13001.0,Abacus,"Technology, Advertising, Media, and Information",Renewal and Expansion,Midtown,157267,,CBD,199870492.0,20133493.0,0.100732693448316,61.9900826547471,74.6320855266435,,,,,,,,,4550078.0,2018-Q3,Medium,Technology_Advertising_Media_and_Information_Medium
2018,Q3,7.0,Manhattan,632 Broadway,Manhattan_Greenwich Village_New York_632 Broadway_166 Crosby St,166 Crosby St,Northeast,New York,NY,10012.0,Greenwich Village,O,27400.0,Meetup,"Technology, Advertising, Media, and Information",Renewal,Midtown South,158150,,CBD,199870492.0,20133493.0,0.100732693448316,61.9900826547471,74.6320855266435,,,,,,,,,4550078.0,2018-Q3,Medium,Technology_Advertising_Media_and_Information_Medium
2018,Q3,7.0,Manhattan,Gross Bldg,Manhattan_Chelsea_New York_Gross Bldg_330 Seventh Ave,330 Seventh Ave,Northeast,New York,NY,10001.0,Chelsea,O,12850.0,Better Cloud,"Technology, Advertising, Media, and Information",Expansion,Midtown South,157428,Relet,CBD,199870492.0,20133493.0,0.100732693448316,61.9900826547471,74.6320855266435,,,,,,,,,4550078.0,2018-Q3,Medium,Technology_Advertising_Media_and_Information_Medium
2018,Q3,7.0,Manhattan,One World Trade Center,Manhattan_WTC/Brookfield Place_New York_One World Trade Center_One World Trade Center,One World Trade Center,Northeast,New York,NY,10007.0,WTC/Brookfield Place,A,25550.0,Undertone,"Technology, Advertising, Media, and Information",Relocation,Downtown,1130742,Relet,CBD,244542518.0,30684926.0,0.125478899338069,82.0305648880271,74.6320855266435,,,,,,,,,4198889.0,2018-Q3,Medium,Technology_Advertising_Media_and_Information_Medium
2018,Q3,7.0,Orange County,,Orange County_Airport Area_Irvine_NA_111 Theory Dr,111 Theory Dr,West,Irvine,CA,92617.0,Airport Area,O,26897.0,Intel,"Technology, Advertising, Media, and Information",Renewal,,281316,Relet,Suburban,,,,,,,,,,,,,,,2018-Q3,Medium,Technology_Advertising_Media_and_Information_Medium
2018,Q3,7.0,San Francisco,,San Francisco_Financial District South_San Francisco_NA_301 Howard St,301 Howard St,West,San Francisco,CA,94105.0,Financial District South,A,12731.0,Rainberry,"Technology, Advertising, Media, and Information",New,,320570,Sublet,CBD,46800865.0,3801901.0,0.0812356993829067,73.7020036886353,70.5694017665314,,,,,,,,,1381643.0,2018-Q3,Medium,Technology_Advertising_Media_and_Information_Medium
2018,Q3,7.0,Seattle,333 Elliott West,Seattle_Fremont / North Seattle_Seattle_333 Elliott West_333 Elliott Ave W,333 Elliott Ave W,West,Seattle,WA,98119.0,Fremont / North Seattle,O,27085.0,Outreach,"Technology, Advertising, Media, and Information",New,,1487291,Relet,Suburban,51977566.0,7554431.0,0.145340222356699,28.5636011945024,36.3015860540125,,,,,,,,,768564.0,2018-Q3,Medium,Technology_Advertising_Media_and_Information_Medium
