year,quarter,monthsigned,market,building_name,building_id,address,region,city,state,zip,internal_submarket,internal_class,leasedSF,company_name,internal_industry,transaction_type,internal_market_cluster,costarID,space_type,CBD_suburban,RBA,available_space,availability_proportion,internal_class_rent,overall_rent,direct_available_space,direct_availability_proportion,direct_internal_class_rent,direct_overall_rent,sublet_available_space,sublet_availability_proportion,sublet_internal_class_rent,sublet_overall_rent,leasing,year-quarter,company_size,industry_size
2018,Q2,4.0,Atlanta,Platinum Tower,Atlanta_Northwest_Atlanta_Platinum Tower_400 Interstate N Pky SE,400 Interstate N Pky SE,South,Atlanta,GA,30339.0,Northwest,A,2779.0,Numerex,"Technology, Advertising, Media, and Information",New,,434916,Relet,Suburban,103299677.0,21402315.0,0.207186659451026,29.2519005754806,26.0678750972516,,,,,,,,,1440017.0,2018-Q2,Small,Technology_Advertising_Media_and_Information_Small
2018,Q2,4.0,Atlanta,Two Decatur Town Center,Atlanta_Northlake_Decatur_Two Decatur Town Center_125 Clairemont Ave,125 Clairemont Ave,South,Decatur,GA,30030.0,Northlake,A,1993.0,Gimmie Games,"Technology, Advertising, Media, and Information",New,,437791,Relet,Suburban,103299677.0,21402315.0,0.207186659451026,29.2519005754806,26.0678750972516,,,,,,,,,1440017.0,2018-Q2,Small,Technology_Advertising_Media_and_Information_Small
2018,Q2,4.0,Boston,2 Adams Pl,Boston_Route 128 South_Braintree_2 Adams Pl_19-23 Granite St,19-23 Granite St,Northeast,Braintree,MA,2184.0,Route 128 South,A,6589.0,Infosys Technologies,"Technology, Advertising, Media, and Information",New,Route 128 Corridor,219431,Relet,Suburban,133073672.0,18646228.0,0.140119587291467,45.7071930392714,35.2171633843862,,,,,,,,,1898167.0,2018-Q2,Small,Technology_Advertising_Media_and_Information_Small
2018,Q2,4.0,Dallas/Ft Worth,One Hanover,Dallas/Ft Worth_North Dallas Corridor_Addison_One Hanover_16633 N Dallas Pky,16633 N Dallas Pky,South,Addison,TX,75001.0,North Dallas Corridor,A,8000.0,Cdw,"Technology, Advertising, Media, and Information",Renewal,,420129,,Suburban,,,,,,,,,,,,,,,2018-Q2,Small,Technology_Advertising_Media_and_Information_Small
2018,Q2,4.0,Denver,Canyon Center,Denver_Downtown Boulder_Boulder_Canyon Center_1881 9th St,1881 9th St,Midwest/Central,Boulder,CO,80302.0,Downtown Boulder,O,5170.0,Nvidia,"Technology, Advertising, Media, and Information",New,Greater Boulder,393356,Relet,CBD,,,,,,,,,,,,,,,2018-Q2,Small,Technology_Advertising_Media_and_Information_Small
2018,Q2,4.0,Denver,,Denver_LoDo / Platte / RiNo_Denver_NA_1614 15th St,1614 15th St,Midwest/Central,Denver,CO,80202.0,LoDo / Platte / RiNo,O,8900.0,Ingather Research & Sensory,"Technology, Advertising, Media, and Information",Renewal,Downtown Denver,501605,Relet,CBD,,,,,,,,,,,,,,,2018-Q2,Small,Technology_Advertising_Media_and_Information_Small
2018,Q2,4.0,Los Angeles,Marina Towers North,Los Angeles_Marina/Playa Vista_Marina Del Rey_Marina Towers North_4640 Admiralty Way,4640 Admiralty Way,West,Marina Del Rey,CA,90292.0,Marina/Playa Vista,A,4140.0,Telecom Lease Advisors,"Technology, Advertising, Media, and Information",Renewal,Westside,248545,,Suburban,144098024.0,25837665.0,0.179306171471165,39.0330756919583,36.5813015155726,,,,,,,,,2418566.0,2018-Q2,Small,Technology_Advertising_Media_and_Information_Small
2018,Q2,4.0,Manhattan,7983 Fifth Ave,Manhattan_Union Square_New York_7983 Fifth Ave_79 Fifth Ave,79 Fifth Ave,Northeast,New York,NY,10003.0,Union Square,O,5200.0,Hulu,"Technology, Advertising, Media, and Information",New,Midtown South,157605,Sublet,CBD,199870492.0,20756796.0,0.103851227824065,62.1751199680751,73.9042202835504,,,,,,,,,4324015.0,2018-Q2,Small,Technology_Advertising_Media_and_Information_Small
2018,Q2,4.0,Northern Virginia,Rosslyn Gateway South,Northern Virginia_Rosslyn_Arlington_Rosslyn Gateway South_1901 N Fort Myer Dr,1901 N Fort Myer Dr,Northeast,Arlington,VA,22209.0,Rosslyn,O,2112.0,Trident Group,"Technology, Advertising, Media, and Information",Renewal,Arlington County,137348,Relet,Suburban,50820827.0,11186620.0,0.220118810738755,28.7155514061252,32.3010111130319,,,,,,,,,602817.0,2018-Q2,Small,Technology_Advertising_Media_and_Information_Small
2018,Q2,4.0,Northern Virginia,Southgate Center I,Northern Virginia_Route 28 South / Chantilly_Chantilly_Southgate Center I_4501 Singer Ct,4501 Singer Ct,Northeast,Chantilly,VA,20151.0,Route 28 South / Chantilly,A,4241.0,Copper River Information Technology,"Technology, Advertising, Media, and Information",New,Fairfax County,135570,Relet,Suburban,98610960.0,21315720.0,0.216159745326483,34.4448668610663,32.3010111130319,,,,,,,,,2188728.0,2018-Q2,Small,Technology_Advertising_Media_and_Information_Small
2018,Q2,4.0,San Francisco,475 Sacramento St,San Francisco_Financial District North_San Francisco_475 Sacramento St_275 Battery St,275 Battery St,West,San Francisco,CA,94111.0,Financial District North,A,9630.0,Sensor Tower,"Technology, Advertising, Media, and Information",New,,320361,Relet,CBD,46050495.0,4027372.0,0.087455563724125,68.9639384422598,66.5293843664807,,,,,,,,,2194536.0,2018-Q2,Small,Technology_Advertising_Media_and_Information_Small
2018,Q2,4.0,South Bay/San Jose,Bldg 3,South Bay/San Jose_South San Jose_San Jose_Bldg 3_4340 Stevens Creek Blvd,4340 Stevens Creek Blvd,West,San Jose,CA,95129.0,South San Jose,O,2630.0,Tandon Group,"Technology, Advertising, Media, and Information",Renewal,,305929,,Suburban,,,,,,,,,,,,,,,2018-Q2,Small,Technology_Advertising_Media_and_Information_Small
2018,Q2,4.0,South Bay/San Jose,,South Bay/San Jose_North San Jose_San Jose_NA_1980-1982 Zanker Rd,1980-1982 Zanker Rd,West,San Jose,CA,95112.0,North San Jose,O,8127.0,Objectivity,"Technology, Advertising, Media, and Information",New,,309696,Relet,Suburban,,,,,,,,,,,,,,,2018-Q2,Small,Technology_Advertising_Media_and_Information_Small
2018,Q2,4.0,South Florida,BayView Corporate Tower,South Florida_Cypress Creek/Fort Lauderdale_Fort Lauderdale_BayView Corporate Tower_6451 N Federal Hwy,6451 N Federal Hwy,South,Fort Lauderdale,FL,33308.0,Cypress Creek/Fort Lauderdale,O,1467.0,Webb Mason,"Technology, Advertising, Media, and Information",New,Broward County,379017,Relet,Suburban,51137809.0,8032140.0,0.157068520475721,28.9804475377944,33.4349320475774,,,,,,,,,836465.0,2018-Q2,Small,Technology_Advertising_Media_and_Information_Small
2018,Q2,4.0,South Florida,Bayshore Executive Plaza,South Florida_NE Dade_Miami_Bayshore Executive Plaza_10800 Biscayne Blvd,10800 Biscayne Blvd,South,Miami,FL,33161.0,NE Dade,O,2800.0,Practice Panther,"Technology, Advertising, Media, and Information",New,Miami-Dade County,41905,New,Suburban,51137809.0,8032140.0,0.157068520475721,28.9804475377944,33.4349320475774,,,,,,,,,836465.0,2018-Q2,Small,Technology_Advertising_Media_and_Information_Small
2018,Q2,4.0,Tampa,Morgan Stanley Tower,Tampa_St. Petersburg CBD_Saint Petersburg_Morgan Stanley Tower_150 2nd Ave N,150 2nd Ave N,South,Saint Petersburg,FL,33701.0,St. Petersburg CBD,A,7000.0,Paradise Advertising & Marketing,"Technology, Advertising, Media, and Information",Renewal,,382126,,CBD,22636282.0,2653479.0,0.11722238660925,28.7579468132127,23.7175468131548,,,,,,,,,309597.0,2018-Q2,Small,Technology_Advertising_Media_and_Information_Small
2018,Q2,5.0,Atlanta,Circa 730,Atlanta_Midtown_Atlanta_Circa 730_730 Peachtree St NE,730 Peachtree St NE,South,Atlanta,GA,30308.0,Midtown,O,2583.0,Market Street Services,"Technology, Advertising, Media, and Information",New,,441002,Relet,CBD,65945176.0,12365457.0,0.1875111683681,20.2190604318338,26.0678750972516,,,,,,,,,792610.0,2018-Q2,Small,Technology_Advertising_Media_and_Information_Small
2018,Q2,5.0,Atlanta,North Terraces,Atlanta_Central Perimeter_Atlanta_North Terraces_400 Perimeter Center Ter,400 Perimeter Center Ter,South,Atlanta,GA,30346.0,Central Perimeter,A,4200.0,Knowles Intellectual Property Strategies,"Technology, Advertising, Media, and Information",New,,437461,Relet,Suburban,103299677.0,21402315.0,0.207186659451026,29.2519005754806,26.0678750972516,,,,,,,,,1440017.0,2018-Q2,Small,Technology_Advertising_Media_and_Information_Small
2018,Q2,5.0,Austin,515 Congress,Austin_CBD_Austin_515 Congress_515 Congress Ave,515 Congress Ave,South,Austin,TX,78701.0,CBD,A,3817.0,Magnitude Software,"Technology, Advertising, Media, and Information",Renewal,,591276,Relet,CBD,37106334.0,4709924.0,0.126930458826787,39.659272025382,35.7442116138143,,,,,,,,,1131284.0,2018-Q2,Small,Technology_Advertising_Media_and_Information_Small
2018,Q2,5.0,Charlotte,Morehead Place,Charlotte_Midtown/ South End_Charlotte_Morehead Place_521 E Morehead St,521 E Morehead St,South,Charlotte,NC,28202.0,Midtown/ South End,A,10676.0,Charter Communications,"Technology, Advertising, Media, and Information",New,,479482,Sublet,CBD,37279246.0,6442771.0,0.172824605948307,29.3791009452546,26.8226604382563,,,,,,,,,522574.0,2018-Q2,Small,Technology_Advertising_Media_and_Information_Small
2018,Q2,5.0,Chicago,Michigan Plaza,Chicago_East Loop_Chicago_Michigan Plaza_225 N Michigan Ave,225 N Michigan Ave,Midwest/Central,Chicago,IL,60601.0,East Loop,O,4822.0,Data Xu,"Technology, Advertising, Media, and Information",Renewal,,144387,,CBD,,,,,,,,,,,,,,,2018-Q2,Small,Technology_Advertising_Media_and_Information_Small
2018,Q2,5.0,Houston,The Cimarron Building,Houston_Nasa/Clear Lake_Houston_The Cimarron Building_1331 Gemini St,1331 Gemini St,South,Houston,TX,77058.0,Nasa/Clear Lake,O,1347.0,Vertex,"Technology, Advertising, Media, and Information",New,,240702,Relet,Suburban,78051358.0,19945987.0,0.255642865581776,20.5381144012492,28.5165015124504,,,,,,,,,1189553.0,2018-Q2,Small,Technology_Advertising_Media_and_Information_Small
2018,Q2,5.0,Manhattan,2731 Trinity Pl,Manhattan_WTC/Brookfield Place_New York_2731 Trinity Pl_55 Broadway,55 Broadway,Northeast,New York,NY,10006.0,WTC/Brookfield Place,A,10137.0,Seven Stars Cloud Group,"Technology, Advertising, Media, and Information",Restructure,Downtown,157233,Relet,CBD,244192517.0,29535879.0,0.120953251814838,82.0331156463172,73.9042202835504,,,,,,,,,6703076.0,2018-Q2,Small,Technology_Advertising_Media_and_Information_Small
2018,Q2,5.0,Manhattan,One World Trade Center,Manhattan_WTC/Brookfield Place_New York_One World Trade Center_One World Trade Center,One World Trade Center,Northeast,New York,NY,10007.0,WTC/Brookfield Place,A,4810.0,Kensho Technologies,"Technology, Advertising, Media, and Information",Expansion,Downtown,1130742,Relet,CBD,244192517.0,29535879.0,0.120953251814838,82.0331156463172,73.9042202835504,,,,,,,,,6703076.0,2018-Q2,Small,Technology_Advertising_Media_and_Information_Small
2018,Q2,5.0,Manhattan,The SoHo Building,Manhattan_Soho_New York_The SoHo Building_104-110 Greene St,104-110 Greene St,Northeast,New York,NY,10012.0,Soho,O,9700.0,Leanplum,"Technology, Advertising, Media, and Information",Relocation,Midtown South,157840,Relet,CBD,199870492.0,20756796.0,0.103851227824065,62.1751199680751,73.9042202835504,,,,,,,,,4324015.0,2018-Q2,Small,Technology_Advertising_Media_and_Information_Small
2018,Q2,5.0,Northern New Jersey,The Walton Bldg,Northern New Jersey_Middlesex_Piscataway_The Walton Bldg_242 Old New Brunswick Rd,242 Old New Brunswick Rd,Northeast,Piscataway,NJ,8854.0,Middlesex,A,1488.0,M Power Logic,"Technology, Advertising, Media, and Information",Renewal,,41492,Relet,Suburban,112490880.0,30215591.0,0.268604806007385,28.4283263168331,27.20733577737,,,,,,,,,1754265.0,2018-Q2,Small,Technology_Advertising_Media_and_Information_Small
2018,Q2,5.0,Northern Virginia,1717 Clarendon Blvd,Northern Virginia_Rosslyn_Arlington_1717 Clarendon Blvd_1776 Wilson Blvd,1776 Wilson Blvd,Northeast,Arlington,VA,22209.0,Rosslyn,A,5525.0,Lmo Advertising,"Technology, Advertising, Media, and Information",Renewal,Arlington County,6014463,Relet,Suburban,98610960.0,21315720.0,0.216159745326483,34.4448668610663,32.3010111130319,,,,,,,,,2188728.0,2018-Q2,Small,Technology_Advertising_Media_and_Information_Small
2018,Q2,5.0,Northern Virginia,Evergreen Terrace,Northern Virginia_Loudoun County_Manassas_Evergreen Terrace_9705 Liberia Ave,9705 Liberia Ave,Northeast,Manassas,VA,20110.0,Loudoun County,A,7080.0,Gold's Gym,"Technology, Advertising, Media, and Information",New,Loudoun/Stafford/Prince William,6430071,Relet,Suburban,98610960.0,21315720.0,0.216159745326483,34.4448668610663,32.3010111130319,,,,,,,,,2188728.0,2018-Q2,Small,Technology_Advertising_Media_and_Information_Small
2018,Q2,5.0,Northern Virginia,,Northern Virginia_Reston / Herndon_Reston_NA_11130 Sunrise Valley Dr,11130 Sunrise Valley Dr,Northeast,Reston,VA,20191.0,Reston / Herndon,A,5320.0,BEI,"Technology, Advertising, Media, and Information",Renewal,Fairfax County,135208,Relet,Suburban,98610960.0,21315720.0,0.216159745326483,34.4448668610663,32.3010111130319,,,,,,,,,2188728.0,2018-Q2,Small,Technology_Advertising_Media_and_Information_Small
2018,Q2,5.0,San Francisco,3 Embarcadero Ctr,San Francisco_Financial District North_San Francisco_3 Embarcadero Ctr_Three Embarcadero Ctr,Three Embarcadero Ctr,West,San Francisco,CA,94111.0,Financial District North,A,1840.0,Errigal,"Technology, Advertising, Media, and Information",New,,320471,Relet,CBD,46050495.0,4027372.0,0.087455563724125,68.9639384422598,66.5293843664807,,,,,,,,,2194536.0,2018-Q2,Small,Technology_Advertising_Media_and_Information_Small
2018,Q2,5.0,South Bay/San Jose,Bldg 1,South Bay/San Jose_Santa Clara_Santa Clara_Bldg 1_4633 Old Ironsides Dr,4633 Old Ironsides Dr,West,Santa Clara,CA,95054.0,Santa Clara,O,888.0,Medium One,"Technology, Advertising, Media, and Information",Renewal,,310090,,Suburban,,,,,,,,,,,,,,,2018-Q2,Small,Technology_Advertising_Media_and_Information_Small
2018,Q2,5.0,South Bay/San Jose,Palo Alto Labs,South Bay/San Jose_Palo Alto_Palo Alto_Palo Alto Labs_1804 Embarcadero Rd,1804 Embarcadero Rd,West,Palo Alto,CA,94303.0,Palo Alto,O,11145.0,Accellion,"Technology, Advertising, Media, and Information",Renewal,,302686,Relet,CBD,,,,,,,,,,,,,,,2018-Q2,Small,Technology_Advertising_Media_and_Information_Small
2018,Q2,5.0,Southern Maryland,Woodmont Plaza,Southern Maryland_Bethesda / Chevy Chase_Bethesda_Woodmont Plaza_8120 Woodmont Ave,8120 Woodmont Ave,Northeast,Bethesda,MD,20814.0,Bethesda / Chevy Chase,O,2549.0,Green Generation Solutions,"Technology, Advertising, Media, and Information",New,,819784,Relet,Suburban,,,,,,,,,,,,,,,2018-Q2,Small,Technology_Advertising_Media_and_Information_Small
2018,Q2,5.0,Washington D.C.,,Washington D.C._Central Business District_Washington_NA_1100 17th St NW,1100 17th St NW,Northeast,Washington,DC,20036.0,Central Business District,O,4588.0,Allison Partners,"Technology, Advertising, Media, and Information",New,,129168,Relet,CBD,,,,,,,,,,,,,,,2018-Q2,Small,Technology_Advertising_Media_and_Information_Small
2018,Q2,5.0,Washington D.C.,,Washington D.C._Central Business District_Washington_NA_1701 Pennsylvania Ave NW,1701 Pennsylvania Ave NW,Northeast,Washington,DC,20006.0,Central Business District,A,2625.0,First Look Media,"Technology, Advertising, Media, and Information",New,,129513,Relet,CBD,,,,,,,,,,,,,,,2018-Q2,Small,Technology_Advertising_Media_and_Information_Small
2018,Q2,5.0,Washington D.C.,,Washington D.C._East End_Washington_NA_650 Massachusetts Ave NW,650 Massachusetts Ave NW,Northeast,Washington,DC,20001.0,East End,A,3973.0,Buying Time,"Technology, Advertising, Media, and Information",Renewal,,129231,,CBD,,,,,,,,,,,,,,,2018-Q2,Small,Technology_Advertising_Media_and_Information_Small
2018,Q2,6.0,Detroit,,Detroit_Troy South_Troy_NA_2800 Livernois Rd,2800 Livernois Rd,Midwest/Central,Troy,MI,48083.0,Troy South,A,2910.0,Amdocs,"Technology, Advertising, Media, and Information",TBD,Suburban Detroit,458651,,Suburban,34423167.0,6472413.0,0.188024913570561,21.3336500243945,18.8803566539298,,,,,,,,,345698.0,2018-Q2,Small,Technology_Advertising_Media_and_Information_Small
2018,Q2,6.0,Manhattan,The Trump Building,Manhattan_Financial District_New York_The Trump Building_40 Wall St,40 Wall St,Northeast,New York,NY,10005.0,Financial District,A,10862.0,Derive Technologies,"Technology, Advertising, Media, and Information",Relocation,Downtown,157026,Relet,CBD,244192517.0,29535879.0,0.120953251814838,82.0331156463172,73.9042202835504,,,,,,,,,6703076.0,2018-Q2,Small,Technology_Advertising_Media_and_Information_Small
2019,Q2,3.0,Atlanta,Pacific Century Tower,Atlanta_Northlake_Atlanta_Pacific Century Tower_6 W Druid Hills Dr NE,6 W Druid Hills Dr NE,South,Atlanta,GA,30329.0,Northlake,O,9764.0,Industrial Media,"Technology, Advertising, Media, and Information",New,,437265,Relet,Suburban,66344064.0,11343275.0,0.170976487059943,20.72274351261,26.9054257174279,10504355.0,0.0617,20.820071,27.272135,838920.0,0.0049,19.200807,22.134262,687805.0,2019-Q2,Small,Technology_Advertising_Media_and_Information_Small
2019,Q2,3.0,Austin,Plaza 290,Austin_Southwest_Austin_Plaza 290_5316 Hwy 290 W,5316 Hwy 290 W,South,Austin,TX,78735.0,Southwest,O,1100.0,Iheart Radio,"Technology, Advertising, Media, and Information",New,,591283,Sublet,Suburban,27947525.0,3295636.0,0.118729320497142,30.7147950599793,36.2009202973452,2737010.0,0.0413,31.672212,37.50936,558626.0,0.0084,25.506284,30.130918,487384.0,2019-Q2,Small,Technology_Advertising_Media_and_Information_Small
2019,Q2,3.0,Boston,1836 Otis Pl,Boston_Financial District_Boston_1836 Otis Pl_77 Franklin St,77 Franklin St,Northeast,Boston,MA,2110.0,Financial District,O,5500.0,Hi Marley,"Technology, Advertising, Media, and Information",New,Boston/Suffolk County,222216,Relet,CBD,116276482.0,14248686.0,0.122541426734944,23.0134597969556,34.3251786655952,13181854.0,0.0524,22.985434,32.87633,1066832.0,0.0042,21.632875,39.755551,988837.0,2019-Q2,Small,Technology_Advertising_Media_and_Information_Small
2019,Q2,3.0,Boston,Henderson Carriage Building,Boston_Cambridge_Cambridge_Henderson Carriage Building_2067 Massachusetts Ave,2067 Massachusetts Ave,Northeast,Cambridge,MA,2140.0,Cambridge,A,6125.0,Dimensional Insight,"Technology, Advertising, Media, and Information",New,,215205,Sublet,CBD,135145149.0,18038525.0,0.133475194141079,42.1093472222838,34.3251786655952,14333594.0,0.057,41.173678,32.87633,3704931.0,0.0147,42.804836,39.755551,2986422.0,2019-Q2,Small,Technology_Advertising_Media_and_Information_Small
2019,Q2,3.0,Charlotte,,Charlotte_East Charlotte_Charlotte_NA_1805 Sardis Rd N,1805 Sardis Rd N,South,Charlotte,NC,28270.0,East Charlotte,O,1839.0,The Good Book,"Technology, Advertising, Media, and Information",New,,479844,Relet,Suburban,27835480.0,2971476.0,0.106751383486112,23.0988677569748,28.1455057090784,2635641.0,0.0404,23.229555,28.435415,335835.0,0.0051,21.934232,24.477567,147074.0,2019-Q2,Small,Technology_Advertising_Media_and_Information_Small
2019,Q2,3.0,Chicago Suburbs,Schaumburg Corporate Center III,Chicago Suburbs_Northwest Corridor_Schaumburg_Schaumburg Corporate Center III_1475 E Woodfield Rd,1475 E Woodfield Rd,Midwest/Central,Schaumburg,IL,60173.0,Northwest Corridor,A,4476.0,Bectran,"Technology, Advertising, Media, and Information",New,,146642,Relet,Suburban,52799639.0,13766770.0,0.260736062987097,27.4738058246421,23.7702058474828,11830166.0,0.1193,27.963386,24.04943,1936604.0,0.0195,19.380758,17.731739,907751.0,2019-Q2,Small,Technology_Advertising_Media_and_Information_Small
2019,Q2,3.0,Northern New Jersey,65 Challenger Blvd,Northern New Jersey_East Bergen_Ridgefield Park_65 Challenger Blvd_65 Challenger Rd,65 Challenger Rd,Northeast,Ridgefield Park,NJ,7660.0,East Bergen,A,6778.0,Jiangnan Environmental Technology,"Technology, Advertising, Media, and Information",New,,161638,,Suburban,112389052.0,27583817.0,0.245431530110246,29.6993131123202,28.6555475686613,22908736.0,0.1573,29.745474,28.665985,4675081.0,0.0321,29.112632,28.508059,1203461.0,2019-Q2,Small,Technology_Advertising_Media_and_Information_Small
2019,Q2,3.0,Seattle,Fourth  Vine,Seattle_Seattle CBD_Seattle_Fourth  Vine_2601 4th Ave,2601 4th Ave,West,Seattle,WA,98121.0,Seattle CBD,A,4095.0,Hospitality Online,"Technology, Advertising, Media, and Information",Renewal,,470297,,CBD,60747381.0,6913905.0,0.113814042452299,45.9356805878853,37.9400043851624,5685464.0,0.0504,46.645537,38.490995,1228441.0,0.0109,40.585667,34.447098,2143476.0,2019-Q2,Small,Technology_Advertising_Media_and_Information_Small
2019,Q2,3.0,Seattle,Fourth  Vine,Seattle_Seattle CBD_Seattle_Fourth  Vine_2601 4th Ave,2601 4th Ave,West,Seattle,WA,98121.0,Seattle CBD,A,8889.0,Municipal Research & Service Center,"Technology, Advertising, Media, and Information",Renewal,,470297,,CBD,60747381.0,6913905.0,0.113814042452299,45.9356805878853,37.9400043851624,5685464.0,0.0504,46.645537,38.490995,1228441.0,0.0109,40.585667,34.447098,2143476.0,2019-Q2,Small,Technology_Advertising_Media_and_Information_Small
2019,Q2,3.0,South Bay/San Jose,The Almaden,South Bay/San Jose_Downtown San Jose_San Jose_The Almaden_1 Almaden Blvd,1 Almaden Blvd,West,San Jose,CA,95113.0,Downtown San Jose,O,7734.0,Zoom Video Communications,"Technology, Advertising, Media, and Information",New,,306217,Relet,CBD,,,,,,,,,,,,,,,2019-Q2,Small,Technology_Advertising_Media_and_Information_Small
2019,Q2,4.0,Atlanta,Lake View I,Atlanta_North Fulton_Alpharetta_Lake View I_1105 Lakewood Pky,1105 Lakewood Pky,South,Alpharetta,GA,30009.0,North Fulton,A,7055.0,Hexaware Technologies,"Technology, Advertising, Media, and Information",New,,444607,Relet,Suburban,103866928.0,20867317.0,0.200904343680984,29.9445463104943,26.9054257174279,18391134.0,0.108,30.525283,27.272135,2476183.0,0.0145,23.278305,22.134262,1532604.0,2019-Q2,Small,Technology_Advertising_Media_and_Information_Small
2019,Q2,4.0,Baltimore,BECO Towers I,Baltimore_Reisterstown Rd Corridor_Owings Mills_BECO Towers I_10451 Mill Run Cir,10451 Mill Run Cir,Northeast,Owings Mills,MD,21117.0,Reisterstown Rd Corridor,A,9558.0,Mind Over Machines,"Technology, Advertising, Media, and Information",Renewal,North Suburbs,138336,Relet,Suburban,41915202.0,7204407.0,0.171880526783576,26.5263722547327,23.9286856277536,6565679.0,0.0798,26.515443,23.898512,638728.0,0.0078,26.796712,24.529739,419460.0,2019-Q2,Small,Technology_Advertising_Media_and_Information_Small
2019,Q2,4.0,Chicago,303 East Wacker,Chicago_East Loop_Chicago_303 East Wacker_303 E Wacker Dr,303 E Wacker Dr,Midwest/Central,Chicago,IL,60601.0,East Loop,O,4795.0,Hireology,"Technology, Advertising, Media, and Information",New,,144365,Relet,CBD,,,,,,,,,,,,,,,2019-Q2,Small,Technology_Advertising_Media_and_Information_Small
2019,Q2,4.0,Houston,Hollister  Hillmont Bldg,Houston_Northwest/290 Far_Houston_Hollister  Hillmont Bldg_5300 Hollister Rd,5300 Hollister Rd,South,Houston,TX,77040.0,Northwest/290 Far,O,5770.0,Gcp Technologies,"Technology, Advertising, Media, and Information",Renewal,,239850,Relet,Suburban,78051358.0,18888576.0,0.242090285900575,20.634460543688,28.435689063275,18073026.0,0.094,20.840033,28.972157,815550.0,0.0042,15.846735,22.974909,1049916.0,2019-Q2,Small,Technology_Advertising_Media_and_Information_Small
2019,Q2,4.0,Manhattan,101 Greenwich St,Manhattan_WTC/Brookfield Place_New York_101 Greenwich St_101 Greenwich St,101 Greenwich St,Northeast,New York,NY,10006.0,WTC/Brookfield Place,O,6110.0,Botify,"Technology, Advertising, Media, and Information",Relocation,Downtown,157314,,CBD,200026077.0,18165113.0,0.0908137242525633,61.4046508004938,80.4832380705748,14086664.0,0.0315,61.723811,83.104269,4078449.0,0.0091,57.206137,57.587003,3477494.0,2019-Q2,Small,Technology_Advertising_Media_and_Information_Small
2019,Q2,4.0,Manhattan,31 Penn Plaza,Manhattan_Penn Plaza/Times Square South_New York_31 Penn Plaza_132 W 31st St,132 W 31st St,Northeast,New York,NY,10001.0,Penn Plaza/Times Square South,O,10204.0,Execonline,"Technology, Advertising, Media, and Information",Relocation,Midtown,157565,Relet,CBD,200026077.0,18165113.0,0.0908137242525633,61.4046508004938,80.4832380705748,14086664.0,0.0315,61.723811,83.104269,4078449.0,0.0091,57.206137,57.587003,3477494.0,2019-Q2,Small,Technology_Advertising_Media_and_Information_Small
2019,Q2,4.0,Manhattan,387393 Park Ave S,Manhattan_Park Avenue South_New York_387393 Park Ave S_387 Park Ave S,387 Park Ave S,Northeast,New York,NY,10016.0,Park Avenue South,O,6911.0,Amenity Analytics,"Technology, Advertising, Media, and Information",Expansion,Midtown South,158084,Sublet,CBD,200026077.0,18165113.0,0.0908137242525633,61.4046508004938,80.4832380705748,14086664.0,0.0315,61.723811,83.104269,4078449.0,0.0091,57.206137,57.587003,3477494.0,2019-Q2,Small,Technology_Advertising_Media_and_Information_Small
2019,Q2,4.0,Manhattan,9e38,Manhattan_Grand Central_New York_9e38_9 E 38th St,9 E 38th St,Northeast,New York,NY,10016.0,Grand Central,O,5064.0,Comply Advantage,"Technology, Advertising, Media, and Information",Expansion,Midtown,158172,Sublet,CBD,200026077.0,18165113.0,0.0908137242525633,61.4046508004938,80.4832380705748,14086664.0,0.0315,61.723811,83.104269,4078449.0,0.0091,57.206137,57.587003,3477494.0,2019-Q2,Small,Technology_Advertising_Media_and_Information_Small
2019,Q2,4.0,Manhattan,Bowling Green Bldg,Manhattan_WTC/Brookfield Place_New York_Bowling Green Bldg_11 Broadway,11 Broadway,Northeast,New York,NY,10004.0,WTC/Brookfield Place,O,1587.0,Oraiko,"Technology, Advertising, Media, and Information",Renewal,Downtown,157418,,CBD,200026077.0,18165113.0,0.0908137242525633,61.4046508004938,80.4832380705748,14086664.0,0.0315,61.723811,83.104269,4078449.0,0.0091,57.206137,57.587003,3477494.0,2019-Q2,Small,Technology_Advertising_Media_and_Information_Small
2019,Q2,4.0,Manhattan,,Manhattan_Park Avenue South_New York_NA_373 Park Ave S,373 Park Ave S,Northeast,New York,NY,10016.0,Park Avenue South,O,8732.0,Launchsquad,"Technology, Advertising, Media, and Information",Relocation,Midtown South,158078,Relet,CBD,200026077.0,18165113.0,0.0908137242525633,61.4046508004938,80.4832380705748,14086664.0,0.0315,61.723811,83.104269,4078449.0,0.0091,57.206137,57.587003,3477494.0,2019-Q2,Small,Technology_Advertising_Media_and_Information_Small
