year,quarter,monthsigned,market,building_name,building_id,address,region,city,state,zip,internal_submarket,internal_class,leasedSF,company_name,internal_industry,transaction_type,internal_market_cluster,costarID,space_type,CBD_suburban,RBA,available_space,availability_proportion,internal_class_rent,overall_rent,direct_available_space,direct_availability_proportion,direct_internal_class_rent,direct_overall_rent,sublet_available_space,sublet_availability_proportion,sublet_internal_class_rent,sublet_overall_rent,leasing,year-quarter,company_size,industry_size
2024,Q3,8.0,San Francisco,608 Commercial St,San Francisco_Financial District North_San Francisco_608 Commercial St_555 Montgomery St,555 Montgomery St,West,San Francisco,CA,94111.0,Financial District North,A,6721.0,Hero Digital,"Technology, Advertising, Media, and Information",New,,320734,Sublet,CBD,56633008.0,19441595.0,0.343290877291914,75.1027032458946,68.2170675700458,14768384.0,0.1662,80.400491,71.752706,4673211.0,0.0526,58.368366,57.653946,1345703.0,2024-Q3,Small,Technology_Advertising_Media_and_Information_Small
2024,Q3,9.0,Chicago,THE MART,Chicago_River North_Chicago_THE MART_222 Merchandise Mart Plz,222 Merchandise Mart Plz,Midwest/Central,Chicago,IL,60654.0,River North,O,10091.0,Foxcorp Holdings,"Technology, Advertising, Media, and Information",TBD,,144391,Relet,CBD,,,,,,,,,,,,,,,2024-Q3,Small,Technology_Advertising_Media_and_Information_Small
2024,Q3,9.0,Detroit,Auburn Hills Corporate Center,Detroit_Auburn Hills / Rochester_Auburn Hills_Auburn Hills Corporate Center_900 N Squirrel Rd,900 N Squirrel Rd,Midwest/Central,Auburn Hills,MI,48326.0,Auburn Hills / Rochester,A,9962.0,Allegro Microsystems,"Technology, Advertising, Media, and Information",TBD,Suburban Detroit,460524,Relet,Suburban,36684001.0,9776349.0,0.266501710105176,23.6363991472463,21.6385459522153,8529865.0,0.1004,23.979394,21.992432,1246484.0,0.0147,19.063798,17.464776,561095.0,2024-Q3,Small,Technology_Advertising_Media_and_Information_Small
2024,Q3,9.0,Manhattan,394408 Madison Ave,Manhattan_Grand Central_New York_394408 Madison Ave_400 Madison Ave,400 Madison Ave,Northeast,New York,NY,10017.0,Grand Central,O,6154.0,D Exposito & Partners,"Technology, Advertising, Media, and Information",New,Midtown,157431,Relet,CBD,198553779.0,39959005.0,0.201250286956261,61.65304255607,75.9093678931504,33133297.0,0.0711,64.788593,80.836168,6825708.0,0.0146,45.467794,57.972647,3818375.0,2024-Q3,Small,Technology_Advertising_Media_and_Information_Small
2024,Q3,9.0,Salt Lake City,Zims Building,Salt Lake City_CBD_Salt Lake City_Zims Building_140-150 S State St,140-150 S State St,West,Salt Lake City,UT,84111.0,CBD,O,10000.0,Onboard,"Technology, Advertising, Media, and Information",New,,1058120,Relet,CBD,25275193.0,4964764.0,0.196428331922134,24.0896859539306,27.3415666720641,4436683.0,0.0942,24.524761,28.205337,528081.0,0.0112,21.150595,23.906419,152048.0,2024-Q3,Small,Technology_Advertising_Media_and_Information_Small
2018,Q4,9.0,Denver,,Denver_Southeast_Englewood_NA_304 Inverness Way S,304 Inverness Way S,Midwest/Central,Englewood,CO,80112.0,Southeast,O,2568.0,Advanced Network Management,"Technology, Advertising, Media, and Information",New,,401955,Relet,Suburban,,,,,,,,,,,,,,,2018-Q4,Small,Technology_Advertising_Media_and_Information_Small
2018,Q4,9.0,Los Angeles,,Los Angeles_Central San Fernando Valley_Sherman Oaks_NA_5805 Sepulveda Blvd,5805 Sepulveda Blvd,West,Sherman Oaks,CA,91411.0,Central San Fernando Valley,A,3597.0,Visual Effects Society,"Technology, Advertising, Media, and Information",Renewal,San Fernando Valley,248754,,Suburban,144721671.0,24918510.0,0.172182298807205,41.501803130904,38.758575652246,,,,,,,,,3679718.0,2018-Q4,Small,Technology_Advertising_Media_and_Information_Small
2018,Q4,9.0,Manhattan,261267 Canal St,Manhattan_Soho_New York_261267 Canal St_261-267 Canal St,261-267 Canal St,Northeast,New York,NY,10013.0,Soho,O,408.0,Paper Street Films,"Technology, Advertising, Media, and Information",New,Midtown South,1240034,Relet,CBD,199870492.0,18953645.0,0.0948296309792443,61.4446490070472,77.408112510696,,,,,,,,,5143430.0,2018-Q4,Small,Technology_Advertising_Media_and_Information_Small
2018,Q4,9.0,Manhattan,One Liberty Plaza,Manhattan_WTC/Brookfield Place_New York_One Liberty Plaza_1 Liberty Plz,1 Liberty Plz,Northeast,New York,NY,10006.0,WTC/Brookfield Place,A,11456.0,Digiday,"Technology, Advertising, Media, and Information",New,Downtown,157043,Sublet,CBD,246759127.0,28690887.0,0.116270823895401,86.498436481122,77.408112510696,,,,,,,,,6598763.0,2018-Q4,Small,Technology_Advertising_Media_and_Information_Small
2018,Q4,9.0,Northern New Jersey,Greenbrook Executive Center,Northern New Jersey_Wayne_Fairfield_Greenbrook Executive Center_100 Passaic Ave,100 Passaic Ave,Northeast,Fairfield,NJ,7004.0,Wayne,A,2718.0,The Macaluso Group,"Technology, Advertising, Media, and Information",New,,87698,Relet,Suburban,112430880.0,28402335.0,0.252620409979892,28.173788017714,27.3974623111869,,,,,,,,,1569832.0,2018-Q4,Small,Technology_Advertising_Media_and_Information_Small
2018,Q4,9.0,Northern Virginia,The Atrium at Worldgate,Northern Virginia_Reston / Herndon_Herndon_The Atrium at Worldgate_205 Van Buren St,205 Van Buren St,Northeast,Herndon,VA,20170.0,Reston / Herndon,O,4181.0,Samsung,"Technology, Advertising, Media, and Information",New,Fairfax County,135516,Sublet,Suburban,50820827.0,10497779.0,0.206564505532348,28.9209729459548,32.6030846355442,,,,,,,,,585942.0,2018-Q4,Small,Technology_Advertising_Media_and_Information_Small
2018,Q4,9.0,Northern Virginia,,Northern Virginia_Reston / Herndon_Reston_NA_1920 Association Dr,1920 Association Dr,Northeast,Reston,VA,20191.0,Reston / Herndon,O,3000.0,Apptad,"Technology, Advertising, Media, and Information",New,Fairfax County,610,Relet,Suburban,50820827.0,10497779.0,0.206564505532348,28.9209729459548,32.6030846355442,,,,,,,,,585942.0,2018-Q4,Small,Technology_Advertising_Media_and_Information_Small
2018,Q4,10.0,Baltimore,701 Aliceanna St,Baltimore_Baltimore City South_Baltimore_701 Aliceanna St_100 International Dr,100 International Dr,Northeast,Baltimore,MD,21202.0,Baltimore City South,A,500.0,Costar Group,"Technology, Advertising, Media, and Information",Renewal,Baltimore City,5623855,Sublet,CBD,41594238.0,7167071.0,0.172309227061691,27.1711408382655,23.4786510455246,,,,,,,,,368227.0,2018-Q4,Small,Technology_Advertising_Media_and_Information_Small
2018,Q4,10.0,Boston,The Glass Tower,Boston_Southern New Hampshire_Nashua_The Glass Tower_20 Trafalgar Sq,20 Trafalgar Sq,Northeast,Nashua,NH,3063.0,Southern New Hampshire,A,500.0,Seoptiks,"Technology, Advertising, Media, and Information",Renewal,,214154,,Suburban,133484672.0,18508938.0,0.138659650750013,42.0147611158493,32.9089536292717,,,,,,,,,1356055.0,2018-Q4,Small,Technology_Advertising_Media_and_Information_Small
2018,Q4,10.0,Boston,,Boston_Route 128 North_North Reading_NA_400 Riverpark Dr,400 Riverpark Dr,Northeast,North Reading,MA,1864.0,Route 128 North,A,3822.0,Tracelink,"Technology, Advertising, Media, and Information",New,Route 128 Corridor,217903,Relet,Suburban,133484672.0,18508938.0,0.138659650750013,42.0147611158493,32.9089536292717,,,,,,,,,1356055.0,2018-Q4,Small,Technology_Advertising_Media_and_Information_Small
2018,Q4,10.0,Charlotte,Harris Building,Charlotte_Ballantyne / Highway 51_Charlotte_Harris Building_13024 Ballantyne Corporate Pl,13024 Ballantyne Corporate Pl,South,Charlotte,NC,28277.0,Ballantyne / Highway 51,A,7320.0,Paymentus,"Technology, Advertising, Media, and Information",New,,5923843,Sublet,Suburban,37279246.0,5842469.0,0.156721758803813,30.1201906009039,27.3965078864549,,,,,,,,,670952.0,2018-Q4,Small,Technology_Advertising_Media_and_Information_Small
2018,Q4,10.0,Chicago Suburbs,Bannockburn Lakes II,Chicago Suburbs_North Corridor_Bannockburn_Bannockburn Lakes II_2345 Waukegan Rd,2345 Waukegan Rd,Midwest/Central,Bannockburn,IL,60015.0,North Corridor,A,1671.0,Decision Design,"Technology, Advertising, Media, and Information",New,,209668,Relet,Suburban,53959122.0,14304151.0,0.265092360101782,27.1130316943204,23.5682177410697,,,,,,,,,1182043.0,2018-Q4,Small,Technology_Advertising_Media_and_Information_Small
2018,Q4,10.0,Dallas/Ft Worth,Centerpoint One,Dallas/Ft Worth_Mid-Cities_Arlington_Centerpoint One_624 Six Flags Dr,624 Six Flags Dr,South,Arlington,TX,76011.0,Mid-Cities,O,4828.0,North Central Texas Regional Certification Agency,"Technology, Advertising, Media, and Information",Renewal,,422527,Relet,Suburban,,,,,,,,,,,,,,,2018-Q4,Small,Technology_Advertising_Media_and_Information_Small
2018,Q4,10.0,Dallas/Ft Worth,Uptown Tower,Dallas/Ft Worth_Central Expressway_Dallas_Uptown Tower_4144 N Central Expy,4144 N Central Expy,South,Dallas,TX,75204.0,Central Expressway,O,2532.0,New Lifestyles,"Technology, Advertising, Media, and Information",New,,409380,Relet,Suburban,,,,,,,,,,,,,,,2018-Q4,Small,Technology_Advertising_Media_and_Information_Small
2018,Q4,10.0,Dallas/Ft Worth,Uptown Tower,Dallas/Ft Worth_Central Expressway_Dallas_Uptown Tower_4144 N Central Expy,4144 N Central Expy,South,Dallas,TX,75204.0,Central Expressway,O,2532.0,New Lifestyles,"Technology, Advertising, Media, and Information",New,,409380,Relet,Suburban,,,,,,,,,,,,,,,2018-Q4,Small,Technology_Advertising_Media_and_Information_Small
2018,Q4,10.0,Denver,,Denver_Boulder County_Longmont_NA_6309 Monarch Park Pl,6309 Monarch Park Pl,Midwest/Central,Longmont,CO,80503.0,Boulder County,O,3049.0,Stmicroelectronics,"Technology, Advertising, Media, and Information",New,Greater Boulder,573241,Relet,Suburban,,,,,,,,,,,,,,,2018-Q4,Small,Technology_Advertising_Media_and_Information_Small
2018,Q4,10.0,Los Angeles,,Los Angeles_N. Hwd/St. City/Univ City_North Hollywood_NA_4640 Lankershim Blvd,4640 Lankershim Blvd,West,North Hollywood,CA,91602.0,N. Hwd/St. City/Univ City,A,1000.0,Cami Patton Casting,"Technology, Advertising, Media, and Information",Renewal,Westside,248546,,CBD,144721671.0,24918510.0,0.172182298807205,41.501803130904,38.758575652246,,,,,,,,,3679718.0,2018-Q4,Small,Technology_Advertising_Media_and_Information_Small
2018,Q4,10.0,Manhattan,225229 W 39th St,Manhattan_Penn Plaza/Times Square South_New York_225229 W 39th St_225 W 39th St,225 W 39th St,Northeast,New York,NY,10018.0,Penn Plaza/Times Square South,O,2500.0,Lighthouse Films,"Technology, Advertising, Media, and Information",New,Midtown,158009,Relet,CBD,199870492.0,18953645.0,0.0948296309792443,61.4446490070472,77.408112510696,,,,,,,,,5143430.0,2018-Q4,Small,Technology_Advertising_Media_and_Information_Small
2018,Q4,10.0,Manhattan,2628 E 41st St,Manhattan_Grand Central_New York_2628 E 41st St_292 Madison Ave,292 Madison Ave,Northeast,New York,NY,10017.0,Grand Central,O,11113.0,Spark44,"Technology, Advertising, Media, and Information",Relocation,Midtown,157313,Sublet,CBD,199870492.0,18953645.0,0.0948296309792443,61.4446490070472,77.408112510696,,,,,,,,,5143430.0,2018-Q4,Small,Technology_Advertising_Media_and_Information_Small
2018,Q4,10.0,Manhattan,5157 W 31st St,Manhattan_Penn Plaza/Times Square South_New York_5157 W 31st St_1261 Broadway,1261 Broadway,Northeast,New York,NY,10001.0,Penn Plaza/Times Square South,O,3500.0,Abrams Media,"Technology, Advertising, Media, and Information",Expansion,Midtown,158185,Relet,CBD,199870492.0,18953645.0,0.0948296309792443,61.4446490070472,77.408112510696,,,,,,,,,5143430.0,2018-Q4,Small,Technology_Advertising_Media_and_Information_Small
2018,Q4,10.0,Manhattan,Film Forum,Manhattan_Hudson Square_New York_Film Forum_200 Varick St,200 Varick St,Northeast,New York,NY,10014.0,Hudson Square,O,5240.0,Ben Group,"Technology, Advertising, Media, and Information",New,Midtown South,157998,Relet,CBD,199870492.0,18953645.0,0.0948296309792443,61.4446490070472,77.408112510696,,,,,,,,,5143430.0,2018-Q4,Small,Technology_Advertising_Media_and_Information_Small
2018,Q4,10.0,Manhattan,,Manhattan_Financial District_New York_NA_1 Whitehall St,1 Whitehall St,Northeast,New York,NY,10004.0,Financial District,A,7356.0,Adstruc,"Technology, Advertising, Media, and Information",,Downtown,157464,Sublet,CBD,246759127.0,28690887.0,0.116270823895401,86.498436481122,77.408112510696,,,,,,,,,6598763.0,2018-Q4,Small,Technology_Advertising_Media_and_Information_Small
2018,Q4,10.0,Manhattan,,Manhattan_Penn Plaza/Times Square South_New York_NA_263 W 38th St,263 W 38th St,Northeast,New York,NY,10018.0,Penn Plaza/Times Square South,O,9700.0,Quotient,"Technology, Advertising, Media, and Information",New,Midtown,157643,Relet,CBD,199870492.0,18953645.0,0.0948296309792443,61.4446490070472,77.408112510696,,,,,,,,,5143430.0,2018-Q4,Small,Technology_Advertising_Media_and_Information_Small
2018,Q4,10.0,Manhattan,,Manhattan_Financial District_New York_NA_48 Wall St,48 Wall St,Northeast,New York,NY,10005.0,Financial District,A,7150.0,Urban Ft,"Technology, Advertising, Media, and Information",Relocation,Downtown,157262,Relet,CBD,246759127.0,28690887.0,0.116270823895401,86.498436481122,77.408112510696,,,,,,,,,6598763.0,2018-Q4,Small,Technology_Advertising_Media_and_Information_Small
2018,Q4,10.0,Northern Virginia,,Northern Virginia_Huntington / Eisenhower_Alexandria_NA_3601 Eisenhower Ave,3601 Eisenhower Ave,Northeast,Alexandria,VA,22304.0,Huntington / Eisenhower,A,2400.0,Team Technology,"Technology, Advertising, Media, and Information",Renewal,Alexandria,137599,Relet,Suburban,98785668.0,22201031.0,0.224739392358009,34.3963200551224,32.6030846355442,,,,,,,,,2807514.0,2018-Q4,Small,Technology_Advertising_Media_and_Information_Small
2018,Q4,10.0,Northern Virginia,,Northern Virginia_Tysons Corner_McLean_NA_8200 Greensboro Dr,8200 Greensboro Dr,Northeast,McLean,VA,22102.0,Tysons Corner,A,6072.0,Everbridge,"Technology, Advertising, Media, and Information",New,Fairfax County,135354,Sublet,Suburban,98785668.0,22201031.0,0.224739392358009,34.3963200551224,32.6030846355442,,,,,,,,,2807514.0,2018-Q4,Small,Technology_Advertising_Media_and_Information_Small
2018,Q4,10.0,Philadelphia,The Curtis,Philadelphia_East Market_Philadelphia_The Curtis_601 Walnut St,601 Walnut St,Northeast,Philadelphia,PA,19106.0,East Market,A,4000.0,Humanistic Robotics,"Technology, Advertising, Media, and Information",Relocation,,300387,,CBD,85439454.0,14724955.0,0.172343739462567,29.1386926607641,27.9779109402998,,,,,,,,,1542595.0,2018-Q4,Small,Technology_Advertising_Media_and_Information_Small
2018,Q4,10.0,Phoenix,7272 Old Town,Phoenix_Scottsdale South_Scottsdale_7272 Old Town_7272 E Indian School Rd,7272 E Indian School Rd,West,Scottsdale,AZ,85251.0,Scottsdale South,A,9254.0,Zenreach,"Technology, Advertising, Media, and Information",New,Scottsdale,224663,Sublet,Suburban,46080465.0,9222383.0,0.200136500358666,30.956143763769,27.361707772669,,,,,,,,,750315.0,2018-Q4,Small,Technology_Advertising_Media_and_Information_Small
2018,Q4,10.0,Seattle,14ACRES  Building III,Seattle_I-90 / East King County_Bellevue_14ACRES  Building III_15375 SE 30th Pl,15375 SE 30th Pl,West,Bellevue,WA,98007.0,I-90 / East King County,O,5168.0,Huawei Technologies Usa,"Technology, Advertising, Media, and Information",Renewal,,502120,New,Suburban,51977566.0,6844673.0,0.1316851389309,28.5663505708425,37.718775402664,,,,,,,,,1111045.0,2018-Q4,Small,Technology_Advertising_Media_and_Information_Small
2018,Q4,10.0,Washington D.C.,National Press Building,Washington D.C._East End_Washington_National Press Building_529 14th St NW,529 14th St NW,Northeast,Washington,DC,20045.0,East End,O,1195.0,Turkish Radio Television,"Technology, Advertising, Media, and Information",New,,129266,Relet,CBD,,,,,,,,,,,,,,,2018-Q4,Small,Technology_Advertising_Media_and_Information_Small
2018,Q4,10.0,Washington D.C.,,Washington D.C._East End_Washington_NA_1121 14th St NW,1121 14th St NW,Northeast,Washington,DC,20005.0,East End,A,3886.0,Arcadia Power,"Technology, Advertising, Media, and Information",New,,703590,Relet,CBD,,,,,,,,,,,,,,,2018-Q4,Small,Technology_Advertising_Media_and_Information_Small
2018,Q4,11.0,Dallas/Ft Worth,,Dallas/Ft Worth_Las Colinas_Irving_NA_1212 Corporate Dr,1212 Corporate Dr,South,Irving,TX,75038.0,Las Colinas,O,5691.0,Stormprime,"Technology, Advertising, Media, and Information",New,,94935,Relet,Suburban,,,,,,,,,,,,,,,2018-Q4,Small,Technology_Advertising_Media_and_Information_Small
2018,Q4,11.0,Los Angeles,Broadway Media Center,Los Angeles_Downtown LA_Los Angeles_Broadway Media Center_205 S Broadway,205 S Broadway,West,Los Angeles,CA,90012.0,Downtown LA,O,2000.0,Quandary Peak Research,"Technology, Advertising, Media, and Information",Renewal,,247519,,CBD,69187474.0,13610560.0,0.196720001658104,32.667620548966,38.758575652246,,,,,,,,,732414.0,2018-Q4,Small,Technology_Advertising_Media_and_Information_Small
2018,Q4,11.0,Northern New Jersey,NUS Corporate Plaza,Northern New Jersey_West Bergen_Park Ridge_NUS Corporate Plaza_1 Maynard Dr,1 Maynard Dr,Northeast,Park Ridge,NJ,7656.0,West Bergen,A,7874.0,Wainscot Media,"Technology, Advertising, Media, and Information",New,,161607,Relet,Suburban,112430880.0,28402335.0,0.252620409979892,28.173788017714,27.3974623111869,,,,,,,,,1569832.0,2018-Q4,Small,Technology_Advertising_Media_and_Information_Small
2018,Q4,11.0,Northern New Jersey,NUS Corporate Plaza,Northern New Jersey_West Bergen_Park Ridge_NUS Corporate Plaza_1 Maynard Dr,1 Maynard Dr,Northeast,Park Ridge,NJ,7656.0,West Bergen,A,8000.0,Wainscot Media,"Technology, Advertising, Media, and Information",,,161607,Relet,Suburban,112430880.0,28402335.0,0.252620409979892,28.173788017714,27.3974623111869,,,,,,,,,1569832.0,2018-Q4,Small,Technology_Advertising_Media_and_Information_Small
2019,Q4,9.0,Dallas/Ft Worth,One Main,Dallas/Ft Worth_Dallas CBD_Dallas_One Main_1201 Main St,1201 Main St,South,Dallas,TX,75202.0,Dallas CBD,O,5172.0,Level 3 Communications,"Technology, Advertising, Media, and Information",Renewal,,9649354,Relet,CBD,,,,,,,,,,,,,,,2019-Q4,Small,Technology_Advertising_Media_and_Information_Small
2019,Q4,9.0,Denver,Arapahoe Corporate Park,Denver_Southeast_Centennial_Arapahoe Corporate Park_12503 E Euclid Dr,12503 E Euclid Dr,Midwest/Central,Centennial,CO,80111.0,Southeast,O,3252.0,GALILEO PROCESSING,"Technology, Advertising, Media, and Information",Renewal,,395187,Relet,Suburban,,,,,,,,,,,,,,,2019-Q4,Small,Technology_Advertising_Media_and_Information_Small
2019,Q4,9.0,Manhattan,Lords Court Building,Manhattan_Financial District_New York_Lords Court Building_40 Exchange Pl,40 Exchange Pl,Northeast,New York,NY,10005.0,Financial District,O,5725.0,Loyalkaspar,"Technology, Advertising, Media, and Information",New,Downtown,157518,Sublet,CBD,200310172.0,19766988.0,0.0986818981913709,63.6588464465576,84.7466627584618,14106445.0,0.031,64.145123,88.438174,5660543.0,0.0124,60.55404,64.567057,3323773.0,2019-Q4,Small,Technology_Advertising_Media_and_Information_Small
2019,Q4,9.0,Northern Virginia,8000 Westbranch Dr,Northern Virginia_Tysons Corner_McLean_8000 Westbranch Dr_8000 Westpark Dr,8000 Westpark Dr,Northeast,McLean,VA,22102.0,Tysons Corner,O,2405.0,Direction.com,"Technology, Advertising, Media, and Information",New,Fairfax County,135423,Relet,Suburban,50820827.0,9106016.0,0.179178823674003,30.6633445341479,35.1689766095543,8569968.0,0.0566,30.854676,35.531762,536048.0,0.0035,26.806686,30.586615,707523.0,2019-Q4,Small,Technology_Advertising_Media_and_Information_Small
2019,Q4,9.0,Northern Virginia,Kingstowne One,Northern Virginia_Springfield / Annandale_Alexandria_Kingstowne One_5971 Kingstowne Village Pky,5971 Kingstowne Village Pky,Northeast,Alexandria,VA,22315.0,Springfield / Annandale,A,4929.0,Mantech,"Technology, Advertising, Media, and Information",New,Fairfax County,391851,Relet,Suburban,100499022.0,21191798.0,0.210865713698189,37.1336654363902,35.1689766095543,19258382.0,0.1273,37.645303,35.531762,1933416.0,0.0128,31.563986,30.586615,2191725.0,2019-Q4,Small,Technology_Advertising_Media_and_Information_Small
2019,Q4,9.0,San Diego,Bldg A,San Diego_Central Suburban_San Diego_Bldg A_2251 San Diego Ave,2251 San Diego Ave,West,San Diego,CA,92110.0,Central Suburban,O,1047.0,Cerasoll Strafford,"Technology, Advertising, Media, and Information",Renewal,,42632,,Suburban,33012845.0,5281374.0,0.159979365607539,32.8623292255891,36.5876164960694,4378204.0,0.0688,33.066693,37.216148,903170.0,0.0142,30.001255,31.122285,414273.0,2019-Q4,Small,Technology_Advertising_Media_and_Information_Small
2019,Q4,9.0,South Florida,Cypress Centre,South Florida_Cypress Creek/Fort Lauderdale_Fort Lauderdale_Cypress Centre_6600 N Andrews Ave,6600 N Andrews Ave,South,Fort Lauderdale,FL,33309.0,Cypress Creek/Fort Lauderdale,A,10762.0,Omnicom Group,"Technology, Advertising, Media, and Information",New,Broward County,378655,Relet,Suburban,53111282.0,10334664.0,0.194585097757572,41.8067810896513,36.4974218784032,9185261.0,0.0879,42.223508,36.719064,1149403.0,0.011,33.80342,31.660151,1162799.0,2019-Q4,Small,Technology_Advertising_Media_and_Information_Small
2019,Q4,10.0,Austin,Scarbrough Building,Austin_CBD_Austin_Scarbrough Building_522 N Congress Ave,522 N Congress Ave,South,Austin,TX,78701.0,CBD,A,10536.0,Dialpad,"Technology, Advertising, Media, and Information",New,,591335,Relet,CBD,38276350.0,5839118.0,0.152551588644163,42.77284623387,38.3496934180689,4915055.0,0.0742,43.126246,39.257077,924063.0,0.014,40.884154,33.371312,675683.0,2019-Q4,Small,Technology_Advertising_Media_and_Information_Small
2019,Q4,10.0,Detroit,Liberty Center,Detroit_Troy South_Troy_Liberty Center_100 W Big Beaver Rd,100 W Big Beaver Rd,Midwest/Central,Troy,MI,48084.0,Troy South,A,6000.0,ZKW,"Technology, Advertising, Media, and Information",Renewal,Suburban Detroit,455850,,Suburban,34533167.0,6127939.0,0.177450825752529,22.6046938437686,20.225982384794,5234784.0,0.064,22.82513,20.174528,893155.0,0.0109,20.814936,19.377848,364578.0,2019-Q4,Small,Technology_Advertising_Media_and_Information_Small
2019,Q4,10.0,Manhattan,560 Broadway,Manhattan_Soho_New York_560 Broadway_100 Crosby St,100 Crosby St,Northeast,New York,NY,10012.0,Soho,O,4578.0,101 Studios,"Technology, Advertising, Media, and Information",New,Midtown South,158630,Sublet,CBD,200310172.0,19766988.0,0.0986818981913709,63.6588464465576,84.7466627584618,14106445.0,0.031,64.145123,88.438174,5660543.0,0.0124,60.55404,64.567057,3323773.0,2019-Q4,Small,Technology_Advertising_Media_and_Information_Small
2019,Q4,10.0,Phoenix,Norte  Chandler Corporate,Phoenix_South Tempe/Ahwatukee_Chandler_Norte  Chandler Corporate_4100 W Galveston St,4100 W Galveston St,West,Chandler,AZ,85226.0,South Tempe/Ahwatukee,O,8513.0,Analog Devices,"Technology, Advertising, Media, and Information",New,,9826257,New,Suburban,55988361.0,10641777.0,0.190227214384039,24.498675844971,27.7364464112614,10056770.0,0.0971,24.593467,27.928663,585007.0,0.0056,21.400237,23.377601,646125.0,2019-Q4,Small,Technology_Advertising_Media_and_Information_Small
2019,Q4,10.0,San Diego,,San Diego_Sorrento Mesa_San Diego_NA_9707 Waples St,9707 Waples St,West,San Diego,CA,92121.0,Sorrento Mesa,O,3000.0,Franklin Wireless Corp,"Technology, Advertising, Media, and Information",Renewal,,316920,,Suburban,33012845.0,5281374.0,0.159979365607539,32.8623292255891,36.5876164960694,4378204.0,0.0688,33.066693,37.216148,903170.0,0.0142,30.001255,31.122285,414273.0,2019-Q4,Small,Technology_Advertising_Media_and_Information_Small
2019,Q4,10.0,South Bay/San Jose,113 W Evelyn Ave,South Bay/San Jose_Sunnyvale/Cupertino_Sunnyvale_113 W Evelyn Ave_111 W Evelyn Ave,111 W Evelyn Ave,West,Sunnyvale,CA,94086.0,Sunnyvale/Cupertino,O,1208.0,Safebreach,"Technology, Advertising, Media, and Information",Renewal,,305202,,CBD,,,,,,,,,,,,,,,2019-Q4,Small,Technology_Advertising_Media_and_Information_Small
2019,Q4,11.0,Boston,,Boston_Seaport/South Boston_Boston_NA_285 Summer St,285 Summer St,Northeast,Boston,MA,2210.0,Seaport/South Boston,O,8476.0,Id Business Solutions Ltd,"Technology, Advertising, Media, and Information",Renewal,Boston/Suffolk County,222168,Relet,CBD,116276482.0,14720271.0,0.126597147994209,22.3951643265889,33.0167395469807,13070462.0,0.0517,21.908237,31.371338,1649809.0,0.0065,27.154443,40.463805,781094.0,2019-Q4,Small,Technology_Advertising_Media_and_Information_Small
2019,Q4,11.0,Manhattan,10 Grand Central,Manhattan_Grand Central_New York_10 Grand Central_155 E 44th St,155 E 44th St,Northeast,New York,NY,10017.0,Grand Central,A,9741.0,Zefr,"Technology, Advertising, Media, and Information",New,Midtown,157192,Relet,CBD,254558960.0,30535063.0,0.119952811717961,94.191224222457,84.7466627584618,23574628.0,0.0518,99.642941,88.438174,6960435.0,0.0153,66.071362,64.567057,9393220.0,2019-Q4,Small,Technology_Advertising_Media_and_Information_Small
2019,Q4,11.0,Manhattan,1519 W 39th St,Manhattan_Grand Central_New York_1519 W 39th St_15 W 39th St,15 W 39th St,Northeast,New York,NY,10018.0,Grand Central,O,9960.0,PIXACORE,"Technology, Advertising, Media, and Information",Renewal,Midtown,157693,Relet,CBD,200310172.0,19766988.0,0.0986818981913709,63.6588464465576,84.7466627584618,14106445.0,0.031,64.145123,88.438174,5660543.0,0.0124,60.55404,64.567057,3323773.0,2019-Q4,Small,Technology_Advertising_Media_and_Information_Small
2019,Q4,11.0,Manhattan,One World Trade Center,Manhattan_WTC/Brookfield Place_New York_One World Trade Center_One World Trade Center,One World Trade Center,Northeast,New York,NY,10007.0,WTC/Brookfield Place,A,10847.0,ASAPP,"Technology, Advertising, Media, and Information",Expansion,Downtown,1130742,Relet,CBD,254558960.0,30535063.0,0.119952811717961,94.191224222457,84.7466627584618,23574628.0,0.0518,99.642941,88.438174,6960435.0,0.0153,66.071362,64.567057,9393220.0,2019-Q4,Small,Technology_Advertising_Media_and_Information_Small
