year,quarter,monthsigned,market,building_name,building_id,address,region,city,state,zip,internal_submarket,internal_class,leasedSF,company_name,internal_industry,transaction_type,internal_market_cluster,costarID,space_type,CBD_suburban,RBA,available_space,availability_proportion,internal_class_rent,overall_rent,direct_available_space,direct_availability_proportion,direct_internal_class_rent,direct_overall_rent,sublet_available_space,sublet_availability_proportion,sublet_internal_class_rent,sublet_overall_rent,leasing,year-quarter,company_size,industry_size
2023,Q2,5.0,South Bay/San Jose,Phase I,South Bay/San Jose_Fremont (880 Corridor)_Fremont_Phase I_39300 Civic Center Dr,39300 Civic Center Dr,West,Fremont,CA,94538.0,Fremont (880 Corridor),O,1000.0,Sonata Software North America,"Technology, Advertising, Media, and Information",New,,326955,Relet,Suburban,,,,,,,,,,,,,,,2023-Q2,Small,Technology_Advertising_Media_and_Information_Small
2023,Q2,5.0,South Florida,1000 Waterford,South Florida_West Miami/Airport_Miami_1000 Waterford_1000 NW 57th Ct,1000 NW 57th Ct,South,Miami,FL,33126.0,West Miami/Airport,A,5836.0,The Mcclatchy,"Technology, Advertising, Media, and Information",New,Miami-Dade County,5689417,Relet,Suburban,54261809.0,11608290.0,0.213931127876699,48.241740809977,42.5248618108969,10012303.0,0.0953,48.961966,42.995651,1595987.0,0.0152,40.451922,36.377056,1018831.0,2023-Q2,Small,Technology_Advertising_Media_and_Information_Small
2023,Q2,6.0,Manhattan,26 Mercer,Manhattan_Soho_New York_26 Mercer_26 Mercer St,26 Mercer St,Northeast,New York,NY,10013.0,Soho,O,6772.0,FIVERR,"Technology, Advertising, Media, and Information",Relocation,Midtown South,160213,Sublet,CBD,200365520.0,39363274.0,0.196457324593573,62.7886729998808,77.6167126379485,30857922.0,0.066,65.696492,82.462611,8505352.0,0.0182,51.249825,60.971057,3173221.0,2023-Q2,Small,Technology_Advertising_Media_and_Information_Small
2023,Q2,6.0,Manhattan,950 3rd Ave,Manhattan_East Side / UN_New York_950 3rd Ave_950 Third Ave,950 Third Ave,Northeast,New York,NY,10022.0,East Side / UN,A,5451.0,Ninth Wave,"Technology, Advertising, Media, and Information",Relocation,Midtown,157238,Relet,CBD,267321980.0,52490528.0,0.19635694752822,86.9186202911424,77.6167126379485,39374327.0,0.0842,93.491861,82.462611,13116201.0,0.028,66.064437,60.971057,3717180.0,2023-Q2,Small,Technology_Advertising_Media_and_Information_Small
2024,Q2,3.0,Los Angeles,,Los Angeles_Westwood/West LA_Los Angeles_NA_3415 S Sepulveda Blvd,3415 S Sepulveda Blvd,West,Los Angeles,CA,90034.0,Westwood/West LA,A,9130.0,Love Productions,"Technology, Advertising, Media, and Information",Renewal,Westside,248243,Relet,CBD,148053040.0,42431501.0,0.286596621048781,49.2107534395837,46.8385278909253,34468474.0,0.1567,51.735397,48.836888,7963027.0,0.0362,38.255388,37.676806,2066191.0,2024-Q2,Small,Technology_Advertising_Media_and_Information_Small
2024,Q2,3.0,Manhattan,14461450 Broadway,Manhattan_Penn Plaza/Times Square South_New York_14461450 Broadway_1450 Broadway,1450 Broadway,Northeast,New York,NY,10018.0,Penn Plaza/Times Square South,O,10124.0,Iconix International,"Technology, Advertising, Media, and Information",Renewal,Midtown,157106,Relet,CBD,198703233.0,39963264.0,0.201120351172142,62.0443224895677,76.6259509200918,33139125.0,0.071,64.990536,81.800437,6824139.0,0.0146,46.897569,58.567878,2807110.0,2024-Q2,Small,Technology_Advertising_Media_and_Information_Small
2024,Q2,3.0,Manhattan,ColgatePalmolive Bldg,Manhattan_Plaza South_New York_ColgatePalmolive Bldg_300 Park Ave,300 Park Ave,Northeast,New York,NY,10022.0,Plaza South,A,5070.0,Triton International,"Technology, Advertising, Media, and Information",New,Midtown,157344,Relet,CBD,267787350.0,53537225.0,0.199924398968062,86.0903147571715,76.6259509200918,39664181.0,0.085,94.170351,81.800437,13873044.0,0.0297,63.282968,58.567878,5869995.0,2024-Q2,Small,Technology_Advertising_Media_and_Information_Small
2024,Q2,3.0,Northern New Jersey,Carnegie Center,Northern New Jersey_Princeton_Princeton_Carnegie Center_300 Carnegie Center Dr,300 Carnegie Center Dr,Northeast,Princeton,NJ,8540.0,Princeton,A,8154.0,Ul Solutions,"Technology, Advertising, Media, and Information",New,,5811267,Relet,Suburban,114586211.0,32040766.0,0.279621480808018,32.7557516577412,31.4765902519741,25377922.0,0.1688,33.412962,31.928076,6662844.0,0.0443,29.215098,28.684072,1331014.0,2024-Q2,Small,Technology_Advertising_Media_and_Information_Small
2024,Q2,3.0,San Diego,La Jolla Cove Research Center,San Diego_La Jolla_La Jolla_La Jolla Cove Research Center_505 Coast Blvd S,505 Coast Blvd S,West,La Jolla,CA,92037.0,La Jolla,O,284.0,Oath,"Technology, Advertising, Media, and Information",New,,314919,Relet,Suburban,31833704.0,4973447.0,0.156232118009265,33.8715905080621,41.4691127669684,4294545.0,0.0668,34.329892,42.62223,678902.0,0.0106,30.912268,35.855324,373744.0,2024-Q2,Small,Technology_Advertising_Media_and_Information_Small
2024,Q2,4.0,Atlanta,Interlock Tower,Atlanta_Midtown_Atlanta_Interlock Tower_1042 Northside Dr NW,1042 Northside Dr NW,South,Atlanta,GA,30318.0,Midtown,A,4956.0,Trevelino/Keller,"Technology, Advertising, Media, and Information",Relocation,,11409712,,CBD,113175903.0,39198751.0,0.346352447481687,35.0583055064288,32.6147217616091,32781931.0,0.1843,36.249103,33.803635,6416820.0,0.0361,28.435283,26.307451,2244642.0,2024-Q2,Small,Technology_Advertising_Media_and_Information_Small
2024,Q2,4.0,Chicago Suburbs,Buffalo Grove Bus Prk I,Chicago Suburbs_North Corridor_Buffalo Grove_Buffalo Grove Bus Prk I_1110 Lake Cook Rd,1110 Lake Cook Rd,Midwest/Central,Buffalo Grove,IL,60089.0,North Corridor,O,2809.0,Hodgson Consulting & Solutions,"Technology, Advertising, Media, and Information",New,,209657,Relet,Suburban,44426340.0,12065882.0,0.271592978399751,22.2891381939009,27.3620107521311,11428613.0,0.118,22.438827,27.779732,637269.0,0.0066,18.295675,19.465606,389084.0,2024-Q2,Small,Technology_Advertising_Media_and_Information_Small
2024,Q2,4.0,Los Angeles,Maple Plaza,Los Angeles_Beverly Hills_Beverly Hills_Maple Plaza_345 N Maple Dr,345 N Maple Dr,West,Beverly Hills,CA,90210.0,Beverly Hills,A,6302.0,Tomorrow Itv Studios,"Technology, Advertising, Media, and Information",Renewal,Westside,248261,Relet,CBD,148053040.0,42431501.0,0.286596621048781,49.2107534395837,46.8385278909253,34468474.0,0.1567,51.735397,48.836888,7963027.0,0.0362,38.255388,37.676806,2066191.0,2024-Q2,Small,Technology_Advertising_Media_and_Information_Small
2024,Q2,4.0,Manhattan,320 W 13th St,Manhattan_Greenwich Village_New York_320 W 13th St_2 Gansevoort St,2 Gansevoort St,Northeast,New York,NY,10014.0,Greenwich Village,A,10000.0,Kobalt Music,"Technology, Advertising, Media, and Information",Restructure,Midtown South,158343,New,CBD,267787350.0,53537225.0,0.199924398968062,86.0903147571715,76.6259509200918,39664181.0,0.085,94.170351,81.800437,13873044.0,0.0297,63.282968,58.567878,5869995.0,2024-Q2,Small,Technology_Advertising_Media_and_Information_Small
2024,Q2,4.0,Manhattan,921925 Broadway,Manhattan_Union Square_New York_921925 Broadway_149 Fifth Ave,149 Fifth Ave,Northeast,New York,NY,10010.0,Union Square,O,11238.0,Sound Lounge,"Technology, Advertising, Media, and Information",Renewal,Midtown South,157689,Relet,CBD,198703233.0,39963264.0,0.201120351172142,62.0443224895677,76.6259509200918,33139125.0,0.071,64.990536,81.800437,6824139.0,0.0146,46.897569,58.567878,2807110.0,2024-Q2,Small,Technology_Advertising_Media_and_Information_Small
2024,Q2,4.0,Manhattan,,Manhattan_Flatiron_New York_NA_19-21 W 24th St,19-21 W 24th St,Northeast,New York,NY,10010.0,Flatiron,O,5418.0,Alethea,"Technology, Advertising, Media, and Information",New,Midtown South,157992,Sublet,CBD,198703233.0,39963264.0,0.201120351172142,62.0443224895677,76.6259509200918,33139125.0,0.071,64.990536,81.800437,6824139.0,0.0146,46.897569,58.567878,2807110.0,2024-Q2,Small,Technology_Advertising_Media_and_Information_Small
2024,Q2,4.0,Manhattan,,Manhattan_Flatiron_New York_NA_27 W 24th St,27 W 24th St,Northeast,New York,NY,10010.0,Flatiron,O,5401.0,Omaha Productions,"Technology, Advertising, Media, and Information",New,Midtown South,158204,Sublet,CBD,198703233.0,39963264.0,0.201120351172142,62.0443224895677,76.6259509200918,33139125.0,0.071,64.990536,81.800437,6824139.0,0.0146,46.897569,58.567878,2807110.0,2024-Q2,Small,Technology_Advertising_Media_and_Information_Small
2024,Q2,4.0,Nashville,Cool Springs III,Nashville_Cool Springs_Franklin_Cool Springs III_725 Cool Springs Blvd,725 Cool Springs Blvd,South,Franklin,TN,37067.0,Cool Springs,A,3819.0,Xgenisys,"Technology, Advertising, Media, and Information",New,South Nashville,1012731,,Suburban,26791624.0,6418033.0,0.23955371275739,37.1725470468682,34.4029769124653,5298908.0,0.1074,38.056167,34.982836,1119125.0,0.0227,32.737761,31.166408,560969.0,2024-Q2,Small,Technology_Advertising_Media_and_Information_Small
2024,Q2,4.0,Northern Virginia,Crystal  Clark,Northern Virginia_National Landing_Arlington_Crystal  Clark_2450 Crystal Dr,2450 Crystal Dr,Northeast,Arlington,VA,22202.0,National Landing,O,10807.0,Crowdstrike,"Technology, Advertising, Media, and Information",Renewal,Arlington County,137337,Relet,Suburban,47372726.0,9289493.0,0.1960936974579,32.425136381763,35.2572608740939,8678759.0,0.0577,32.858142,35.86277,610734.0,0.0041,26.008875,30.585632,368468.0,2024-Q2,Small,Technology_Advertising_Media_and_Information_Small
2024,Q2,4.0,San Diego,Bldg 2,San Diego_I-15 Corridor_San Diego_Bldg 2_13500 Evening Creek Dr N,13500 Evening Creek Dr N,West,San Diego,CA,92128.0,I-15 Corridor,A,3472.0,Willow,"Technology, Advertising, Media, and Information",New,,601357,Relet,Suburban,32442692.0,8497695.0,0.261929404625239,45.8807516969865,41.4691127669684,6867906.0,0.1068,47.779105,42.62223,1629789.0,0.0254,37.865377,35.855324,491144.0,2024-Q2,Small,Technology_Advertising_Media_and_Information_Small
2024,Q2,4.0,South Bay/San Jose,,South Bay/San Jose_Downtown San Jose_San Jose_NA_160 W Santa Clara St,160 W Santa Clara St,West,San Jose,CA,95113.0,Downtown San Jose,A,1834.0,Hume.ai,"Technology, Advertising, Media, and Information",New,,309656,Relet,CBD,,,,,,,,,,,,,,,2024-Q2,Small,Technology_Advertising_Media_and_Information_Small
2024,Q2,5.0,Boston,,Boston_Seaport/South Boston_Boston_NA_320 Congress St,320 Congress St,Northeast,Boston,MA,2210.0,Seaport/South Boston,O,4249.0,One Door,"Technology, Advertising, Media, and Information",New,Boston/Suffolk County,222400,,CBD,115964278.0,18471574.0,0.159286758979347,32.8303864586869,47.9903732537181,15072319.0,0.0565,32.631952,49.388691,3399255.0,0.0127,33.796474,40.094155,617287.0,2024-Q2,Small,Technology_Advertising_Media_and_Information_Small
2024,Q2,5.0,Boston,,Boston_Route 128 West_Waltham_NA_930 Winter St,930 Winter St,Northeast,Waltham,MA,2451.0,Route 128 West,A,10000.0,Qliktech International,"Technology, Advertising, Media, and Information",Renewal,Route 128 Corridor,688048,,Suburban,150846043.0,35446338.0,0.234983545441759,56.6276814988861,47.9903732537181,25614042.0,0.096,58.588263,49.388691,9832296.0,0.0369,44.490656,40.094155,1050068.0,2024-Q2,Small,Technology_Advertising_Media_and_Information_Small
2024,Q2,5.0,Denver,700 17th St,Denver_Central Business District_Denver_700 17th St_700 17th St,700 17th St,Midwest/Central,Denver,CO,80202.0,Central Business District,A,2345.0,AIQUIRE,"Technology, Advertising, Media, and Information",Renewal,Downtown Denver,393834,Relet,CBD,,,,,,,,,,,,,,,2024-Q2,Small,Technology_Advertising_Media_and_Information_Small
2024,Q2,5.0,Denver,Elevate,Denver_Colorado Blvd / I-25_Glendale_Elevate_4100 E Mississippi Ave,4100 E Mississippi Ave,Midwest/Central,Glendale,CO,80246.0,Colorado Blvd / I-25,A,2552.0,Delightree,"Technology, Advertising, Media, and Information",New,,393684,New,Suburban,,,,,,,,,,,,,,,2024-Q2,Small,Technology_Advertising_Media_and_Information_Small
2024,Q2,5.0,Houston,Energy Center I,Houston_Katy Freeway/Energy Corridor_Houston_Energy Center I_585 N Dairy Ashford Rd,585 N Dairy Ashford Rd,South,Houston,TX,77079.0,Katy Freeway/Energy Corridor,A,7265.0,Samsung,"Technology, Advertising, Media, and Information",New,,236321,,Suburban,117823966.0,36853620.0,0.312785431106605,36.7731442685278,31.8158165925787,32779438.0,0.1672,37.331674,32.328914,4074182.0,0.0208,28.10854,23.873878,1588147.0,2024-Q2,Small,Technology_Advertising_Media_and_Information_Small
2024,Q2,5.0,Los Angeles,101,Los Angeles_El Segundo_El Segundo_101_101 Pacific Coast Hwy,101 Pacific Coast Hwy,West,El Segundo,CA,90245.0,El Segundo,O,10996.0,Dti Services,"Technology, Advertising, Media, and Information",Renewal,South Bay Area,246779,Relet,CBD,71892724.0,17808582.0,0.247710491537363,41.1858725402631,46.8385278909253,14965001.0,0.068,42.158804,48.836888,2843581.0,0.0129,36.057582,37.676806,726726.0,2024-Q2,Small,Technology_Advertising_Media_and_Information_Small
2024,Q2,5.0,Los Angeles,,Los Angeles_Burbank_Burbank_NA_300 E Magnolia Blvd,300 E Magnolia Blvd,West,Burbank,CA,91502.0,Burbank,O,10826.0,Unity Technologies,"Technology, Advertising, Media, and Information",New,Tri-Cities,248090,Sublet,CBD,71892724.0,17808582.0,0.247710491537363,41.1858725402631,46.8385278909253,14965001.0,0.068,42.158804,48.836888,2843581.0,0.0129,36.057582,37.676806,726726.0,2024-Q2,Small,Technology_Advertising_Media_and_Information_Small
2024,Q2,5.0,Manhattan,1 Trinity Centre,Manhattan_WTC/Brookfield Place_New York_1 Trinity Centre_111 Broadway,111 Broadway,Northeast,New York,NY,10006.0,WTC/Brookfield Place,O,500.0,Solutionflows,"Technology, Advertising, Media, and Information",New,Downtown,157451,Relet,CBD,198703233.0,39963264.0,0.201120351172142,62.0443224895677,76.6259509200918,33139125.0,0.071,64.990536,81.800437,6824139.0,0.0146,46.897569,58.567878,2807110.0,2024-Q2,Small,Technology_Advertising_Media_and_Information_Small
2024,Q2,5.0,Manhattan,192 Mercer St,Manhattan_Greenwich Village_New York_192 Mercer St_625 Broadway,625 Broadway,Northeast,New York,NY,10012.0,Greenwich Village,O,8085.0,Frontify,"Technology, Advertising, Media, and Information",Relocation,Midtown South,158146,Relet,CBD,198703233.0,39963264.0,0.201120351172142,62.0443224895677,76.6259509200918,33139125.0,0.071,64.990536,81.800437,6824139.0,0.0146,46.897569,58.567878,2807110.0,2024-Q2,Small,Technology_Advertising_Media_and_Information_Small
2024,Q2,5.0,Manhattan,24 Mercer St,Manhattan_Soho_New York_24 Mercer St_447 Broadway,447 Broadway,Northeast,New York,NY,10013.0,Soho,O,6000.0,Lipman Studio,"Technology, Advertising, Media, and Information",Relocation,Midtown South,161039,Relet,CBD,198703233.0,39963264.0,0.201120351172142,62.0443224895677,76.6259509200918,33139125.0,0.071,64.990536,81.800437,6824139.0,0.0146,46.897569,58.567878,2807110.0,2024-Q2,Small,Technology_Advertising_Media_and_Information_Small
2024,Q2,5.0,Manhattan,301309 35th St,Manhattan_Penn Plaza/Times Square South_New York_301309 35th St_505 Eighth Ave,505 Eighth Ave,Northeast,New York,NY,10018.0,Penn Plaza/Times Square South,O,5009.0,Mesmerize,"Technology, Advertising, Media, and Information",Renewal,Midtown,157349,Relet,CBD,198703233.0,39963264.0,0.201120351172142,62.0443224895677,76.6259509200918,33139125.0,0.071,64.990536,81.800437,6824139.0,0.0146,46.897569,58.567878,2807110.0,2024-Q2,Small,Technology_Advertising_Media_and_Information_Small
2024,Q2,5.0,Manhattan,4854 E 12th St,Manhattan_Greenwich Village_New York_4854 E 12th St_817 Broadway,817 Broadway,Northeast,New York,NY,10003.0,Greenwich Village,A,9943.0,Splice,"Technology, Advertising, Media, and Information",Relocation,Midtown South,157804,Relet,CBD,267787350.0,53537225.0,0.199924398968062,86.0903147571715,76.6259509200918,39664181.0,0.085,94.170351,81.800437,13873044.0,0.0297,63.282968,58.567878,5869995.0,2024-Q2,Small,Technology_Advertising_Media_and_Information_Small
2024,Q2,5.0,Manhattan,74 Trinity Pl,Manhattan_WTC/Brookfield Place_New York_74 Trinity Pl_107 Greenwich St,107 Greenwich St,Northeast,New York,NY,10006.0,WTC/Brookfield Place,A,10108.0,Puck,"Technology, Advertising, Media, and Information",New,Downtown,11072598,Relet,CBD,267787350.0,53537225.0,0.199924398968062,86.0903147571715,76.6259509200918,39664181.0,0.085,94.170351,81.800437,13873044.0,0.0297,63.282968,58.567878,5869995.0,2024-Q2,Small,Technology_Advertising_Media_and_Information_Small
2024,Q2,5.0,Philadelphia,Horizon Corporate Center  20000 Horizon Way,Philadelphia_Burlington County_Mount Laurel_Horizon Corporate Center  20000 Horizon Way_20000 Horizon Way,20000 Horizon Way,Northeast,Mount Laurel,NJ,8054.0,Burlington County,O,3453.0,Telamerica,"Technology, Advertising, Media, and Information",Renewal,,244337,,Suburban,44794487.0,9748985.0,0.217638054432904,28.3854169905413,32.1924140675547,8407264.0,0.0639,28.930456,32.772904,1341721.0,0.0102,23.916744,27.551989,206143.0,2024-Q2,Small,Technology_Advertising_Media_and_Information_Small
2024,Q2,5.0,Philadelphia,,Philadelphia_Lansdale_Lansdale_NA_100 W Main St,100 W Main St,Northeast,Lansdale,PA,19446.0,Lansdale,O,2258.0,Netmedia Solutions,"Technology, Advertising, Media, and Information",New,,297569,Relet,Suburban,44794487.0,9748985.0,0.217638054432904,28.3854169905413,32.1924140675547,8407264.0,0.0639,28.930456,32.772904,1341721.0,0.0102,23.916744,27.551989,206143.0,2024-Q2,Small,Technology_Advertising_Media_and_Information_Small
2024,Q2,5.0,South Bay/San Jose,Tower 2,South Bay/San Jose_Campbell/Los Gatos_Campbell_Tower 2_910 E Hamilton Ave,910 E Hamilton Ave,West,Campbell,CA,95008.0,Campbell/Los Gatos,O,9932.0,UTIMACO,"Technology, Advertising, Media, and Information",New,,310769,Relet,Suburban,,,,,,,,,,,,,,,2024-Q2,Small,Technology_Advertising_Media_and_Information_Small
2024,Q2,5.0,Washington D.C.,District Center,Washington D.C._East End_Washington_District Center_555 12th St NW,555 12th St NW,Northeast,Washington,DC,20004.0,East End,A,11151.0,Credence Management Solutions,"Technology, Advertising, Media, and Information",Expansion,,129861,Relet,CBD,,,,,,,,,,,,,,,2024-Q2,Small,Technology_Advertising_Media_and_Information_Small
2024,Q2,6.0,Chicago,,Chicago_West Loop_Chicago_NA_150 N Wacker Dr,150 N Wacker Dr,Midwest/Central,Chicago,IL,60606.0,West Loop,O,2070.0,Outbrain,"Technology, Advertising, Media, and Information",New,,144357,,CBD,,,,,,,,,,,,,,,2024-Q2,Small,Technology_Advertising_Media_and_Information_Small
2024,Q2,6.0,Chicago Suburbs,Highland Atrium,Chicago Suburbs_East-West Corridor_Downers Grove_Highland Atrium_1101 W 31st St,1101 W 31st St,Midwest/Central,Downers Grove,IL,60515.0,East-West Corridor,O,10000.0,Aqueity,"Technology, Advertising, Media, and Information",Relocation,,204589,,Suburban,44426340.0,12065882.0,0.271592978399751,22.2891381939009,27.3620107521311,11428613.0,0.118,22.438827,27.779732,637269.0,0.0066,18.295675,19.465606,389084.0,2024-Q2,Small,Technology_Advertising_Media_and_Information_Small
2024,Q2,6.0,Detroit,,Detroit_Southfield_Southfield_NA_3000 Town Center,3000 Town Center,Midwest/Central,Southfield,MI,48075.0,Southfield,A,3934.0,Netapp,"Technology, Advertising, Media, and Information",TBD,Suburban Detroit,455741,Relet,Suburban,36621501.0,9453054.0,0.258128524005611,24.0132090964122,21.8355579030725,8185040.0,0.0968,24.420782,22.225199,1268014.0,0.015,18.908594,17.407312,526413.0,2024-Q2,Small,Technology_Advertising_Media_and_Information_Small
2024,Q2,6.0,Los Angeles,Dick Clark Productions Building,Los Angeles_Burbank_Burbank_Dick Clark Productions Building_3003 W Olive Ave,3003 W Olive Ave,West,Burbank,CA,91505.0,Burbank,O,7143.0,Starburns Industries,"Technology, Advertising, Media, and Information",Relocation,Tri-Cities,248101,Sublet,CBD,71892724.0,17808582.0,0.247710491537363,41.1858725402631,46.8385278909253,14965001.0,0.068,42.158804,48.836888,2843581.0,0.0129,36.057582,37.676806,726726.0,2024-Q2,Small,Technology_Advertising_Media_and_Information_Small
2024,Q2,6.0,Manhattan,Nomad Tower,Manhattan_Penn Plaza/Times Square South_New York_Nomad Tower_1250 Broadway,1250 Broadway,Northeast,New York,NY,10001.0,Penn Plaza/Times Square South,A,9270.0,Datavant,"Technology, Advertising, Media, and Information",New,Midtown,157146,Relet,CBD,267787350.0,53537225.0,0.199924398968062,86.0903147571715,76.6259509200918,39664181.0,0.085,94.170351,81.800437,13873044.0,0.0297,63.282968,58.567878,5869995.0,2024-Q2,Small,Technology_Advertising_Media_and_Information_Small
2024,Q2,6.0,Manhattan,One Penn Plaza,Manhattan_Penn Plaza/Times Square South_New York_One Penn Plaza_PENN 1,PENN 1,Northeast,New York,NY,10119.0,Penn Plaza/Times Square South,A,4085.0,Datacamp,"Technology, Advertising, Media, and Information",New,Midtown,157037,Relet,CBD,267787350.0,53537225.0,0.199924398968062,86.0903147571715,76.6259509200918,39664181.0,0.085,94.170351,81.800437,13873044.0,0.0297,63.282968,58.567878,5869995.0,2024-Q2,Small,Technology_Advertising_Media_and_Information_Small
2024,Q2,6.0,Manhattan,One World Trade Center,Manhattan_WTC/Brookfield Place_New York_One World Trade Center_One World Trade Center,One World Trade Center,Northeast,New York,NY,10007.0,WTC/Brookfield Place,A,6557.0,Studio 71,"Technology, Advertising, Media, and Information",New,Downtown,1130742,Relet,CBD,267787350.0,53537225.0,0.199924398968062,86.0903147571715,76.6259509200918,39664181.0,0.085,94.170351,81.800437,13873044.0,0.0297,63.282968,58.567878,5869995.0,2024-Q2,Small,Technology_Advertising_Media_and_Information_Small
2024,Q2,6.0,Seattle,,Seattle_Eastside_Kirkland_NA_550 Kirkland Way,550 Kirkland Way,West,Kirkland,WA,98033.0,Eastside,A,3943.0,Censys,"Technology, Advertising, Media, and Information",New,,470119,,Suburban,71749675.0,21182133.0,0.295222703099352,51.4530498925043,46.0959935640364,16802454.0,0.1356,53.996489,47.639411,4379679.0,0.0353,38.994395,37.552424,1325199.0,2024-Q2,Small,Technology_Advertising_Media_and_Information_Small
2018,Q3,6.0,Boston,,Boston_Seaport/South Boston_Boston_NA_11 Elkins St,11 Elkins St,Northeast,Boston,MA,2127.0,Seaport/South Boston,O,1300.0,360 Branding & Comms,"Technology, Advertising, Media, and Information",Renewal,Boston/Suffolk County,5861085,Relet,CBD,116186937.0,15204502.0,0.130862404953493,21.9502817389666,31.3996394787049,,,,,,,,,1189301.0,2018-Q3,Small,Technology_Advertising_Media_and_Information_Small
2018,Q3,6.0,Boston,,Boston_Route 495/Mass Pike West_Westborough_NA_134 Flanders Rd,134 Flanders Rd,Northeast,Westborough,MA,1581.0,Route 495/Mass Pike West,O,2698.0,Sba Communications,"Technology, Advertising, Media, and Information",Renewal,Route 495 Corridor,221388,Relet,Suburban,116186937.0,15204502.0,0.130862404953493,21.9502817389666,31.3996394787049,,,,,,,,,1189301.0,2018-Q3,Small,Technology_Advertising_Media_and_Information_Small
2018,Q3,6.0,Houston,Park Towers North,Houston_West Loop/Galleria_Houston_Park Towers North_1233 West Loop S,1233 West Loop S,South,Houston,TX,77027.0,West Loop/Galleria,A,10000.0,Pierpont Communications,"Technology, Advertising, Media, and Information",New,,234030,Relet,Suburban,114154896.0,31590818.0,0.276736426618093,33.4397149273622,28.5122604771179,,,,,,,,,2858821.0,2018-Q3,Small,Technology_Advertising_Media_and_Information_Small
2018,Q3,6.0,Los Angeles,,Los Angeles_Central San Fernando Valley_Van Nuys_NA_5900 Sepulveda Blvd,5900 Sepulveda Blvd,West,Van Nuys,CA,91411.0,Central San Fernando Valley,O,1500.0,Membership Management Svc,"Technology, Advertising, Media, and Information",New,San Fernando Valley,27154,Relet,Suburban,69043674.0,13067672.0,0.189266753098915,35.1455829037211,39.4800003545481,,,,,,,,,888703.0,2018-Q3,Small,Technology_Advertising_Media_and_Information_Small
2018,Q3,6.0,Northern Virginia,,Northern Virginia_Reston / Herndon_Herndon_NA_2121 Cooperative Way,2121 Cooperative Way,Northeast,Herndon,VA,20171.0,Reston / Herndon,A,4060.0,Cascades Technologies,"Technology, Advertising, Media, and Information",Renewal,Fairfax County,136827,Relet,Suburban,98785668.0,22604095.0,0.228819579374611,34.8123431501444,32.8066892814417,,,,,,,,,1484098.0,2018-Q3,Small,Technology_Advertising_Media_and_Information_Small
2018,Q3,6.0,San Francisco,644 Mission St,San Francisco_Financial District South_San Francisco_644 Mission St_90 New Montgomery St,90 New Montgomery St,West,San Francisco,CA,94105.0,Financial District South,A,9079.0,Sigma Computing,"Technology, Advertising, Media, and Information",New,,320759,Relet,CBD,46800865.0,3801901.0,0.0812356993829067,73.7020036886353,70.5694017665314,,,,,,,,,1381643.0,2018-Q3,Small,Technology_Advertising_Media_and_Information_Small
2018,Q3,6.0,South Bay/San Jose,2099 Gateway,South Bay/San Jose_North San Jose_San Jose_2099 Gateway_2099 Gateway Pl,2099 Gateway Pl,West,San Jose,CA,95110.0,North San Jose,A,2340.0,Zentera Systems,"Technology, Advertising, Media, and Information",Renewal,,305964,,Suburban,,,,,,,,,,,,,,,2018-Q3,Small,Technology_Advertising_Media_and_Information_Small
2018,Q3,6.0,Washington D.C.,The Esplanade,Washington D.C._Central Business District_Washington_The Esplanade_1990 K St NW,1990 K St NW,Northeast,Washington,DC,20006.0,Central Business District,O,5476.0,Wpfw-Fm 89.9 Fm,"Technology, Advertising, Media, and Information",Renewal,,122998,Relet,CBD,,,,,,,,,,,,,,,2018-Q3,Small,Technology_Advertising_Media_and_Information_Small
2018,Q3,7.0,Atlanta,NorthWinds VI,Atlanta_North Fulton_Alpharetta_NorthWinds VI_11675 Rainwater Dr,11675 Rainwater Dr,South,Alpharetta,GA,30009.0,North Fulton,A,3600.0,Red House Atlanta,"Technology, Advertising, Media, and Information",New,,89157,Relet,Suburban,103659328.0,22206503.0,0.214225805129665,29.5072586063214,26.3933334340637,,,,,,,,,1929820.0,2018-Q3,Small,Technology_Advertising_Media_and_Information_Small
2018,Q3,7.0,Chicago,,Chicago_River North_Chicago_NA_363 W Erie St,363 W Erie St,Midwest/Central,Chicago,IL,60654.0,River North,O,10150.0,Level Ex,"Technology, Advertising, Media, and Information",Renewal,,144698,Relet,CBD,,,,,,,,,,,,,,,2018-Q3,Small,Technology_Advertising_Media_and_Information_Small
